eng,sd
East Khasi Hills,ओभर खासी हिल्स
Chakchaka Icds Project Sorbhog,छाकछाका आई. सी. डि. ऐस. प्रोजेक्ट
EGRA-II ICDS PROJECT,EGRA-II आई. सी. डी. ऐस. प्रोजेक्ट
Mirzapur City 1,मीर्जापुर शहरी 1
Measles Containing vaccine (MCV)/MR-2JE-2**DiphtheriaPertussis & Tetanus (DPT)-Booster-1OPV –Booster,मिसलेस कनटेनिंग वेक्सिन (MCV)/MR-2JE-2**डिप्थीरियापरटयुसिस एंड टिटनस (DPT)-बूस्टर-1OPV -बूस्टर
The Poshan Tracker enables real-time monitoring and tracking of all AWCs and beneficiaries on defined indicators.,पोषण टे्कर कंदो आ रियल टाइम मानिटरिंग आऊं ट्रेकिंग सभीन AWCs आऊं लाभकारी मनयो वेंदो आ।
It is built using centralized data architecture that also aligns with the digital technology systems of other ministries and programs.,इयो गायों व्यो आ डेटा खे ईक्कठो करे देखो डिजिटल टेक्नोलॉजी सिस्टम आऊं नये फिचरन मिनिस्टर आऊं प्रोग्राम सा ठयल आ।
"The objective is to provide a 360-degree view of the activities of the Anganwadi Centre (AWC), service deliveries of Anganwadi Workers (AWWs) and complete beneficiary management for pregnant women, lactating mothers and children.","हिनजो मकसद आंगनवाडी केंद्र (AWC) जा कम्मअ, आंगनवाडी वरकरन (AWW) जीं सेवा पहुँचायण आऊं पेटवारी माईयूं, दुक्कअ डेयण वारी माऊं आऊं बारन जे लाये मुकम्मल फायदे जो बंदोबस्त करण लाये कम करण जो 360-डिग्री नजरियो डीअन्दो आहे।"
The public dashboard helps to impart transparency on services delivered to beneficiaries,पब्लिक डैशबोर्ड हितभागिण खे डी वणन वारी सेवाउण में ट्रांसपेरेंसी खणी अचण में मदद कंदो आहे
Translations on the Poshan Tracker Portal & App Chabot are done by third party translators.,पोषण ट्रैकर पोर्टल आऊं ऐप चाबोट ते अनुवाद ट्रीं दुरी जा अनुवादक कंदा।
"While the translations are done on a best effort basis, some of the parts may be incorrect.","जेडी मैल अनुवाद बेहतरीन कोशिश जे आधार ते किया वेंदा आहेन, कोई कोई भाग गलत थी सिगंदा आहेन।"
Certain files and other items on the website cannot be translated.,वेबसाइट ते कुछ फाइल आऊं बी शयाइन जो अनुवाद न थी सिगंदो आहे।
"In addition, on translation, some applications and/or services may not function as expected, due to language barriers.","हिनजे अलावा, अनुवाद ते, कुछ एप्लिकेशन आऊं /या सेवाउन भाषा जी तकलीफुन जी वजह सां अपेक्षित रूप सां कम् न थी सगंदो आहे।"
"We are working constantly to rectify any errors, omissions, or ambiguities in the translations provided on this portal.","अस्सां हिन्ह पोर्टल ते मिलंदड जे लाये अनुवादन में केडी भि गलती, चूक या अस्पष्टता खे सुधारन जे लाये लगातार कम कयूं ता।"
AWH Position Filled,AWH पद भरी वयो
"The MGRS collected primary growth data and related information from approximately 8500 children from widely different ethnic backgrounds and cultural settings (Brazil, Ghana, India, Norway, Oman and the USA)","MGRS इकट्ठा कंदो आ प्राइमरी ग्रोथ डेटा आऊं उनका संबंधि जानकारयु आसपास 8500 बारण जा देखा अलग अलग तरीके सा पलयल आऊं रहते वारा आएन (ब्राजीलl, घाना, इंडिया, नोरवे, ओमन आऊं USA)"
Ratua - I Addl.,रातुआ - I धार
Please enter Height,किरपा लम्बाई भरयो
Harda Gramin 2,हरदा गो॒ठाणो 2
Children of different age groups are monitored on monthly basis by AWWs.,AWW द्वारा अलग अलग उम्र जे बारन जी महीने दर महीने जांच की वेंदी।
"Health indicators like Stunting, Wasting and Underweight prevalence are measured as per WHO standards.","स्टंटिंग, वेस्टिंग आऊं गट्ठ वजन हुजण, इह सिहत जा लच्छण खे डब्ल्यूएचओ जे मअयारिन जे हीसाब सां माप्यो वेंदो आहे।"
Regular growth monitoring helps AWWs to provide relevant and timely assistance to children,टाइम टाइम जी जांच AWW जे कम् कंदननङ खे बारन जी सही आऊं सही टाइम ते मदद करण में कम् में ईअन्दी आहे
"Awareness for Children Stunting, Wasting to prevent malnutrition in children","जागरूकता बारण मे कुपोषण, स्टंट,विनयाण खा बचण लाए"
Create a New Ticket,नई टिकेट ठाहयो
"The Site and all data, text, designs, pages, print screens, images, artwork, photographs, audio and video clips, HTML code, source code, or software that reside or are viewable or otherwise discoverable on the Site, and all participants booked from the Site, (collectively, termed as the “Content”) are owned by Ministry of Women and Child Development and their authorised service providers.","चित्र,कलाकत्रीयु,तस्वीर,आडियो आऊं विडियो क्लिप,HTML कोड, स्त्रोत कोड या साफ्टवेयर देखो साइट ते रयीनदो आ,या खोजें भी सिंघउता,आऊं सभी प्रतिभागि साइट ता चुनयावेनदा,महिलाउ आऊं बार विकास मंत्रालय आऊं हुनजे अधिकरत सेवा प्रदाता जे हाजिर मे आयुं।"
Jaleswar Icds Project,जलेश्वर आई. सी. डि. ऐस. प्रोजेक्ट
Poshan Tracker adds new application features,पोशॉन ट्रेकर गंढी आहे नई ऐपलिकेशन कारगुजारी
Making or Updating Home Visit Planner and Initiating home visits,होम विजिट प्लानर ठायण या अपडेट करण आऊं होम विजिट शुरू करण
Uraiyur    Project-1,उरआयूर प्रोजेक्ट-1
Poshan Calculator is designed to measure growth of the child based on standards defined by World Health Organization (WHO),पोषण कैलकुलेटर खे विश्व स्वास्थ्य संगठन (डब्ल्यूएचओ) जे सबब सां वस्फ पैमाइशअ जी बुनियाद ते बारण जी वाध खे मापण जे लाये डिजाइन कायो वयो आहे
Asthampatti (Sal Pro 1),असथामपाट्टी (साल प्रो 1)
Migrated from one category to another,बिक विभाग खां बे॒ ते लडणु
Icds Parappa Additional, आइ. सी. डी. ऐस. पाराप्पा ऐडिशनल
Binpur - I Adl.,बीनपुर - I धार
Wasting (Weight for Height)-,विनयाएण (वजन लम्बाई लाए)-
Soreng Rural Project,सोरेंग गो॒ठाणी प्रोजेक्ट
It usually occurs when a person has not had food of adequate quality and quantity and/or they have had frequent or prolonged illnesses,इयो तेमल थीनदो आ जेमल माणु वठ सुठी तरह सा रोटी न हुजे आऊं/या माणु चंगे टाईम खा केडि बिमारी खा गुजर दो हुजे
Dinhata - I Addl,दीनहाटा - I धार
Mohgaon - R,मोहगाउं - आर
Malnutrition is one of the most important challenges facing contemporary India.,हम असर भारत जिन अहम ललकारूनु खे मुंह दे॒इ रह्यो आहे उन्ह्नुमां कुपोषण हिक आहे.
Nutrition is acknowledged as central to the achievement of National and Global Sustainable Development Goals.,"पोषण खे, राष्ट्रीय एं आलमी पायेदार तरकीअ जे मकसदनु खे हासिल करण जे लाये मुख्य ग॒णयो वेंदों आहे."
"Optimum and appropriate nutrition is essential for women and children to survive, thrive and break the intergenerational cycle of poor health and poverty in the community.","मायनुं एं बारनु खे बिरादरीअ में बचण, वधण वीझण एं कमजोर सिहत एं गरीबीअ जी बिन अलाकुमी सिरिशते खे टोडण जे लाये सही एं मुकमल पोषण जरूरी आहे."
"The underlying causes of malnutrition that results in undersized children and adults, are multifaceted and rooted in economic and social factors such as poverty, low levels of female literacy, lack of access to clean drinking water, sanitation and hygiene, maternal characteristics, inadequate curative and preventive health care, maternal, household and community resources and women empowerment.","कुपोषण जा लिकियल कारण जहिं जे करे घट कद वारा बार एं नौजवान घणा आहिन एं आर्थिक एं सामाजिक सबबनु ते असर कन था, जियें त गरीबी, मायूँनु में तालीम जो घट सतह, पीयण जे साफ पाणीअ ताईं पहुँच में कमी, सफाई एं इल्म तंदुरुस्ती, मादरी खासियतूँ, घट इलाज एं बचाउ चिकित्सा, घरेलू एं  बिरादरी में मादरी जा वसीला एं मायूँनु जी बा-इख्तियारी"
Check Ticket Status,टिकेट जी स्थिति खे जाचण
Panskura- II ICDS,पांशकुडा- II आई. सी. डी. ऐस.
"Poshan Abhiyaan is India’s flagship programme to improve nutritional outcomes for children, adolescents, pregnant women and lactating mothers by leveraging technology, a targeted approach and convergence.","बारनु, नौजवाननु , गर्भ वंतयूनु जे खोराकी नतीजन खे सुधारण जे लाए, पोषण अभियान भारत जो मुख्य प्रोग्राम आहे."
Reference data not available.,संदर्भ डेटा उपलब्ध काने।
Hot Cooked Meal (HCM) given in last 30 days,पोंयनु 30 दीं॒हनु में दि॒नल गरम रधलु खाधो (HCM)
English Bazar Adl,अंग्रेजी बजार धार
"Dhalpukhuri Icds Project, Hojai.","धालपुकारी आई. सी. डि. ऐस. प्रोजेक्ट, होजय"
Underweight (Weight for Age)-,घट वजन(वजन उम्र लाए)-
Uploading of Data of Anganwadi Services Schemes in Poshan Tracker,डेटा विजण आंगनवाडी सर्विस योजना जो पोषण टे्कर ते
On the Map,नक्शे ते
Prayagraj City 2,प्रयागराज शहरी 2
Poshan Tracker Process Flow,पोशन ट्रेक कंदडु अमलु जो वहिकिरो
New Khar Santacruz,नयू खार सेंटाक्रुज
Enter Date of Birth,जन्म तारीख भ्रमों
0 months to 5 years,0 महिनन खा 5 सालन ताई
Delhi Project 1,दिल्ली प्रोजेकट 1
The Poshan Tracker generates automated alerts to the critical last-mile beneficiaries.,पोषण टे्कर एप जो अलर्ट डयण बार जे वधण लाए।
It also ensures efficient audit of the delivery system by documenting real time attendance of beneficiaries and duty bearers.,हिन जो सुखों सिस्टम सा ड्युटी डयण आऊं डिलीवरी सही टाईम ते डयण।
"This management information system will help the nutrition programme to scale efficiently, thereby generating and documenting positive impact",हिन जो मेनेजमेंट सिस्टम जो बुधाएण नयुटरीशन प्रोग्राम जे बारे मे जेबा कि वधण में जाम सुठो असर डिसण ईंदो आ
How can one Download Poshan Tracker App?,पोषण एप खे कियें डाउनलोड करे सघ॒जे थो?
AWC Opening and AWW behaviour,AWC ओपनिंग आऊं AWW व्यवहार
"We may access, preserve and share your information in response to a legal request, subpoena, or other legal process or if we have a good faith belief that disclosure is reasonably necessary to (1) investigate, prevent or take action regarding fraud or  illegal activities or to assist government enforcement agencies; (2) enforce our agreements with you; (3) investigate and defend ourselves against any third-party claims or allegations; (4) protect the security or integrity of our Services (such as by sharing with companies facing similar threats); or (5) exercise or protect the rights and safety of any person.","अस्सां कानूनी अनुरोध, सम्मन, या बी कानूनी प्रक्रिया जे जवाब में तवान्जी जानकारी खे एक्सेस, संरक्षित आऊं साझा करे सगंदा आयुं या अगर असांखे हिक सही विश्वास आहे कि प्रकटीकरण उचित रूप सां जरूरी आहे (1) धोखाधडी या अवैध गतिविधिइन जे संबंध में जांच, रोकथाम या कार्रवाई करण या सरकारी प्रवर्तन एजेंसिइन जी मदद करण जे लाये; (2) तवांसां गड्ड असांजे समझौतन कहे लागू करण; (3) केडी ट्रीं दुरी जा दावा या आरोपन जी जांच करण आऊं हुनखां बचाव करण; (4) असाँजी सेवाउन जी सुरक्षा या अखंडता जी रक्षा करण (जियँ समान खतरन जो सामनो करण वारी कंपनिन सा साथ बाटण); या (5) केडे माणुन जे हक्क आऊं सुरक्षा जो इस्तेमाल या रक्षा करण।"
Binpur - Ii,बीनपुर - II
Available in 12 different languages,अलग॒ -अलग॒ 12 बो॒लियुन में मौजूद
"Clarification regarding Cost of Smart phones (03 June, 2021)","वजाहत असमारट फोन्ज जी कीमत बाबति (03 जूनि ,2021)"
"POSHAN Abhiyaan is the Government of India's flagship programme to improve nutritional outcomes for children, adolescents, pregnant women and lactating mothers by leveraging technology, a targeted approach and convergence.","टेक्नॉलजी, मक्सदी नजरियो एं मेलाप मेलाप जी ताकत सां बा॒रनु, नौजवाननु, गर्भ वंतयूनु जे खोराकी नतीजन खे सुधारण जे लाए, पोषण अभियान भारत जो मुख्य प्रोग्राम आहे."
"The initiative lays emphasis on creating synergy between various programmes in health, nutrition, sanitation sectors etc.","टेक्नॉलजी, मक्सदी नजरियो एं मेलाप मेलाप जी ताकत सां बा॒रनु, नौजवाननु, गर्भ वंतयूनु जे खोराकी नतीजन खे सुधारण जे लाए, पोषण अभियान भारत जो मुख्य प्रोग्राम आहे."
", to ensure efficiency and effective outcomes.","हीय पहल  नतीजनु जे असर एं कारकिरदगी जी पक करण जे लाए सिहत, पोषण, सफाई जे हिसनजे अलग॒ अलग॒ प्रोग्रामनु जे विचमें  समझोतो पैदा करण ते जोर दि॒ये थो."
Observing Breastfeeding In Newborn Babies,जायल बारण खे ढुक्क डेयन जो महसूल
Dzongu Tribal Project,जोनगु ट्राईबल प्रोजेक्ट
Gadchiroli - Maharashtra,गडचिरोली - महाराष्ट्र
New Hanuman Nagar,नयू हमुनाम नगर
West Jaintia Hills,ओभर जैंतिया टेकरियू
BARUIPUR Addl.ICDS PROJECT,हारुइपुर धार आई. सी. डी. ऐस. प्रोजेक्ट
Raghunathganj - I Addl.,रघुनाथगंज - I धार
Cooch Behar I Addl,कुचबिहार I धार
along with status update once resolved,हालत जे वादारपणे जे सुधो हेकारे निपटाणे जे बैदि
Shar Slum Akbarpur,शेर स्लम अखबरपुर
Sheopur - Madhya Pradesh,शियोपुर - मध्य प्रदेश
Tehatta 1 Addl,तेहाटा 1 धार
East Jaintia Hills,ओभर जैंतिया टेकरियू
"We use your data (including your communications) for security purposes or to prevent or investigate possible fraud or other violations of our Terms of Service and/or attempts to harm our Members, Visitors or others.",असा तांजी इन्फोर्मेशन खे भी रिकार्ड कंदा आयु ताकि केडे भी धोखे खा बची सिघयु जेको टर्म एंड कंडीशन जे खिलाफ आ।
"The Poshan Tracker system is regularly audited by auditors engaged by MWCD, for security and scalability of the system.",बुखारिण जि हिफाजती आऊं नापण जी लाइकियत जे लाये MWCD द्वारा नियुक्त कइल लेखापरीक्षकण द्वारा पोषण ट्रैकर बुखारिण जो टाइम टाइम ते ऑडिट कियो वेंदो आहे।
The records may be used for such audits.,रिकार्ड तांजे जो परिक्षण थींदो आ।
Chinsurah Mogra Addl.,छीनसुराह मोग्रा धार
Mohan Lal Ganj,मोहन लाल गंज
Mira Bhayandar Virar,मीरा भायानदार वीरार
Poshan Tracker adds new Resources on Website,पोशॉन ट्रेकर गंढियो आहे नयो वसिलो वेबसाईट कारगुरीअ ते
Please Enter Valid Mobile Number,किरपा सही मोबाईल नम्बर भरयो
Suti II Addl,सुती II धार
Home Visit Alerts,होम विजिट अलर्ट
How to use Poshan Calculator?,पोषण कैलकुलेटर जो इस्तेमाल कीयं कयूं?
Beneficiary record becoming inactive,फाईदोवठिंदड रेकार्डअणसुजाग था थिंदा वञिनि
2.4. Security and Audit.,2.4. सुरक्षा अंउ अंकेक्षण
Firozabad City 1,फिरोजाबाद शहरी 1
Theni - Urban,थेनि - शहरी
"The ‘Poshan Tracker’ is a mobile based application rolled out by the Ministry of Women and Child Development, Government of India on 1st March 2021 through National e-Governance Division (NeGD), Poshan Tracker is an important governance tool.","'पोशन ट्रैकर' हिक मोबाईल में हलण वारो एप आहे जेको 1 मार्च 2021 ते राष्ट्रीय ई-गवर्नेंस डिवीजन (NeGD), MyGov जे जरिये सां हिक अहिम हुकूमती टूल जे रूप में हिंदुस्तान सरकार जे मिनिस्ट्री ऑफ वुमन आऊं चाईल्ड द्वारा कडयु वयो आहे।"
"Technology under Poshan Tracker is being leveraged for dynamic identification of stunting, wasting, under-weight prevalence among children and last mile tracking of nutrition service delivery","पोषण टे्कर एप जी जे कि टेक्नोलॉजी आ उनका इयो पतों पयीन्दो आ कि बार स्टंटेड, घट वजन, वेस्टेड आ या न उनन ताई सही पोषण पहुंचे तो या न"
Dadra & Nagar Haveli,दादरा एं नगर हवेली
Habibpur Addl.2,हबिबपुर धार 2
Icds Tirur Addl, आई. सी. डी. ऐस. तीरुर धार
Raipur-  Karchulian-2,रायपुर- कारछुलियां-2
The System also takes feedback about system performance and experience.,सिस्टम फिडबेक भी वणंदो आ सर्विस अंउ अनुभव लाए।
"Information on name, mobile number, date of registration and health status may be used for these purposes","सूचना जिंय नालो, मोबाईल नम्बर, रजिस्ट्रेशन जी तारीख,सेहत जो स्टेटस हियो तांजो अनुभव वठण लाए थिंदो आ"
Medchal - Malkajigiri,मेडचाल -मलकाजिगिरी
Poshan Tracker App,पोषण टे्कर एप
Aspirational Districts Program,आकांक्षी जिला कार्यक्रम
Kultali Addl.ICDS Project,कुलटाली धार आई. सी. डी. ऐस. प्रोजेक्ट
"We collect the content and other information that you provide when you use our Services, including when you sign up for an account.","असाने कंटैंट अंउ सूचना ईककठी कईसे जे कि ताने असाखे डिनव सूचना असांजि सर्विस खे वापरे, अंउ जेमल तां अकाउंट खोलंदा आयो।"
"This can include- (i) Name (ii) Mobile number (iii) Date of Birth (iv)Gender (v) Name of Child (vi) Aadhaar Number (vii) AddressIf you choose not to provide data which is required to provide you with a product or feature, you cannot use that product or feature.",जेमे शामिल आ- (i) नालो (ii) मोबाईल नम्बर (iii) जन्म तारीख (iv) जेंडर (v)बार जो नालो (vi) आधार नंबर(vii) पतोअगर तां डाटा डयण जो आप्शन नथा चुनयो त ता प्रोडक्ट अंउ फिचर नथा इस्तेमाल करें सिघो।
