eng,sd
What is Poshan Abhiyaan?,पोषण अभियान छा आहे?
Moderately Wasted (MAM),संतुलन सा विनयाएण (MAM)
Hingoli (Balapur Akhada),हीनगोली (बालापुर अखादा)
Ldh Urban 3,ऐलडीऐच शहरी 3
South Golaghat Icds Project,ड॒खण गोलाघाट आई. सी. डि. ऐस. प्रोजेक्ट
East Garo Hills,ओभर गारो टेकरियू
Alipurduar - I Addl.,अलीपुरद्वार - I धार
Mal Adl 1,माल धार 1
"The Site is directed to the people residing in India.We do not represent that Content available on or through the Site is appropriate or available in other locations.We may limit the availability of the Site or any service or product described on the Site to any person or geographic area at any time.If you choose to access the Site from outside India, you do so at your own risk.","साइट हिंदुस्तान में रहण वारे मानुण लाये आहे अस्सां हिन गाल जो प्रतिनिधित्व नत्ता कयूं कि साइट ते या हुनजे माध्यमसां मिलण वारी सामग्री ठीक आहे या बी जायूँ ते मिलन्दी आहे।अस्सां केडी मैल भी केडे भी माणु या भौगोलिक क्षेत्र में साइट या साइट ते डिनायल केडी सेवा या उत्पाद जी मौजूदगी खे इख्तेयार करे सगंदा आयुं।अगर तवां हिन्दुस्तान जे बाहर खों साइट जो इस्तेमाल करण ता चायो, तो तवां पेंजे जोखिम ते करे ता सगो।"
NORTH DUM DUM,उतर दम दम
Please go back to the homepage,महरबानी करे होमपेज ते वापिस वञो
Please select Anganwadi center,महर्बानी करे हिकु आङनवाडी केंद्र चुंडो
Central Zone Rmc,सेंट्रल जोन आर ऐम सी
"National Nutrition Mission named as the Hon’ble Prime Minister’s Overarching Scheme for Holistic Nutrition (POSHAN) Abhiyaan was launched in 2017, as a multi-ministerial convergence mission, with the overarching vision to make India malnutrition free by 2022.","राष्ट्रीय पोषण मिशन जहिं खे मुअजज प्राइम मिनिस्टर ओवरआर्किंग स्कीम फॉर होलिस्टिक न्यूट्रीशन (पोषण) अभियान नालो दि॒नो वियो, इन खे 2022 ताईं भारत खे कुपोषण खां आजाद करण जे मजमूई नजरिये सां मल्टी मिनिस्ट्रियल मेलाप मिशन जे तोर ते 2017 में शुरू कयो वियो"
Bankura - I,बांकूडा - I
Icds Project Vijaypur, आई. सी. डी. ऐस. प्रोजेक् विजयपुर
 XI. VIOLATION OF THESE TERMS, XI. हिन शरतुं जो उल्लंघन
Rampurhat - I,रामपुरहाट - I
Mirzapur City 2,मीर्जापुर शहरी 2
"All personal information collected from you under Clause 1 at the time of registration will be retained for as long as your record remains in existence and if any medical or administrative interventions have been commenced under Clause 2, subject to Clause4(b) below, for such period thereafter as is required for such interventions to be completed.","पंजीकरण जे मैल खंड 1 जे तहत तवानखां वठैल सजी व्यक्तिगत जानकारी तैस ताईं राखी वेंदी तवाजो रिकॉर्ड हुँदो आऊं अगर कोई चिकित्सा या प्रशासनिक हस्तक्षेप खंड 2 जे तहत शुरू करो वेंदो, त हैट डिनायल खंड 4 (बी) जे अधीन, इह लाये हुनखां पोए जी अवधि जे रूप में हिन् तरह जे हस्तक्षेप खे पूरो करण जे लाये जरूरी आहे।"
"All personal information collected under Clauses 1 will be retained on the application Server, to the extent that such information relates to people who have been registered for the event.","खंड 1 जे मातहत जमा करैल सजी निजी जानकारी खे एप्लिकेशन सर्वर ते हिन् हद ताईं रखंदासे कि ऐडी जानकारी हुन माणुन सा मैल खाये, जेखें इवेंट जे लाये रजिस्टर कयो वयो आहे।"
"Nothing set out herein shall apply to the anonymized, aggregated datasets generated by the personal data of registered users of Poshan Tracker or any reports, heat maps or other visualization created using such datasets.","पोशन ट्रैकर में पंजीकृत वपरिन्दणन जी व्यक्तिगत डेटा या कोई भी रिपोर्ट, हीट मैप्स या एडी डेटासेट जो इस्तेमाल करे ठैल बी विजुअलाइजेशन द्वारा उत्पन्न अज्ञात, समेकित डेटासेट ते इथे मुकरैल कुछ भी लागू न थींदो।"
Number Of Positions,जायूंनि  जी गणप
Please enter Height greater than 29.99 and less than 140.01,किरपा लम्बाई भरयो जेकि वधिक हुजे 37.99 खा आऊं घट हुजे 150.01
"While login to the Poshan Tracker App, AWWs are required to enter the MPIN set by them.","पोषण ट्रेकर एप ते लॉगिन करण वक्त, आंगनवाडी में कम कंदडनु खे उन्ह्नु पारां सेट कयलु एमपिन दाखिल करणो पवंदो।"
This MPIN will act as a passcode to run the Poshan Tracker App and entering the information in the beneficiaries forms.,पोषण ट्रेकर एप खे हलाइण एं फायदों वठंदड जे फॉर्म में जा॒ण दाखिल करण जे लाये एमपिन हिक पासकोड तरीके कम कंदो.
Matigara ICDS Project( Main ),मातीग्रा आई. सी. डी. ऐस. प्रोजेक्ट (मुल)
How to ensure timely initiation of complementary feeding,इजाफे वारे खादे खे सही टाइम ते शुरुआत करण कीयं पक्को कयूं
20 December 2021,20 डिसंबर 2021
Poshan Tracker App can only be installed in Android Phone with Android version 6.0 and above.,पोषण ट्रेकर एप खे ऐंड्रोइड 6.0 या उन खां वधिक जे कोल वारे ऐंड्रोइड फोन में इंसटाल करे सघ॒बो आहे.
Please Enter Mobile Number,किरपा मोबाईल नम्बर भरयो
Request for Hot Cooked Meal,कोसी रधियलु माने जी आछ
Hasnabad ICDS Project,हासनाबाद आई. सी. डी. ऐस. प्रोजेक्ट
RAIPUR URBAN 1,रायपुर शहरी 1
General Awareness about Growth Monitoring of Children,वहींवारी जागरूकता बारण जे वाध निगरानी जी
Bhind - R,भींद - आर
Bastar - Chhattisgarh,बस्तर - छत्तीसगढ
Please select Help Topic,महर्बानी करे मदद जी संफ चुंडो
SINGUR - Addl,सींगुर - धार
Wasting is defined as low weight-for-height,घट वजन लम्बाई जे लाए विनयाएण चयबो आ
Hot Cooked Meal (HCM) Given Today,अजु॒ दि॒नल गरम रधलु खाधो (HCM)
There are 6 categories for beneficiariesPregnant WomenLactating MotherChildren from 0 to 6 monthsChildren from 6 months to 3 yearsChildren from 3 years to 6 yearsAdolescent girls,हिते छः श्रेणियु आएन फायदे जे लाएपेटअ वारी माईढुक्क डेयन वारी माईबार 0 खा 6 महिनन जोबार 6 महिनन खा 3 सालन जोबार 3 सालन खा 6 सालन जोकिशोरी छोकरूयु
"Data Plan for Mobile Application (01 March, 2021)","मोबाईल एप्लीकेशन जे लाये डाटा प्लान ( 01 मार्च, 2021)"
Old  Amravati Urban,ओल्ड अमरावती शहरी
The WHO Multicentre Growth Reference Study (MGRS) was undertakenbetween 1997 and 2003 to generate new growth curves for assessing the growth and development of infants and young children around the world,WHO मल्टीसेंटर ग्रोथ रेफरेंस स्टडी (MGRS) 1997 आऊं 2003 जे विच्छ में दुनिया भर जे जाएल आऊं नंडे बारन जी वृद्धि आऊं वाध जो आकलन करण जे लाये नए विकास वक्र उत्पन्न करण जे लाये कियोवयो होयो
Garbeta - I,गारबेटा - I
How to set MPIN?,एमपिन खे सेट कियें कयो वञे?
Rewa - Urban,रेवा - शहरी
 VIII. LIMITATIONS OF MULTI- LINGUAL INTERFACE, VIII. बहुभाषी - इंटरफेस जी सीमाउँ
Diamond Harbour-I ICDS Project,डायमोंड हार्बर-I आई. सी. डी. ऐस. प्रोजेक्ट
Srijangram I. C. D. S. Project,श्रीजानग्राम आई. सी. डि. ऐस. प्रोजेक्ट
"We may investigate any violation of these Terms, including unauthorized use of the Site.",अस्सां साइट जो गैर कानूनी इस्तेमाल सां हिन शरतुं जो केडे भि उल्लंघन जी जांच करे सगंदा आयुं।
We may provide law enforcement with information you provide to us related to your transactions to assist in any investigation or prosecution of you.,अस्सां केडी भी जांच या तवां जे मथ्थों मुकदमो हलायन में मदद जे लाये कानून खे तवान्जी लेनदेन सां संबंधित काई जानकारी डेई सगंदा आयुं।
We may take legal action that we feel is appropriate.,अस्सां कानूनी कार्रवाई करे सगंदा आयुं अगर असांखे ऊ सही लगे त।
"If we determine that you have violated these Terms or the law, or for any other reason or for no reason, we may block your account and will prevent you from accessing the Site at any time without notice to you.","अगर अस्सां इहो तय कयूं ता तवां हिन् शरतुं जो या कानून जो उल्लंघन कयो तो, या बे केडी वजह सां या बिना केडी वजह सां, अस्सां तवान्जे खाते के ब्लॉक करे सगंदा आयुं आऊं तवांखे बिना काई खबर डेई केडी भी मैल साइट ताईं पहुंचन सां रोके सगंदा आयुं।"
There are limited fields for data entry.Name is required to be entered in English language and for other fields numeric values are required.Most of the features are provided in check boxes or with drop down selection menu.Reports to be updated.,आंगनवाडी कम कंदड फॉर्म फकत अंग्रेजी बो॒लीअ में भरे सघ॒न था.
P P Kamaicha,पी पी कामाईछा
Children between 3-6 Years,3 - 6 सालनु जे विच में बा॒र
Poshan Calculator helps to identify various health conditions of the child as per World Health Organization (WHO) standards,पोषण केल्कयुलेटर सहायता कंदो आ जाम सारयु सिहत जी दिक्कत सा बार जी वर्ल्ड हेल्थ आर्गेनाइजेशन जे तहेत (WHO)
General Awareness on Mother Care,वहींवारी जागरूकता मां जे देखभाल करण जी
Mal Adl 2,माल धार 2
New Poshan Tracker App,नयो पोषण टे्कर एप
How to take care of weak newborn with the help of Kangaroo Mother Care,कंगारू मदर केयर जी मदद सां कमजोर जायल बार जी देखभाल कीयं कयूं
Siliguri II (U),सीलीगुडी II (यू)
Old Urban Project 1,पुराणीशहरी प्रोजेक्ट 1
District Performance across 6 KPIs,6 KPI में जिला प्रदर्शन
Kaliyaganj ICDS Project,कालीयागंज आई. सी. डी. ऐस. प्रोजेक्ट
Turbhe-Panvel Navi Mumbai,थुरबे-पानवेल नवी मुंम्बई
East Zone Rmc,इस्ट जोन आर एम सी
Bagh Kare Khan,बाघ कारे खां
"Shenoy Nagar,Project 1","शेनोइ नगर, प्रोजेक्ट 1"
"The ASPs collecting data from Poshan Tracker and displaying to users shall be solely responsible for the correctness of such data and any liability arising out of any data so provided, shall completely rest with such third party.",पोषण ट्रैकर खों डेटा जमा करण आऊं वापरिधननं खे प्रदर्शित करण वारे एएसपी एडी डेटा जे खरोपण जे लाये पूरी तरह सां जिम्मेदार हुँदा आऊं हिन् तरीके सां डेईल काई भी डेटा सां पैदा थेयन वारी काई भि देयता पूरी तरह सां इहो ट्रीं दुरी सां गड्ड हुंदी।
"Any liabilities civil or criminal, arising out of any incorrect data, shall solely lie with the concerned ASP.",काई भी गलत डेटा सां पैदा थेयन वारी सिविल या आपराधिक देनदारियां पूरी तरह सां संबंधित एएसपी वठ हुंदियूं।
ICDS Khadur Sahib, आई. सी. डी. ऐस. खादुर साहिब
Poshan Tracker App is available over Google playstore https://play. google. com/store/apps/details? id=com. poshantracker,पोषण ट्रेकर एप गूगल ते मौजूद आहे.Google playstore https://play. google. com/store/apps/details? id=com. poshantracker
Can App be accessed without internet?,छा हिन एप खे इंटरनेट जे बिना हलाए सघ॒बो आहे?
"The Government has taken several initiatives to break the intergenerational cycle of malnutrition in children.Adopting a life-cycle approach, interventions have been designed to meet the nutritional requirement of adolescent girls and boys, pregnant women, lactating mothers and children.",बा॒रनु में कुपोषण जी बिन अलाकुमी सिरिशते खे टोडण जे लाये सरकार कुझ कदम खँया आहिन छोकरा
Dhupguri Adl 2,धुपगुडी धार 2
Nalhati - II,नलहाटी - II
Awareness for Pregnancy in Preventing Anemia,जागरूकता गर्भावस्था मे एनीमिया जी
Last 30 days,आखिरीन 30 ॾींहुं
"Howrah North (U) I. C. D. S. Project, Howrah","हावडा उतर (यू) आई. सी. डी. ऐस. प्रोजेक्ट, हावडा"
Ranaghat 1 Addl,राणाघाट 1 धार
Query Related to,केंजे संबंधी सवाल आ
Dhar - U,धार - यू
South Garo Hills,दखण गारो टेकरियू
3. SHARING OF INFORMATION,3. सूचना बाटण
Birth Preparedness- For Institutional and Home Delivery,जन्म जी तैयारी- संस्थायुन आऊं होम डिलीवरी जे लाये
New beneficiary addition with skip OTP option,नयो फाईदोवठिंदड गंढायप नजपअंदाज कंदड OTP विकल्प सां
We are now available on Video Conference,असां हाणे विडिओ कान्फ्रन्स ते बि मौजूद आहियूं
Data Plan for Mobile Application,डेटा जी योजना मोबाईल अप्लिकेशन जे लाए
North West Delhi,उतर द॒खण दिल्ली
English Bazar &amp,अंग्रेजी बजार &amp
2.6. Surveys and Feedbacks.,2.6. सर्वे अंउ फिडबेक
"Poshan Tracker App is meant for Aanganwadi workers, Anganwadi centers to enter beneficiaries data in the forms.","पोषण ट्रेकर एप, आंगनवाडी में कम कंदडनु, आंगनवाडी मरकजन पारां फायदो वठंदडनु जे डाटा खे फॉर्म में दाखिल करण जे लाये ठाही वेई आहे."
It is not at all developed for general public.,हिन एप खे आम अवाम जे लाये बिलकुल न ठाहियो वियो आहे.
Get In Touch,राबतो कयो
ICDS NAUSHERA PANNUAN, आई. सी. डी. ऐस. नौसेरा पुनान
