eng,sd
Please select Project,महर्बानी करे  हिक प्राजेक्ट चुंडो
Please Select Query Related to,किरपा करे चुनयो केंजे संबंधी सवाल आ
 IV. ACCOUNT REGISTRATION, IV. खातों पंजीकरण
Stunting ( Height for Age)-,स्टनटिग ( लम्बाई उम्र जे लाए)-
Binpur - II Adl.,बीनपुर - II धार
Pakyong Rural Project,पाकयोंग गो॒ठाणी प्रोजेक्ट
Wasted Assessment Parameters,व्यर्थ जो मुल्यांकन मापण
Sangam Vihar Ii,संगम विहार-II
Shri Ram Colony,श्रीराम कालोनी
Ranaghat 1 Exsiting,राणाघाट 1 ताजो
Mathabhanga I Addl,माथाभांङा I धार
Stunting is the impaired growth and development that children experience from poor nutrition,स्टंट ग्रोथ आऊं डेवलपमेंट लाए सुठो न हुनदो आ जेसा बार कुपोषित रहजी वेदों आ
Children in the age group of 3 years to 6 years,बार देखा 3 सल खा 6 सालन जा आएन
"Poshan Tracker Dashboard can be accessed by signing onto the dashboard.Dashboard can be accessed by clicking the link https://poshantracker.in/admin Only nominated Nodal level officials at National, State, District, Project and Sector level are provided with a unique credentials to access the dashboard.",डैशबोर्ड ते साइन इन करे पोषण ट्रेकर डैशबोर्ड ताईं पहुंची सघ॒जे थो.लिंक https://poshantracker.in/admin ते क्लिक करे डैशबोर्ड ताईं पहुंची सघ॒जे थो.डैशबोर्ड ते पहुंचण जे लाये फक्त चूंडियल राष्ट्रीय/ राज्य/ जिल्ला/ प्रोजेक्ट एं सेक्टर सतह जे नोडल सतह जे ऑफिसरन खे हिक अनोखो क्रेडिनशल दि॒नो वेंदो आहे.
Please enter valid Weight,किरपा सही वजन भरयो
Khargone (West Nimar),खरगोन (द॒खण निमार )
 Md. Bazar Addl., ऐम. डी. बजार धार
What is the eligibility of a beneficiary?,छा आए लाभकारी जी पात्रता?
Who are the target userbase of Poshan Tracker App?,पोषण ट्रेकर एप जा मक्सदी वापराइंदड केर आहिन?
Kanpur Nagar City 1,कानपुर नगर शहरी 1
How Poshan Tracker Works,पोषण ट्रेकर अप कियें कम कंदी आहे
Kalna - I Addl.,कालना - I धार
Home visits and Counselling,घर वनयण आऊं काउंसिलिंग
Kusheshwar Asthan Purbi,कुशेसवार स्थान पुर्बी
Mandirbazar ICDS Project,मंदिरबजार आई. सी. डी. ऐस. प्रोजेक्ट
Awareness to Lactating Mother,जागरूकता मां मे ढुक्क डेयन जी
"It often indicates recent and severe weight loss, although it can also persist for a long time","इयो डिखाईंदो आ हाणे आऊं गंभीर घट वजन, ईयो दृढ संकल्प सा लम्बे टाईम मे पाए ता सघयु"
 X. ACCESS FROM OUTSIDE INDIA, X. हिंदुस्तान खो बाहर खां पहुंच
Kaliachak - II,कालियाचौक - II
Machkhowa Icds Project,माखखोवा आई. सी. डि. ऐस. प्रोजेक्ट
What is the minimum requirement to install Poshan Tracker App in mobile?,मोबाईल में पोषण ट्रेकर एप इंस्टाल करण जे लाए घटु में घटु घुरज छा आहे?
SHRI ANANDPUR SAHIB,श्री आनंदपुर साहिब
"Khar (West),Santacruze (East)","खार (ओलहि), सेंटाक्रुज (ओभर)"
Create new ticket,नई टिकेट ठाहियो
You will only access (or attempt to access) the Site by the means described in the Documentation and will comply with the terms and conditions of this Agreement.,तवां केवल दस्तावेजीकरण में डिनायल माध्यमन्न सां साइट ताईं पहुंच (या एक्सेस करण जी कोशिश) कंदो आऊं हिन अग्रीमेंट जे नियमन आऊं शरतुं जो पालन कंदो।
"You will comply with all Central and State laws, rules and regulations applicable to you and your use of the Site and affecting any third-party rights.","तावान सभी केंद्रीय आऊं राज्य जे कानूनन, नियमन आऊं विनियमन जो पालन कंदो जो तवांजे आऊं साइट जे तवांजे इस्तेमाल जे मथ्थों लागू थेयंदा आहेन आऊं केडी भी ट्रीं दुरी जे हक्कण जे मथ्थों असर कंदी आहे।"
ROURKELE CIVIL TOWNSHIP,राउरकेले सीविल टाउंशीप
You can participate in Swastha Balak Balika Spardha by registering through the website https://poshantracker.,You can participate in Swastha Balak Balika Spardha by registering through the website https://poshantracker.
in or by downloading ‘Poshan Tracker’ App from Google Play Store.,in or by downloading 'Poshan Tracker' App from Google Play Store.
Ldh Urban 4,ऐलडीऐच शहरी 4
"Welcome!The following are the Terms of Service (“Terms”) that govern your use of the Poshan Tracker Platform hosted at https://poshantracker.in, and all associated sites linked to it, its subsidiaries, and affiliates (collectively, the “Site”).","वेलकम!हाइट डिनायल सेवा जी शर्तूं (""शर्तूं "") आहेन जो तवांजे सां सबब सां होस्ट करैल पोशन ट्रैकर प्लेटफॉर्म खे href='https://poshantracker.in'>https://poshantracker.in आऊं हिनसां जुडैल सभी संबंधी साइटअ, हिनजी मदद कंदिल कंपनियूँ आऊं मददगार (सामूहिक रूप सां, ""साइट"") जे तवांजे इस्तेमाल खे अगुआई कंदी आहे।"
Burdwan - I,बरजवान - I
Project 4 Singanallur,प्रोजेक्ट 4 सीनगानाल्लुर
Select Key Performance Indicator,मुख्य प्रदर्शन संकेतक चुंडयो
Select An Anganwadi center,हिकु आङनवाडी केंद्र चुंडो
Clarification regarding Cost of Smart phones,स्पष्ट करण स्मार्टफोन जो अघ
Budge Budge - II,बज बज - II
Measles Containing vaccine (MCV)/Measles & Rubella (MR)-1Japanese Encephalitis(JE)-1**PCV-Booster,मिसलेस कनटेनिंग वेक्सिन(MCV)/मिसलेस आऊं रूबेला (MR)-1जापानिस इन्सेफेलाइटिस(JE)-1**PCV-बूस्टर
"There are various reports that can be generated fromGeneral Reports:Number of app  downloadsTotal number of Anganwadi centers registeredTotal number of beneficiaries registered (National/state/district/block wise)Total Number of pregnant women registered(National/state/district/block wise)Total Number of  lactating mothers registered(National/state/district/block wise)Total Number of children (0-6months) registered(National/state/district/block wise)Total Number of children (6months-3years) registered(National/state/district/ block wise)Total Number of children (3-6years) registered(National/state/district/ block wise)Maternal and child nutrition:How many beneficiaries got THR in 21 daysHow many children breastfed exclusively in the first hour after deliveryHow many lactating mothers are given HCMAverage level of calcium in children aged 3-6 yearsAverage level of iron in children aged 3-6yearsTotal number of vaccinations administered per month (block, district, state, national level)Vaccinations specific report administered per month (BCG/OPV/Hepatitis B/Rotavirus/Polio/Pneumococcal/PentavalentAWC infrastructure:Number of AWCs (block, district, state, national level)Total number of Balvatikas (block district, state, national level)Total number of AWCs (block, district, state, national level) with clean drinking waterTotal number of AWCs (block, district, state, national level) with working weighing scaleTotal number of AWCs (block, district, state, national level) with electricityTotal number of AWCs that are government ownedTotal number of AWCs that are privately owned",डैशबोर्ड तां तरह-तरह जूं रिपोरटूं कढी सघ॒बियूं आहिनआम रिपोरटूंःएप डाउनलोड जा नंबररजिस्टर थियल आंगनवाडी मरकजनु जो कुल नंबररजिस्टर थियल फायदो वठंदडनु जो कुल नंबर (राष्ट्रीय/ राज्य/ जिला/ ब्लॉक मुजब)रजिस्टर थियल गर्भ वंती मायूनु जो कुल नंबर (राष्ट्रीय/ राज्य/ जिला/ ब्लॉक मुजब)रजिस्टर थियल धाराइंदडु माउरुन जो कुल नंबर (राष्ट्रीय/ राज्य/ जिला/ ब्लॉक मुजब)रजिस्टर थियल बा॒रन (0-6 महिना) जो कुल नंबर (राष्ट्रीय/ राज्य/ जिला/ ब्लॉक मुजब)रजिस्टर थियल बा॒रन (6 महीना- 3 साल) जो कुल नंबर (राष्ट्रीय/ राज्य/ जिला/ ब्लॉक मुजब)रजिस्टर थियल बा॒रन (3- 6 साल) जो कुल नंबर (राष्ट्रीय/ राज्य/ जिला/ ब्लॉक मुजब)माउ एं बा॒र जी खोराकः21 दी॒न्हनु में केतरनु फायदो वठंदडनु खे टीएचआर मिली आहेकेतरनु बा॒रनु खे डिलीवरी जे पहिरियें कलाक में माउ जो खीर दिनो वियोकेतरियुन धाराइंदडु माउरुन खे एचसीएम दि॒नी वेई आहेकेतरनु बा॒रनु खे डिलीवरी जे पहिरियें कलाक में माउ जो खीर दि॒नो वियो3 - 6 सालनु जी उम्र वारनु बा॒रन में कैल्शियम जो सरासरी सतह3 - 6 सालनु जी उम्र वारनु बा॒रन में आयरन जो सरासरी सतहहिक महीने में दि॒नल टीके जो कुल नंबर (राष्ट्रीय/ राज्य/ जिला/ ब्लॉक मुजब)हिक महीने में दि॒नल टीके जी खास रिपोर्ट (बीसीजी/ ओपीवी/ हेपेटाइटिस B/ रोटावायरस/ पोलियो/ नयुमाकोक्कल/ पेंटावेलंट)आंगनवाडी मरकज इमारतःआंगनवाडी मरकज जो नंबर (राष्ट्रीय/ राज्य/ जिला/ ब्लॉक मुजब)बा॒लवाटिका जो कुल नंबर ((राष्ट्रीय/ राज्य/ जिला/ ब्लॉक मुजब)पीयण जे साफ पाणीअ वारन आंगनवाडी मरकज जो कुल नंबर ((राष्ट्रीय/ राज्य/ जिला/ ब्लॉक मुजब)कम कंदड वजन कांटे वारन आंगनवाडी मरकज जो कुल नंबर (राष्ट्रीय/ राज्य/ जिला/ ब्लॉक मुजब)बिजली वारन आंगनवाडी मरकज जो कुल नंबर (राष्ट्रीय/ राज्य/ जिला/ ब्लॉक मुजब)आंगनवाडी मरकजनु जो कुल नंबर जेके सरकार जी मालिकीअ जा आहिनआंगनवाडी मरकजनु जो कुल नंबर जेके खानगी मालिकीअ जा आहिन
JALPAIGURI Sadar Adl,जलपाईगुडी सदर धार
Mobile number need to be validated within a week,मोबाईल नम्बर जे साबित करणो पवंदो हिक हफिते में
Currently a beneficiary can register by the help of an AWW,हाणे जे लाए लाभकारी रजिस्ट्रेशन करे ता सघयु AWW जी मदद सा
Awareness for Lactating Mother Complimentary Feeding for Children,जागरूकता हुजे मां मे बार खे छाति मा सुठे सा खिर पियाण जी
 W. Phaileng ICDS Project,डब्लु फाईलेंग आई. सी. डी. ऐस. प्रोजेक्ट
 H. Bagh Rural, ऐच. बाग गो॒ठाणो
New Poshan Tracker App - CSC-SPV Nodal Person,नयो पोषण टे्कर एप- CSC-SPV नोडल माणु
New Registration request,नयो पंजिकरण जी आछ
Rampurhat - I Addl.,रामपुरहाट - I धार
UJJAIN - RURAL,उजैन - गो॒ठाणो
Tufanganj II Addl,तुफानगंज II धार
Your use of the Site and any dispute arising out of such use of the Site is subject to the laws of India and place of jurisdiction shall be New Delhi.,तांजो साईड जो हिंय इस्तेमाल करण अंउ साईड जे हिंय इस्तेमाल सा विवाद थयण भारत जे कानून जे अधिन आ अंउ क्षेत्राधिकार जी जगह नई दिल्ली थींदी।
1.1. Information you provide to us.,1.1. सूचना जेकि ता असाखे डिनव।
How can one access Poshan Tracker Dashboard?,पोषण ट्रेकर डेशबोर्ड ते कियें पहुंच्यो वञे?
Harda Gramin 1,हरदा गो॒ठाणो 1
Prevention of Anemia in children and adolescents girls,नंडे बारण आऊं जवान छोकरिन में एनीमिया जी रोकथाम
Gangarampur Addl. I. C. D. S Project,गंगारामपुर धार  आई. सी. डी. ऐस. प्रोजेक्ट
Can a beneficiary register directly using application.,छा अप्लिकेशन खे डायरेक्टलि इस्तमाल करें फायदेमंद रजिस्ट्रेशन करे ता सचमुच।
BISHNUPUR 1 Addl,बीशनुपुर 1 धार
Suri - I,सुरी - I
Mohd Pur Devmal,मोहमद पुर देवमल
ROURKELA INDUSTRIAL ESTATE,राउरकेला इंड्रसट्रीयल इसटेट
Click on Show Results,डिसण अचण वारे रिजल्ट ते दबायो
Rjn Gramin 01,आर जे ऐन गो॒ठाणो 01
Terms of Service,टर्म्स ऑफ सर्विसेस
Complementary Feeding - Diet Diversity,इजाफे वारो खादो-मुख्तलिफ खोराक
SHRI MUKTSAR SAHIB,श्री मुख्तसर साहिब
"The Ministry of Women and Child Development has rolled out Poshan Tracker application.The goal is to follow nutrition systems strengthening approach for improving maternal and child undernutrition, focused on strengthening implementation bottlenecks at all levels.The Poshan Tracker is built using centralized data architecture, that also aligns with the digital technology systems of other ministries and programs.The system provides a digital identity to each beneficiary through a digital card, and allows convergence of call centre with the technology platform.The system generates automated alerts to the critical last-mile beneficiaries.It also ensures efficient audit of the delivery system, by documenting real time attendance of beneficiaries and duty bearers.Such a robust digital technology platform and management information system, will help the mission to scale efficiently, thereby generating and documenting significant positive impact.",मिनिस्ट्री ओव वुमन एंड चाइल्ड डेवलपमेंट पोषण ट्रेकर एप्लीकेशन शुरू कई आहे.इन जो मकसद हर सतह ते माउ एं बा॒र जी अधूरी खोराक खे सुधारणु जे लाए खोराक सिरिश्ते खे मजबूत बणाइण आहे.पोषण ट्रेकर एप खे सेंटरलाइजड डाटा आर्किटेक्चर जो उपयोग करे ठाहियो वियो आहे.जेको बि॒यनू मिनिस्ट्री एं प्रोग्रामनु खे डिजिटल टेक्नॉलजी सां सधाइंदो आहे.सिस्टम हिक डिजिटल कार्ड जे जरिये हर हिक फायदे वठंदड खे हिक डिजिटल पहचान दीं॒दो आहे एं टेक्नोलॉजी प्लेटफॉर्म कॉल सेंटर सां राबतो करण जी इजाजत दीं॒दो आहे.सिस्टम वधिक अहम आखिरी महल जे फायदे वठंदडन खे ऑटोमेटेड अलर्ट कंदो आहे.इहो फायदो वठंदड एं कम कंदडनु जी रियल टाइम हाजरी जी लिखत करे डिलीवरी सिस्टम जे असर जी चकास कंदो आहे.अहिडो मजबूत डिजिटल टेक्नोलॉजी प्लेटफॉर्म एं मैनेजमेंट इनफर्मेशन सिस्टम मिशन जे असर खे मापण में मदद कंदो जहिं जे करे अहम हाकारी असर पैदा थींदो एं उन जी लिखत रखंदो
Gaurela Pendra Marwahi,गौरेला पेन्द्रा मारवाही
Cooch Behar I,कुचबिहार I
Weight should be between 0.90 to 58,वजन 0.90 खां 58 जे मंझ हुअणो खपे
Please Enter Valid Email ID,किरपा सही ईमेल आईडी विजो
We own the intellectual property rights in the Site and Content.,अस्सां साइट आऊं सामग्री में बौद्धिक संपदा अधिकारन जा मालिक आऊं।
We may change the Content and features of the Site at any time.,अस्सां कैडी भि मैल साइट जी सामग्री आऊं सुविधाउन खे बदले सगू था।
"The registered and unregistered trademarks, logos, and service marks displayed on the Site are owned by us or our licensors.","साइट ते डिस्प्ले थींदा पंजीकृत आऊं अपंजीकृत ट्रेडमार्क, लोगो आऊं सेवा चिह्न असांजा या असांजे लाइसेंसकर्ताउन जी मिलकियत आहेन।"
"You may not use our trademarks, logos, and service marks in any way without our prior written permission.","तवां असांजी पहना खां लिखैल इजाजत जे बिना केडे भी तरह सां असांजे ट्रेडमार्क, लोगो आऊं सेवा चिह्नन जो इस्तेमाल न करे सगंदा आयो।"
Material featured on this website may be reproduced free of charge.,इन्ह वेबसाइट ते प्रदर्शित सामग्री खे निःशुल्क पुनः प्रस्तुत करे सगंदा आयो।
"However, no part of the Site and no Content may be copied, republished, reproduced, uploaded, posted, displayed publicly, encoded, translated, transmitted or distributed in any way to any other computer, server, Web site or other medium for publication in a derogatory manner or in a misleading context.","हालांकि, साइट जो कोई भी हिस्सौ आऊं केडी भी सामग्री जी प्रतिलिपि, पुनर्प्रकाशित, पुनरुत्पादित, अपलोड, पोस्ट, सार्वजनिक रूप सां प्रदर्शित, एन्कोडेड, अनुवादित, प्रेषित या बे केडे अन्य कंप्यूटर, सर्वर, वेब साइट या ब्या माध्यम में प्रकाशन जे लाये केडे भी तरह सा अपमानजनक तरीके सां या भ्रामक संदर्भ में, डे-वट्ट न करे सगंदा आयो।"
"You may use information available on the Site, provided that you will (1) use such information only for your personal, non-commercial informational purpose and do not copy or post such information on any networked computer or broadcast it in any media, (2) not make any modifications to any such information and any additional representations or warranties relating to such documents and Content.","तवां साइट ते मिलंदड जानकारी जो इस्तेमाल करे सगंदा आयो, बशर्ते कि तवां (1) इह जानकारी जो इस्तेमाल केवल पेंजी निजी, गैर-व्यावसायिक सूचनात्मक वजह जे लाये कयो ता आऊं इह जानकारी खे केडे भि नेटवर्क कंप्यूटर ते कॉपी या पोस्ट न कंदो या हिनखे केडे भी मीडिया में प्रसारित न कंदो, (2) एडी काई भी जानकारी आऊं एडा कागरअ आऊं सामग्री सां संबंधित केडी भी अतिरिक्त अभ्यावेदन या वारंटी में कोई संशोधन न थेयन गुर्जे।"
"Wherever the material is being published or issued to others, the source must be prominently acknowledged.","जित्ते-किथे भी सामग्री प्रकाशित या बेयन खे जारी की वेंदी, स्रोत जे प्रमुखता सां मनी वेंदी।"
"However, the permission to reproduce this material shall not extend to any material which is identified as being copyright of a third party.","हालांकि, इन्ह सामग्री खे पुनः पेश करण जी इजाजत केडी भीएडी सामग्री ताईं विस्तारित न थींदी जैकी केडी ट्रीं दुरी जे कॉपीराइट जे रूप में पहचानन वेंदी आये।"
Galsi - II,गालसी - II
