eng,ta
"Poshan Tracker Platform has reasonable security measures and safeguards in place to protect your privacy and personal information from loss, misuse, unauthorized access, disclosure, destruction, and alteration of the information in compliance with applicable laws.Further, whenever you change or access your account on the System or any information relating to it, we offer the use of a secure server.It is further clarified that you have, so long as you access and/or use the System (directly or indirectly), the obligation to ensure that you, shall at all times, take adequate physical, managerial, and technical safeguards, at your end, to preserve the integrity and security of your data which shall include and not be limited to your personal information.","போஷன் டிராக்கர் பிளாட்ஃபார்ம் உங்கள் தனியுரிமை மற்றும் தனிப்பட்ட தகவல்களை இழப்பு, தவறாகப் பயன்படுத்துதல், அங்கீகரிக்கப்படாத அணுகல், வெளிப்படுத்துதல், அழித்தல் மற்றும் பொருந்தக்கூடிய சட்டங்களுக்கு இணங்க தகவல்களை மாற்றுதல் ஆகியவற்றிலிருந்து பாதுகாக்க நியாயமான பாதுகாப்பு நடவடிக்கைகள் மற்றும் பாதுகாப்புகளைக் கொண்டுள்ளது.மேலும், சிஸ்டத்தில் உங்கள் கணக்கை மாற்றும்போதோ அல்லது அணுகும்போதோ அல்லது அது தொடர்பான எந்தத் தகவலுக்கும், நாங்கள் பாதுகாப்பான சர்வரைப் பயன்படுத்துகிறோம்.நீங்கள் கணினியை (நேரடியாகவோ அல்லது மறைமுகமாகவோ) அணுகும் மற்றும்/அல்லது பயன்படுத்தும் வரை, உங்கள் முடிவில் போதுமான உடல், மேலாண்மை மற்றும் தொழில்நுட்ப பாதுகாப்புகளை நீங்கள் எப்போதும் எடுத்துக்கொள்வதை உறுதிசெய்யும் கடமை உங்களுக்கு உள்ளது என்பது மேலும் தெளிவுபடுத்தப்படுகிறது., உங்கள் தரவின் ஒருமைப்பாடு மற்றும் பாதுகாப்பைப் பாதுகாக்க, அதில் உங்கள் தனிப்பட்ட தகவல்கள் அடங்கும் மற்றும் மட்டுப்படுத்தப்படவில்லை."
General Awareness on the Delivery of the child,குழந்தை பிரசவம் பற்றிய பொது விழிப்புணர்வு
General Awareness on Anaemia,இரத்த சோகை குறித்த பொது விழிப்புணர்வு
"We also use the data to operate our services, which includes analyzing our performance, meeting our legal obligations, developing our workforce, and doing research.","எங்கள் சேவைகளை இயக்கவும் தரவைப் பயன்படுத்துகிறோம், இதில் எங்கள் செயல்திறனைப் பகுப்பாய்வு செய்தல், எங்கள் சட்டப்பூர்வ கடமைகளை நிறைவேற்றுதல், எங்கள் பணியாளர்களை மேம்படுத்துதல் மற்றும் ஆராய்ச்சி செய்தல் ஆகியவை அடங்கும்."
We may also use the information to perform certain necessary operation for improvement of the System and for all acts incidental or ancillary to the provision of the System and for developing and providing new technologies and services.,"சிஸ்டத்தை மேம்படுத்துவதற்கும், தற்செயலான அல்லது துணைச் செயல்களுக்கும், புதிய தொழில்நுட்பங்கள் மற்றும் சேவைகளை உருவாக்குவதற்கும், வழங்குவதற்கும் தேவையான சில செயல்பாடுகளைச் செய்வதற்கும் நாங்கள் தகவலைப் பயன்படுத்தலாம்."
South Salmara Mancachar,தெற்கு சல்மாரா மஞ்சாச்சர்
Where can I enquire about Hot Cooked Meal?,சூடான சமைத்த உணவைப் பற்றி நான் எங்கே கேட்கலாம்?
"The Site may contain links to other websites that may not be owned, maintained, or operated by us.","தளத்தில் எங்களுக்குச் சொந்தமான, பராமரிக்கப்படாத அல்லது இயக்கப்படாத பிற இணையதளங்களுக்கான இணைப்புகள் இருக்கலாம்."
"The fact that these websites are linked, does not indicate any endorsement of these websites from us, since we do have any control over these websites.","இந்த இணையதளங்கள் இணைக்கப்பட்டிருப்பது, இந்த இணையதளங்களின் மீது எங்களிடம் எந்தக் கட்டுப்பாடும் இல்லாததால், இந்த இணையதளங்களுக்கு எங்களிடமிருந்து எந்த ஒப்புதலும் இல்லை."
We are not responsible for these websites including any content or the privacy practices of these websites.,எந்தவொரு உள்ளடக்கம் அல்லது இந்த வலைத்தளங்களின் தனியுரிமை நடைமுறைகள் உட்பட இந்த வலைத்தளங்களுக்கு நாங்கள் பொறுப்பல்ல.
We strongly encourage you to familiarize yourself with the terms of use of these websites.,இந்த வலைத்தளங்களின் பயன்பாட்டு விதிமுறைகளுடன் உங்களைப் பழக்கப்படுத்திக்கொள்ள நாங்கள் கடுமையாக ஊக்குவிக்கிறோம்.
Your use of these websites is at your own risk and peril.,இந்த இணையதளங்களைப் பயன்படுத்துவது உங்கள் சொந்த ஆபத்தில் உள்ளது.
"It is solely up to you to take necessary precautions to ensure that the links you select or any software you may download is free of viruses, worms, Trojan horses, defects, date bombs, time bombs, and other or other computer programming routines which are of destructive nature","நீங்கள் தேர்ந்தெடுக்கும் இணைப்புகள் அல்லது நீங்கள் பதிவிறக்கம் செய்யும் எந்த மென்பொருளும் வைரஸ்கள், ட்ரோஜன் ஹார்ஸ்கள், குறைபாடுகள், தேதி குண்டுகள், நேர வெடிகுண்டுகள் மற்றும் பிற அல்லது பிற கணினி நிரலாக்க நடைமுறைகள் அழிக்கும் இயல்புடையது இல்லாமல் இருப்பதை உறுதிசெய்ய தேவையான முன்னெச்சரிக்கை நடவடிக்கைகளை எடுப்பது உங்களுடையது மட்டுமே"
TITAGARH (U) ICDS PROJECT,டிடாகர் (யு) ஐ. சி. டி. எஸ். புராஜக்ட்
Singtam Rural Project,சிங்டம் கிராமப்புற திட்டம்
In how many languages AWW can enter the data while filling up the form?,படிவத்தை நிரப்பும்போது அடபிள்யூடபிள்யூ அல்லது அடபிள்யூசி எத்தனை மொழிகளில் தரவை உள்ளிடலாம்?
Purnia East Urban,பூர்னியா கிழக்கு அர்பன்
Children who are identified as deficit on nutrition are eligible for additional food supplements.,ஊட்டச்சத்து குறைபாடு உள்ள குழந்தைகள் கூடுதல் உணவுப் பொருட்களுக்கு தகுதியுடையவர்கள்.
An underweight person is a person whose body weight is considered too low to be healthy,சாதாரண நபரின் எடையை விட உடல் எடை குறைவாக இருக்கும் நபர் எடை குறைந்தவராக கருதப்படுகிறார்
Balasore Sadar II,பாலஸோர் சதர் II
Project 1 Selvapuram,புராஜக்ட் 1 செல்வபுரம்
East Golaghat Icds,கிழக்கு கோலாகாட் ஐ. சி. டி. எஸ்.
Gangarampur ICDS Project,கங்காராம்பூர் ஐ. சி. டி. எஸ். புராஜக்ட்
Please enter Mobile Number,தயவு செய்து மொபைல் எண்ணை உள்ளிடவும்
Rewa - R,ரேவா - ஆர்
South West Garo Hills,தென் மேற்கு கரோ ஹில்ஸ்
When and how to use MPIN?,"எம்பின் ஐ எப்போது,   எப்படிப் பயன்படுத்துவது?"
"We also send SMSs on your registered mobile number to alert you about registration, we also use your information to respond to you when you contact us and to investigate, respond to and resolve complaints and for Service issues (e. g. bugs).","பதிவுசெய்தல் குறித்து உங்களை எச்சரிக்க உங்கள் பதிவு செய்யப்பட்ட மொபைல் எண்ணுக்கு SMS அனுப்புகிறோம், நீங்கள் எங்களைத் தொடர்புகொள்ளும்போது உங்களுக்குப் பதிலளிக்கவும், புகார்களை விசாரிக்கவும், பிரச்னைகளைத் தீர்க்கவும், சேவைச் சிக்கல்களுக்கு (எ. கா. பிழைகள்) உங்கள் தகவலைப் பயன்படுத்துகிறோம்."
Ensuring that complementary feeding improves over time,காலப்போக்கில் துணை உணவு மேம்படுவதை உறுதி செய்தல்
Memari - I Addl.,மேமரி - I அடிஷனல்
Using ABHA (Health ID) is the first step towards creating safer and efficient digital health records for you and your family.,உங்களுக்கும் உங்கள் குடும்பத்துக்கும் பாதுகாப்பான மற்றும் திறமையான டிஜிட்டல் ஹெல்த் ரெக்கார்டுகளை உருவாக்குவதற்கான முதல் படி ABHA (ஹெல்த் ஐடி) ஐப் பயன்படுத்துவது தான்.
NALHATI-I A ICDS PROJECT (NGO),நல்ஹதி-I ஏ. ஐசிடிஎஸ் புராஜக்ட் (என் ஜி ஓ)
ABHA (earlier known as Health ID) is an acronym for Ayushman Bharat Health Account.,ABHA (முன்பு ஹெல்த் ஐடி என அறியப்பட்டது) என்பது ஆயுஷ்மான் பாரத் ஹெல்த் அக்கவுண்ட் என்பதன் சுருக்கமாகும்.
AWW/AWCs can only be added by nodal level official.Anybody in the above rank in the hierarchy.,"அடபிள்யூடபிள்யூ / அடபிள்யூசி களை நோடல் நிலை அதிகாரியால் மட்டுமே சேர்க்க முடியும்.வரிசைக்கு மேலே உள்ள எவரும்.தேசிய அளவிலான பயனர் மாநில, மாவட்டம், திட்டம் மற்றும் துறை அளவிலான பயனர்களை உருவாக்க முடியும்.மாநில அளவிலான பயனர் மாவட்ட, திட்ட மற்றும் துறை அளவிலான பயனர்களை உருவாக்க முடியும், மாவட்ட அளவிலான பயனர் திட்ட மற்றும் துறை மட்ட பயனரை உருவாக்க முடியும், திட்ட அளவிலான பயனர் துறை அளவிலான பயனர்.காவை உருவாக்க முடியும்."
Please enter valid DOB,சரியான பிறந்த தேதியை (DOB) உள்ளிடவும்
Raghunathganj - II Addl.,ரகுநாத்கஞ்ஜ் - II அடிஷனல்
Where can I enquire about take home ration?,வீட்டிற்கு எடுத்துச் செல்லும் ரேஷன் பற்றி நான் எங்கே கேட்கலாம்?
Kaying - Payum,கேயிங் - பாயும்
Hot Cooked Meal,சூடான சமைத்த உணவு
ATTENDANCE OF CHILDREN TODAY,இன்று குழந்தைகளின் கவனம்
How Poshan Tracker Works,போஷன் டிராக்கர் எவ்வாறு செயல்படுகிறது
Upper Dibang Valley,மேல் திபாங் பள்ளத்தாக்கு
 R. K. Nagar, ஆர். கே. நகர்
South Bungtlang ICDS Project,தெற்கு பங்ட்லாங் ஐ. சி. டி. எஸ். திட்டம்
We use the information we collect from all our services for the following purposes:,எங்கள் எல்லா சேவைகளிலிருந்தும் நாங்கள் சேகரிக்கும் தகவலை பின்வரும் நோக்கங்களுக்காகப் பயன்படுத்துகிறோம்ஃ
Identification & Referral of Sick Newborn,உடம்பு சரியில்லாத புதிதாகப் பிறந்த குழந்தையை அடையாளம் கண்டு பரிந்துரைத்தல்
Sant Kabir Nagar,சாந்த் கபீர் நகர்
 XIV. CORRECTNESS OF DATA PROVIDED BY THIRD PARTY SYSTEMS, XIV. மூன்றாம் தரப்பு அமைப்புகளால் வழங்கப்பட்ட தரவுகளின் சரியான தன்மை
Beneficiary concerns accessibility to AWW,AWW-ஐ அணுகுவது பற்றி பயனாளரின் கவலைகள்
Nabadwip Urban ICDS Project,நபத்வீப் அர்பன் ஐ. சி. டி. எஸ். புராஜக்ட்
Monday to Friday,திங்கள் முதல் வெள்ளி வரை
Please select Gender,உங்களுடைய பாலினத்தைத் தேர்ந்தெடுக்கவும்
Andaman & Nicobar Islands,அந்தமான் மற்றும் நிக்கோபார் தீவுகள்
Please Select Description,டிஸ்க்ரிப்ஷன் ஐத் தேர்ந்தெடுக்கவும்
Kaliachak - I Adl.,காலியாசக் - I அடிஷனல்
NEEM KA THANA,நீம் கா தானா
Who is eligible for Take Home Ration?,வீட்டுக்கு ரேஷன் எடுத்துச் செல்ல யார் தகுதியானவர்?
Golghat West Icds Project,கோல்காட் மேற்கு ஐ. சி. டி. எஸ். புராஜக்ட்
Jorebunglow - Sukhiapokhri,ஜோரேபங்க்ளோ - சுகியாபோக்ரி
Supporting mothers with issues in Breastfeeding,தாய்ப்பால் கொடுப்பதில் சிக்கல் உள்ள தாய்மார்களுக்கு ஆதரவு அளித்தல்
Barasat - I,பாராஸட் - I
Bakshi Ka Talab,பக்ஷி கா தாலாப்
Harishchandrapur - II,ஹரிஸ்சந்திரபூர் - II
"The purpose of POSHAN Tracker application is to provide a 360-degree view of the activities of the Anganwadi Centre (AWC), service deliveries of Anganwadi Workers (AWWs) and complete beneficiary management for pregnant women, lactating mothers and children.The proposed system should enable real-time monitoring and tracking of all AWCs, AWWs and beneficiaries on the defined indicators.","போஷான் டிராக்கர் பயன்பாட்டின் நோக்கம் அங்கன்வாடி மையத்தின் (ஏ. டபிள்யூ. சி) செயல்பாடுகள், அங்கன்வாடி தொழிலாளர்களின் சேவை வழங்கல்கள் (ஏ. டபிள்யூ. டபிள்யூ) மற்றும் கர்ப்பிணிப் பெண்கள், பாலூட்டும் தாய்மார்கள் மற்றும் குழந்தைகளுக்கான முழுமையான பயனாளி மேலாண்மை பற்றிய 360 டிகிரி பார்வையை வழங்குவதாகும்.முன்மொழியப்பட்ட அமைப்பு வரையறுக்கப்பட்ட குறிகாட்டிகளில் அனைத்து AWC கள், AWW கள் மற்றும் பயனாளிகளின் நிகழ்நேர கண்காணிப்பு மற்றும் கண்காணிப்பை செயல்படுத்த வேண்டும்."
Madhubani - Bihar,மதுபனி - பீகார்
Last 7 days,கடந்த 7 நாட்கள்
Above standards are defined as per given above mentioned age brackets,மேலே குறிப்பிடப்பட்ட தரநிலைகள் வயது வரம்புகளின்படி வரையறுக்கப்பட்டுள்ளன
"If a person is underweight, their body may not be getting the nutrients it needs to build healthy bones, skin and hair","ஒரு நபர் எடை குறைவாக இருந்தால், ஆரோக்கியமான எலும்புகள், தோல் மற்றும் முடியை உருவாக்க தேவையான ஊட்டச்சத்துக்கள் அவரது உடலுக்கு கிடைக்காமல் போயிருக்கலாம்"
Please select State,தயவு செய்து மாநிலத்தைத் தேர்ந்தெடுக்கவும்
Ngopa ICDS Project,என்கோபா ஐ. சி. டி. எஸ். திட்டம்
Magrahat - II Addl ICDS,மாக்ராஹட் -II அடிஷனல் ஐ. சி. டி. எஸ். புராஜக்ட்
Sabroom NP ICDS project,சாப்ரூம் என்பி ஐ. சி. டி. எஸ். புராஜக்ட்
MPIN can be set by respective Anganwadi worker by requesting an OTP against his/her mobile number.,அந்தந்த அங்கன்வாடி ஊழியரால் அவரது / அவள் மொபைல் எண்ணுக்கு எதிராக OTP கோருவதன் மூலம் எம்பின் ஐ அமைக்கலாம்.
"If Mobile number is already present in the database, the respective Anganwadi person will receive 4 digits OTP on registered mobile number.","மொபைல் எண் ஏற்கனவே தரவுத்தளத்தில் இருந்தால், அந்தந்த அங்கன்வாடி நபர் பதிவு செய்யப்பட்ட மொபைல் எண்ணில் 4 இலக்க OTP ஐப் பெறுவார்."
"Post entering the OTP, AWW can easily set customized MPIN.","OTP க்குள் நுழைந்த பின், அங்கன்வாடி ஊழியர்கள் தனிப்பயனாக்கப்பட்ட எம்பின் ஐ எளிதாக அமைக்க முடியும்."
"It enables your interaction with participating healthcare providers, and allows you to receive your digital lab reports, prescriptions and diagnosis seamlessly from verified healthcare professionals and health service providers.","இது சுகாதார வழங்குநர்களுடன் உங்கள் தொடர்புகளை செயல்படுத்துகிறது, மேலும் சுகாதார நிபுணர்கள் மற்றும் சுகாதார சேவை வழங்குநர்களிடமிருந்து உங்கள் டிஜிட்டல் ஆய்வக அறிக்கைகள், மருந்துச்சீட்டுகள் மற்றும் நோயறிதல் ஆகியவற்றை தடையின்றி பெற அனுமதிக்கிறது."
Alipurduar - I,அலிபுர்த்வார் - I
Poshan Tracker Features,போஷன் டிராக்கர் அம்சங்கள்
Why this Monthly Meeting?,ஏன் இந்த மாதாந்திர கூட்டம்?
Urban Slum Project,நகர்ப்புற சேரி திட்டம்
Our System provides API to Third – Party Sites that may collect your personal information.,உங்கள் தனிப்பட்ட தகவல்களைச் சேகரிக்கக்கூடிய மூன்றாம் தரப்பு தளங்களுக்கு எங்கள் அமைப்பு API ஐ வழங்குகிறது.
Poshan Tracker is not in any manner responsible for the security of such information or their privacy practices or content of those Third – Party Sites.,அத்தகைய தகவல் அல்லது அவர்களின் தனியுரிமை நடைமுறைகள் அல்லது அந்த மூன்றாம் தரப்பு தளங்களின் உள்ளடக்கத்திற்கு போஷன் டிராக்கர் எந்த வகையிலும் பொறுப்பாக இல்லை.
"Additionally, you may also encounter “cookies” or other similar devices on certain pages of the Third – Party Sites and it is hereby clarified by Poshan Tracker that the System does not control the use of cookies by these Third – Party Sites.","கூடுதலாக, மூன்றாம் தரப்பு தளங்களின் சில பக்கங்களில் ""குக்கீகள்"" அல்லது பிற ஒத்த சாதனங்களையும் நீங்கள் சந்திக்கலாம், மேலும் இந்த மூன்றாம் தரப்பு தளங்கள் குக்கீகளைப் பயன்படுத்துவதை கணினி கட்டுப்படுத்தாது என்பதை போஷன் டிராக்கர் மூலம் தெளிவுபடுத்துகிறது."
