eng,ta
What is Poshan Abhiyaan?,போஷன் அபியான் என்றால் என்ன?
Moderately Wasted (MAM),மிதமான ஊட்டச்சத்து குறைபாடு (MAM)
Hingoli (Balapur Akhada),ஹிங்கோலி (பாலாபூர் அகாடா)
Ldh Urban 3,லூதியானா அர்பன் 3
South Golaghat Icds Project,தெற்கு கோலாகாட் ஐ. சி. டி. எஸ். புராஜக்ட்
East Garo Hills,கிழக்கு கரோ ஹில்ஸ்
Alipurduar - I Addl.,அலிபுர்த்வார் - I அடிஷனல்
Mal Adl 1,மால் அடிஷனல் 1
The Site is directed to the people residing in India.,இந்த தளம் இந்தியாவில் வசிக்கும் மக்களுக்கு மட்டுமே.
We do not represent that Content available on or through the Site is appropriate or available in other locations.,தளத்தில் கிடைக்கும் உள்ளடக்கம் சரியானது அல்லது பிற இடங்களில் உள்ளது என்பதை நாங்கள் குறிப்பிடவில்லை.
We may limit the availability of the Site or any service or product described on the Site to any person or geographic area at any time.,எந்த நேரத்திலும் எந்தவொரு நபருக்கும் அல்லது புவியியல் பகுதிக்கும் தளத்தில் விவரிக்கப்பட்டுள்ள தளம் அல்லது எந்தவொரு சேவை அல்லது தயாரிப்பின் கிடைக்கும் தன்மையை நாங்கள் கட்டுப்படுத்தலாம்.
"If you choose to access the Site from outside India, you do so at your own risk.","இந்தியாவிற்கு வெளியே இருந்து தளத்தை அணுக நீங்கள் தேர்வுசெய்தால், உங்கள் சொந்த ஆபத்தில் அதைச் செய்கிறீர்கள்."
NORTH DUM DUM,வடக்கு டம் டம்
Please go back to the homepage,முகப்புப்பக்கத்திற்குச் செல்லவும்
Please select Anganwadi center,தயவு செய்து அங்கன்வாடி மையத்தைத் தேர்ந்தெடுக்கவும்
Central Zone Rmc,மத்திய மண்டலம் ஆர்எம்சி
"National Nutrition Mission named as the Hon’ble Prime Minister’s Overarching Scheme for Holistic Nutrition (POSHAN) Abhiyaan was launched in 2017, as a multi-ministerial convergence mission, with the overarching vision to make India malnutrition free by 2022.","க ரவ பிரதமரின் முழுமையான ஊட்டச்சத்துக்கான திட்டம் (போஷான்) என பெயரிடப்பட்ட தேசிய ஊட்டச்சத்து மிஷன், 2017 ஆம் ஆண்டில், பல அமைச்சர்கள் ஒன்றிணைக்கும் பணியாக, 2022 ஆம் ஆண்டில் இந்தியா ஊட்டச்சத்துக் குறைபாட்டை இலவசமாக்குவதற்கான விரிவான பார்வையுடன் தொடங்கப்பட்டது."
Bankura - I,பங்குரா- I
Icds Project Vijaypur, ஐ. சி. டி. எஸ். புராஜக்ட் விஜய்பூர்
 XI. VIOLATION OF THESE TERMS, XI. இந்த விதிமுறைகளை மீறுதல்
Rampurhat - I,ராம்பூர்ஹட் - I
Mirzapur City 2,மிர்ஸாபூர் நகரம் 2
"All personal information collected from you under Clause 1 at the time of registration will be retained for as long as your record remains in existence and if any medical or administrative interventions have been commenced under Clause 2, subject to Clause4(b) below, for such period thereafter as is required for such interventions to be completed.","பதிவு செய்யும் போது பிரிவு 1ன் கீழ் உங்களிடமிருந்து சேகரிக்கப்பட்ட அனைத்து தனிப்பட்ட தகவல்களும் உங்கள் பதிவு இருக்கும் வரையில் சேமிக்கப்படும் மற்றும் ஏதேனும் மருத்துவ அல்லது நிர்வாகத் தலையீடுகள் கீழே உள்ள உட்பிரிவு 4(b) க்கு உட்பட்டு பிரிவு 2ன் கீழ் தொடங்கப்பட்டிருந்தால், அத்தகைய தலையீடுகள் முடிக்கப்படுவதற்கு தேவையான கால அவகாசம் எடுக்கப்படும்."
"All personal information collected under Clauses 1 will be retained on the application Server, to the extent that such information relates to people who have been registered for the event.","உட்பிரிவு 1ன் கீழ் சேகரிக்கப்பட்ட அனைத்து தனிப்பட்ட தகவல்களும், நிகழ்வுக்காகப் பதிவுசெய்யப்பட்ட நபர்களுடன் தொடர்புடைய தகவல்களின் அளவிற்கு, பயன்பாட்டு சேவையகத்தில் சேமிக்கப்படும்."
"Nothing set out herein shall apply to the anonymized, aggregated datasets generated by the personal data of registered users of Poshan Tracker or any reports, heat maps or other visualization created using such datasets.","போஷன் டிராக்கர் இன் பதிவுசெய்யப்பட்ட பயனர்களின் தனிப்பட்ட தரவு அல்லது அத்தகைய தரவுத்தொகுப்புகளைப் பயன்படுத்தி உருவாக்கப்பட்ட அறிக்கைகள், வெப்ப வரைபடங்கள் அல்லது பிற காட்சிப்படுத்தல் மூலம் உருவாக்கப்பட்ட அநாமதேய, ஒருங்கிணைந்த தரவுத்தொகுப்புகளுக்கு இங்கு குறிப்பிடப்பட்டுள்ள எதுவும் பொருந்தாது."
Number Of Positions,பணியிடங்களின் எண்ணிக்கை
Please enter Height greater than 29.99 and less than 140.01,29.99 க்கும் அதிகமான உயரம் மற்றும் 140.01 க்கும் குறைவான உயரத்தை உள்ளிடவும்
"While login to the Poshan Tracker App, AWWs are required to enter the MPIN set by them.","போஷன் ட்ராக்ஜெர் பயன்பாட்டில் உள்நுழையும்போது, அங்கன்வாடி ஊழியர்கள் அவர்கள் அமைத்த எம்பின் ஐ உள்ளிட வேண்டும்."
This MPIN will act as a passcode to run the Poshan Tracker App and entering the information in the beneficiaries forms.,இந்த எம்பிநான்என் போஷன் டிராக்கர் பயன்பாட்டை இயக்குவதற்கான கடவுக்குறியீடாக செயல்படும் மற்றும் பயனாளிகளின் படிவங்களில் தகவல்களை உள்ளிடும்.
Matigara ICDS Project( Main ),மதிகரா ஐ. சி. டி. எஸ். புராஜக்ட் (மெயின்)
How to ensure timely initiation of complementary feeding,துணை உணவுகளை சரியான நேரத்தில் தொடங்குவதை எவ்வாறு உறுதிப்படுத்துவது
20 December 2021,20 டிசம்பர் 2021
Poshan Tracker App can only be installed in Android Phone with Android version 6.0 and above.,போஷான் டிராக்கர் பயன்பாட்டை ஆண்ட்ராய்டு பதிப்பு 6.0 மற்றும் அதற்கு மேற்பட்ட ஆண்ட்ராய்டு தொலைபேசியில் மட்டுமே நிறுவ முடியும்.
Please Enter Mobile Number,மொபைல் எண்ணை உள்ளிடவும்
Request for Hot Cooked Meal,சமைக்கப்பட்ட சூடான உணவுக்கான கோரிக்கை
Hasnabad ICDS Project,ஹாஸ்னாபாத் ஐ. சி. டி. எஸ். புராஜக்ட்
RAIPUR URBAN 1,ரெய்ப்பூர் அர்பன் 1
General Awareness about Growth Monitoring of Children,குழந்தைகளின் வளர்ச்சி கண்காணிப்பு பற்றிய பொது விழிப்புணர்வு
Bhind - R,பிந்த்-ஆர்
Bastar - Chhattisgarh,பஸ்தர் - சத்தீஸ்கர்
Please select Help Topic,தயவு செய்து உதவித் தலைப்பைத் தேர்ந்தெடுக்கவும்
SINGUR - Addl,சிங்கூர் - அடிஷனல்
Wasting is defined as low weight-for-height,ஊட்டச்சத்து குறைபாடு என்பது குறைந்த எடை-உயரம் என வரையறுக்கப்படுகிறது
Hot Cooked Meal (HCM) Given Today,இன்று கொடுக்கப்பட்ட சூடான சமைத்த உணவு (HCM)
There are 6 categories for beneficiariesPregnant WomenLactating MotherChildren from 0 to 6 monthsChildren from 6 months to 3 yearsChildren from 3 years to 6 yearsAdolescent girls,பயனாளிகளுக்கு 6 பிரிவுகள் உள்ளனகர்ப்பிணி பெண்கள்பாலூட்டும் தாய்மார்கள்0 முதல் 6 மாதங்கள் வரை உள்ள குழந்தைகள்6 மாதங்கள் முதல் 3 ஆண்டுகள் வரை உள்ள குழந்தைகள்3 வயது முதல் 6 வயது வரையிலான குழந்தைகள்வாலிபப் பெண்கள்
"Data Plan for Mobile Application (01 March, 2021)","மொபைல் பயன்பாட்டிற்கான தரவு திட்டம் (01 மார்ச், 2021)"
Old  Amravati Urban,பழைய அமராவதி அர்பன்
The WHO Multicentre Growth Reference Study (MGRS) was undertakenbetween 1997 and 2003 to generate new growth curves for assessing the growth and development of infants and young children around the world,உலகெங்கிலும் உள்ள கைக்குழந்தைகள் மற்றும் சிறு குழந்தைகளின் வளர்ச்சி மற்றும் வளர்ச்சியை மதிப்பிடுவதற்கான புதிய வளர்ச்சி வளைவுகளை உருவாக்க 1997 மற்றும் 2003 க்கு இடையில் WHO மல்டிசென்டர் க்ரோத் ரெஃபரன்ஸ் ஸ்டடி (MGRS) மேற்கொள்ளப்பட்டது
Garbeta - I,கர்பேடா - I
How to set MPIN?,எம்பின் அமைப்பது எப்படி?
Rewa - Urban,ரேவா - ரூரல்
 VIII. LIMITATIONS OF MULTI- LINGUAL INTERFACE, VIII. பல மொழி இடைமுகத்தின் வரம்புகள்
Diamond Harbour-I ICDS Project,டயமண்ட் ஹார்பர் - I
Srijangram I. C. D. S. Project,ஸ்ரீஜான்கிராம் ஐ. சி. டி. எஸ். புராஜக்ட்
"We may investigate any violation of these Terms, including unauthorized use of the Site.","தளத்தின் அங்கீகரிக்கப்படாத பயன்பாடு உட்பட, இந்த விதிமுறைகளை மீறினால் நாங்கள் விசாரிக்கலாம்."
We may provide law enforcement with information you provide to us related to your transactions to assist in any investigation or prosecution of you.,உங்கள் பரிவர்த்தனைகள் தொடர்பாக நீங்கள் எங்களுக்கு வழங்கிய தகவலை சட்ட அமலாக்கத்திற்கு நாங்கள் வழங்கலாம்.
We may take legal action that we feel is appropriate.,பொருத்தமற்றதாக நாங்கள் கருதும் தகவலின் மீது சட்ட நடவடிக்கை எடுக்கலாம்.
"If we determine that you have violated these Terms or the law, or for any other reason or for no reason, we may block your account and will prevent you from accessing the Site at any time without notice to you.","வேறு எந்த காரணத்திற்காகவும் அல்லது காரணமின்றி நீங்கள் இந்த விதிமுறைகள் அல்லது சட்டத்தை மீறியுள்ளீர்கள் என்று நாங்கள் தீர்மானித்தால், நாங்கள் உங்கள் கணக்கைத் தடுக்கலாம் மற்றும் எந்த நேரத்திலும் உங்களுக்கு அறிவிப்பு இல்லாமல் தளத்தை அணுகுவதைத் தடுப்போம்."
There are limited fields for data entry.Name is required to be entered in English language and for other fields numeric values are required.Most of the features are provided in check boxes or with drop down selection menu.Reports to be updated.,அடபிள்யூடபிள்யூ படிவத்தை நிரப்புவதை ஆங்கில மொழியில் மட்டுமே செய்ய முடியும்.
P P Kamaicha,பி பி கமைசா
Children between 3-6 Years,3-6 வயதுக்குட்பட்ட குழந்தைகள்
Poshan Calculator helps to identify various health conditions of the child as per World Health Organization (WHO) standards,உலக சுகாதார அமைப்பின் (WHO) தரநிலைகளின்படி குழந்தையின் பல்வேறு சுகாதார நிலைமைகளை கண்டறிய போஷன் கால்குலேட்டர் உதவுகிறது
General Awareness on Mother Care,தாய் பராமரிப்பு பற்றிய பொது விழிப்புணர்வு
Mal Adl 2,மால் அடிஷனல் 2
New Poshan Tracker App,புதிய போஷன் டிராக்கர் ஆப்
How to take care of weak newborn with the help of Kangaroo Mother Care,கங்காரு மதர் கேரின் உதவியுடன் பலவீனமான புதிதாகப் பிறந்த குழந்தையை எவ்வாறு பராமரிப்பது
Siliguri II (U),சிலிகுரி II (யு)
Old Urban Project 1,பழைய நகர்ப்புற திட்டம் 1
District Performance across 6 KPIs,6 KPIகள் முழுவதும் மாவட்ட செயல்திறன்
Kaliyaganj ICDS Project,காலியாகஞ்ஜ் ஐ. சி. டி. எஸ். புராஜக்ட்
Turbhe-Panvel Navi Mumbai,டர்பே-பன்வெல் நவி மும்பை
East Zone Rmc,கிழக்கு மண்டலம் ஆர்எம்சி
Bagh Kare Khan,பாக் கரே கான்
"Shenoy Nagar,Project 1","ஷெனாய் நகர், புராஜக்ட் 1"
"The ASPs collecting data from Poshan Tracker and displaying to users shall be solely responsible for the correctness of such data and any liability arising out of any data so provided, shall completely rest with such third party.",போஷன் டிராக்கர் இலிருந்து தரவைச் சேகரித்து பயனர்களுக்குக் காண்பிக்கும் ASPகள் அத்தகைய தரவின் சரியான தன்மைக்கு அவர்கள் மட்டுமே பொறுப்பாவார்கள் மற்றும் அவ்வாறு வழங்கப்பட்ட எந்தவொரு தரவிலிருந்து எழும் எந்தவொரு பொறுப்பும் மூன்றாம் தரப்பினர் உடையதாக இருக்கும்.
"Any liabilities civil or criminal, arising out of any incorrect data, shall solely lie with the concerned ASP.","தவறான தரவுகளிலிருந்து எழும், எந்தவொரு சிவில் அல்லது கிரிமினல் பொறுப்புகள், ஏதேனும் சம்பந்தப்பட்ட ஏஎஸ்பியிடம் மட்டுமே இருக்கும்."
ICDS Khadur Sahib, ஐ. சி. டி. எஸ். காதூர் சாஹிப்
Poshan Tracker App is available over Google playstore https://play. google. com/store/apps/details?,கூகிள் பிளேஸ்டோர் மூலம் போஷன் டிராக்கர் பயன்பாடு https://play. google. com/store/apps/details?
 id=com. poshantracker, id=com. poshantracker.
Can App be accessed without internet?,இணையம் இல்லாமல் அபிபி ஐ அணுக முடியுமா?
The Government has taken several initiatives to break the intergenerational cycle of malnutrition in children.,குழந்தைகளில் ஊட்டச்சத்து குறைபாட்டின் இடைநிலை சுழற்சியை உடைக்க அரசாங்கம் பல முயற்சிகளை எடுத்துள்ளது.
"Adopting a life-cycle approach, interventions have been designed to meet the nutritional requirement of adolescent girls and boys, pregnant women, lactating mothers and children.","வாழ்க்கைச் சுழற்சி அணுகுமுறையை ஏற்றுக்கொள்வது, இளம் பருவ பெண்கள் மற்றும் சிறுவர்கள், கர்ப்பிணிப் பெண்கள், பாலூட்டும் தாய்மார்கள் மற்றும் குழந்தைகளின் ஊட்டச்சத்து தேவைகளைப் பூர்த்தி செய்ய தலையீடுகள் வடிவமைக்கப்பட்டுள்ளன."
Dhupguri Adl 2,துப்குரி அடிஷனல் 2
Nalhati - II,நல்ஹதி - II
Awareness for Pregnancy in Preventing Anemia,கர்ப்ப காலத்தில் இரத்த சோகை வராமல் தடுப்பது குறித்த விழிப்புணர்வு
Last 30 days,கடந்த 30 நாட்கள்
"Howrah North (U) I. C. D. S. Project, Howrah","ஹௌரா வடக்கு (யு) ஐ. சி. டி. எஸ். புராஜக்ட், ஹௌரா"
Ranaghat 1 Addl,ரணகட் 1 அடிஷனல்
Query Related to,குவெரி ரிலேடெட் டு
Dhar - U,தர்- யு
South Garo Hills,தெற்கு கரோ ஹில்ஸ்
3. SHARING OF INFORMATION,3. தகவல் பகிர்வு
Birth Preparedness- For Institutional and Home Delivery,பிறப்புத் தயார்நிலை- நிறுவன மற்றும் வீட்டுப் பிரசவத்திற்கு
New beneficiary addition with skip OTP option,ஓ டி பியைத் தவிர்க்கும் விருப்பத் தேர்வுடனான புதிய பயனாளர் சேர்ப்பு
We are now available on Video Conference,வீடியோ கான்பரன்ஸ் மூலம் தற்போது நாம்
Data Plan for Mobile Application,மொபைல் பயன்பாட்டிற்கான மொபைல் டேட்டா திட்டங்கள்
North West Delhi,வட மேற்கு டெல்லி
English Bazar &amp,இங்கிலிஷ் பஜார் &amp
2.6. Surveys and Feedbacks.,2.6. ஆய்வுகள் மற்றும் கருத்துகள்.
"Poshan Tracker App is meant for Aanganwadi workers, Anganwadi centers to enter beneficiaries data in the forms.","போஷன் டிராக்கர் ஆப் என்பது ஆங்கன்வாடி தொழிலாளர்கள், அங்கன்வாடி மையங்கள் பயனாளிகளின் தரவை படிவங்களில் உள்ளிடுவதற்கானது."
It is not at all developed for general public.,இது பொது மக்களுக்காக உருவாக்கப்படவில்லை.
Get In Touch,தொடர்பில் இருங்கள்
ICDS NAUSHERA PANNUAN, ஐ. சி. டி. எஸ். நௌஷீரா பன்னுவான்
