eng,ta
Your request is received.Please note down the ticket number for future reference.,உங்கள் கோரிக்கை வரப்பெற்றது எதிர்காலக் குறிப்புக்காக தயவு செய்து டிக்கட் எண்ணைக் குறித்துக் கொள்ளவும்
Please enter Ticket Number,தயவு செய்து டிக்கட் எண்ணை உள்ளிடவும்
We believe in building doers.Poshan Tracker is a project of Ministry of Women and Child Development.Digital India Corporation is the technical partner of MoWCD.Poshan Tracker focuses on eradication of malnutrition from India.It serves as a mechanism to monitor and improvise on the service delivery under Poshan Abhiyaan,"செயல்புரிபவர்களை உருவாக்குவதில் நாங்கள் நம்பிக்கை கொண்டுள்ளோம் போஷன் டிராக்கர் மகளிர் மற்றும் சிறுவர் முன்னேற்ற அமைச்சகத்தின் திட்டமாகும் டிஜிடல் இந்தியா கார்ப்பரேஷன் MoWCD.-இன் தொழில்நுட்பக் கூட்டாளியாகும் இந்தியாவிலுருந்து ஊட்டச்சத்துக் குறைவை அறவே ஒழிப்பதில் போஷன் டிராக்கர் கவனம் செலுத்துகிறது.அது போஷன் அபியானின் கீழ் சேவை வழங்குதலைக் கண்காணிப்பதற்கும், மேன்மைப்படுத்தவதற்குமான ஒரு மெகானிசமாகச் செயல்படுகிறது."
Turvihal - Kannatagi,துர்விழல் - கன்னடகி
Anganwadi Worker Training,அங்கண்வாடி ஊழியர் பயிற்சி
St Thomas Mount,செயின்ட் தாமஸ் மவுண்ட்
Please Select Beneficiary Category,தயவுசெய்து பயனாளி வகையைத் தேர்ந்தெடுக்கவும்
Purbasthali - II,புர்பஸ்தாலி- II
3.2. Legal Disclosures.,3.2. சட்ட வெளிப்பாடுகள்.
Is poshan trackers app available over Apple I Store also?,ஆப்பிள் ஐ ஸ்டோரிலும் போஷன் டிராக்ஸ் பயன்பாடு கிடைக்குமா?
Number of records becoming inactive and number of records migrating from one category to another,செயலற்றவையாக ஆகிக் கொண்டிருக்கும் பதிவுகளின் எண்ணிக்கை மற்றும் ஒரு வகையிலிருந்து இன்னொன்றுக்கு மாறும் பதிவுகளின் எண்ணிக்கை
Purulia - I,புருலியா - I
In How many languages the Poshan Tracker App is available?,போஷன் டிராக்கர் பயன்பாடு எத்தனை மொழிகளில் கிடைக்கிறது?
BUDGE BUDGE - I,பட்ஜ் பட்ஜ் - I
AWWs are requested to enter their mobile numbers in the Login screen.,அங்கன்வாடி ஊழியர்கள் உள்நுழைவுத் திரையில் தங்கள் மொபைல் எண்களை உள்ளிடுமாறு கேட்டுகொள்ளப்படுகின்றனர்.
"An OTP will be sent to your registered mobile number, post which you are required too set your MPIN.","உங்கள் பதிவுசெய்யப்பட்ட மொபைல் எண்ணுக்கு ஒரு OTP அனுப்பப்படும்,அதற்கு பிறகு உங்கள் எம்பின் ஐ அமைக்கவும்."
About Poshan Tracker,போஷன் டிராக்கர் பற்றி
Adilabad - Telangana,ஆதிலாபாத் - தெலுங்கானா
CHINSURAH-MOGRA ICDS PROJECT,சின்சுரா-மோக்ரா ஐ. சி. டி. எஸ். புராஜக்ட்
Ravang Rural Project,ரவாங் கிராமப்புற திட்டம்
Kakdwip ICDS Project,காக்த்வீப் ஐ. சி. டி. எஸ். புராஜக்ட்
Request for Home Visit,வீட்டுக்கு வர வேண்டும் என்ற கோரிக்கை
AWW Position Filled,AWW பதவி நிரப்பப்பட்டது
East Khasi Hills,கிழக்கு காசி மலைகள்
Chakchaka Icds Project Sorbhog,சக்சகா ஐ. சி. டி. எஸ். புராஜக்ட் ஸார்பாக்
EGRA-II ICDS PROJECT,எக்ரா -II ஐ. சி. டி. எஸ். புராஜக்ட்
Mirzapur City 1,மிர்ஸாபூர் நகரம் 1
Measles Containing vaccine (MCV)/MR-2JE-2**DiphtheriaPertussis & Tetanus (DPT)-Booster-1OPV –Booster,தட்டம்மை கொண்ட தடுப்பூசி (MCV)/MR-2JE-2**தொண்டை அடைப்பான் நோய்பெர்டுசிஸ் & டெட்டனஸ் (DPT)-பூஸ்டர்-1OPV - பூஸ்டர்
The Poshan Tracker enables real-time monitoring and tracking of all AWCs and beneficiaries on defined indicators.,போஷன் டிராக்கர் ஆனது அனைத்து AWCகள் மற்றும் பயனாளிகளின் நிகழ்நேர கண்காணிப்பு மற்றும் வரையறுக்கப்பட்ட குறிகாட்டிகளில் கண்காணிப்பதை செயல்படுத்துகிறது.
It is built using centralized data architecture that also aligns with the digital technology systems of other ministries and programs.,இது மற்ற அமைச்சகங்கள் மற்றும் திட்டங்களின் டிஜிட்டல் தொழில்நுட்ப அமைப்புகளுடன் இணைந்த மையப்படுத்தப்பட்ட தரவு கட்டமைப்பைப் பயன்படுத்தி கட்டமைக்கப்பட்டுள்ளது.
"The objective is to provide a 360-degree view of the activities of the Anganwadi Centre (AWC), service deliveries of Anganwadi Workers (AWWs) and complete beneficiary management for pregnant women, lactating mothers and children.","அங்கன்வாடி மையத்தின் (AWC) செயல்பாடுகள், அங்கன்வாடி பணியாளர்களின் (AWWs) சேவை வழங்கல்கள் மற்றும் கர்ப்பிணிப் பெண்கள், பாலூட்டும் தாய்மார்கள் மற்றும் குழந்தைகளுக்கான முழுமையான பயனாளிகள் மேலாண்மை ஆகியவற்றின் 360 டிகிரி பார்வையை வழங்குவதே இதன் நோக்கமாகும்."
The public dashboard helps to impart transparency on services delivered to beneficiaries,public dashboard பயனாளிகளுக்கு வழங்கப்படும் சேவைகளில் வெளிப்படைத்தன்மையை வழங்க உதவுகிறது
Translations on the Poshan Tracker Portal & App Chabot are done by third party translators.,போஷன் டிராக்கர் போர்ட்டல் & ஆப் சாட்போட் இல் மொழிபெயர்ப்புகள் மூன்றாம் தரப்பு மொழிபெயர்ப்பாளர்களால் செய்யப்படுகின்றன.
"While the translations are done on a best effort basis, some of the parts may be incorrect.","மொழிபெயர்ப்புகள் சிறந்த முயற்சியின் அடிப்படையில் செய்யப்பட்டாலும், சில பகுதிகள் தவறாக இருக்கலாம்."
Certain files and other items on the website cannot be translated.,இணையதளத்தில் உள்ள சில கோப்புகள் மற்றும் பிற உருப்படிகளை மொழிபெயர்க்க முடியாது.
"In addition, on translation, some applications and/or services may not function as expected, due to language barriers.","கூடுதலாக, மொழிபெயர்ப்பில், மொழி தடைகள் காரணமாக, சில பயன்பாடுகள் அல்லது சேவைகள் மொழி தடைகள் காரணமாக எதிர்பார்த்தபடி செயல்படாமல் போகலாம்."
"We are working constantly to rectify any errors, omissions, or ambiguities in the translations provided on this portal.","இந்த போர்ட்டலில் வழங்கப்பட்டுள்ள மொழிபெயர்ப்புகளில் ஏதேனும் பிழைகள், தவறுகள் அல்லது தெளிவின்மைகள் இருந்தால் அவற்றைத் திருத்துவதற்கு நாங்கள் தொடர்ந்து பணியாற்றி வருகிறோம்."
AWH Position Filled,AWH பதவி நிரப்பப்பட்டது
"The MGRS collected primary growth data and related information from approximately 8500 children from widely different ethnic backgrounds and cultural settings (Brazil, Ghana, India, Norway, Oman and the USA)","MGRS ஆனது பல்வேறு இனப் பின்னணிகள் மற்றும் கலாச்சார அமைப்புகளைச் சேர்ந்த (பிரேசில், கானா, இந்தியா, நார்வே, ஓமன் மற்றும் அமெரிக்கா) சுமார் 8500 குழந்தைகளிடமிருந்து முதன்மை வளர்ச்சித் தரவு மற்றும் தொடர்புடைய தகவல்களைச் சேகரித்தது"
Ratua - I Addl.,ரதுவா - I அடிஷனல்
Please enter Height,தயவுசெய்து உயரத்தை உள்ளிடவும்
Harda Gramin 2,ஹர்தா கிராமின் 2
Children of different age groups are monitored on monthly basis by AWWs.,வெவ்வேறு வயது குழந்தைகள் AWW களால் மாதாந்திர அடிப்படையில் கண்காணிக்கப்படுகிறார்கள்.
"Health indicators like Stunting, Wasting and Underweight prevalence are measured as per WHO standards.","உடல் வளர்ச்சி குன்றிய நிலை, உடல் தேய்மானம் மற்றும் எடை குறைவாக இருப்பது போன்ற சுகாதார குறிகாட்டிகள் WHO தரத்தின்படி அளவிடப்படுகிறது."
Regular growth monitoring helps AWWs to provide relevant and timely assistance to children,வளர்ச்சி கண்காணிப்பு AWW கள் குழந்தைகளுக்கு பொருத்தமான மற்றும் சரியான நேரத்தில் உதவி வழங்க உதவுகிறது
"Awareness for Children Stunting, Wasting to prevent malnutrition in children",குழந்தைகளின் வளர்ச்சி குன்றியிருப்பதற்கான விழிப்புணர்வு மற்றும் குழந்தைகளின் ஊட்டச்சத்து குறைபாட்டை தடுப்பதற்கான விழிப்புணர்வு
Create a New Ticket,புதிய டிக்கெட்டை உருவாக்கவும்
"The Site and all data, text, designs, pages, print screens, images, artwork, photographs, audio and video clips, HTML code, source code, or software that reside or are viewable or otherwise discoverable on the Site, and all participants booked from the Site, (collectively, termed as the “Content”) are owned by Ministry of Women and Child Development and their authorised service providers.","தளம் மற்றும் அனைத்து தரவு, உரை, வடிவமைப்புகள், பக்கங்கள், அச்சுத் திரைகள், படங்கள், கலைப்படைப்புகள், புகைப்படங்கள், ஆடியோ மற்றும் வீடியோ கிளிப்புகள், HTML குறியீடு, மூலக் குறியீடு அல்லது தளத்தில் வசிக்கும் அல்லது பார்க்கக்கூடிய அல்லது வேறுவிதமாகக் கண்டறியக்கூடிய மென்பொருள், மற்றும் தளத்தில் இருந்து முன்பதிவு செய்துள்ள அனைத்து பங்கேற்பாளர்களும், (ஒட்டுமொத்தமாக, ""உள்ளடக்கம்"" என அழைக்கப்படுகிறது) பெண்கள் மற்றும் குழந்தைகள் மேம்பாட்டு அமைச்சகம் மற்றும் அவர்களின் அங்கீகரிக்கப்பட்ட சேவை வழங்குநர்களுக்கு சொந்தமானது."
Jaleswar Icds Project,ஜலேஸ்வர் ஐ. சி. டி. எஸ். புராஜக்ட்
Poshan Tracker adds new application features,ரோஷன் டிராக்கர் புதிய பயன்பாடு அம்சங்களைச் சேர்க்கிறது
Making or Updating Home Visit Planner and Initiating home visits,ஹோம் விசிட் பிளானரை உருவாக்குதல் அல்லது புதுப்பித்தல் மற்றும் வீட்டுச் சந்திப்புகளைத் தொடங்குதல்
Uraiyur    Project-1,உறையூர் புராஜக்ட்-1
Poshan Calculator is designed to measure growth of the child based on standards defined by World Health Organization (WHO),உலக சுகாதார அமைப்பு (WHO) வரையறுத்துள்ள தரநிலைகளின் அடிப்படையில் குழந்தையின் வளர்ச்சியை அளவிடும் வகையில் போஷன் கால்குலேட்டர் வடிவமைக்கப்பட்டுள்ளது
Asthampatti (Sal Pro 1),அஸ்தம்பட்டி (சால் ப்ரோ 1)
Migrated from one category to another,ஒரு பிரிவிலிருந்து இன்னொன்றுக்கு மாறி இருக்கிறார்
Icds Parappa Additional, ஐ. சி. டி. எஸ். பரப்பா அடிஷனல்
Binpur - I Adl.,பின்பூர்- I அடிஷனல்
Wasting (Weight for Height)-,விரயம் (உயரத்திற்க்கான எடை)-
Soreng Rural Project,சோரெங் கிராமப்புற திட்டம்
It usually occurs when a person has not had food of adequate quality and quantity and/or they have had frequent or prolonged illnesses,"ஒரு நபர் நல்ல தரமான மற்றும் போதுமான அளவு உணவை உட்கொள்ளாதபோதும், அடிக்கடி உடல்நிலை சரியில்லாமல் போவதும் அல்லது நீண்ட கால நோய்களை கொண்டிருக்கும்போதும் இது பொதுவாக நிகழ்கிறது"
Dinhata - I Addl,தின்ஹடா - I அடிஷனல்
Mohgaon - R,மோஹ்காவ்ன் - ஆர்
"Malnutrition is one of the most important challenges facing contemporary India.Nutrition is acknowledged as central to the achievement of National and Global Sustainable Development Goals.Optimum and appropriate nutrition is essential for women and children to survive, thrive and break the intergenerational cycle of poor health and poverty in the community.The underlying causes of malnutrition that results in undersized children and adults, are multifaceted and rooted in economic and social factors such as poverty, low levels of female literacy, lack of access to clean drinking water, sanitation and hygiene, maternal characteristics, inadequate curative and preventive health care, maternal, household and community resources and women empowerment.","சமகால இந்தியா எதிர்கொள்ளும் மிக முக்கியமான சவால்களில் ஒன்று ஊட்டச்சத்து குறைபாடு.தேசிய மற்றும் உலகளாவிய நிலையான அபிவிருத்தி இலக்குகளை அடைவதற்கு ஊட்டச்சத்து மையமாக ஏற்றுக்கொள்ளப்படுகிறது.சமூகத்தில் மோசமான உடல்நலம் மற்றும் வறுமை ஆகியவற்றின் இடைநிலை சுழற்சியை பெண்கள் மற்றும் குழந்தைகள் உயிர்வாழவும், செழிக்கவும், உடைக்கவும் உகந்த மற்றும் பொருத்தமான ஊட்டச்சத்து அவசியம்.குறைவான குழந்தைகள் மற்றும் பெரியவர்களுக்கு விளைவிக்கும் ஊட்டச்சத்துக் குறைபாட்டின் அடிப்படைக் காரணங்கள், வறுமை, குறைந்த அளவிலான பெண் கல்வியறிவு, சுத்தமான குடிநீர் கிடைக்காதது, சுகாதாரம் மற்றும் சுகாதாரம், தாய்வழி பண்புகள், போதிய நோய் தீர்க்கும் மற்றும் போன்ற பொருளாதார மற்றும் சமூக காரணிகளில் பன்முகத்தன்மை கொண்டவை மற்றும் வேரூன்றியுள்ளன.தடுப்பு சுகாதார பராமரிப்பு, தாய்வழி, வீட்டு மற்றும் சமூக வளங்கள் மற்றும் பெண்கள் அதிகாரம்."
Check Ticket Status,டிக்கெட் நிலையை சரிபார்க்கவும்
Panskura- II ICDS,பன்ஸ்குரா- II ஐ. சி. டி. எஸ்.
"Poshan Abhiyaan is India’s flagship programme to improve nutritional outcomes for children, adolescents, pregnant women and lactating mothers by leveraging technology, a targeted approach and convergence.","போஷன் அபியான் என்பது குழந்தைகள், இளம் பருவத்தினர், முன்னுரிமைக்கான ஊட்டச்சத்து விளைவுகளை மேம்படுத்துவதற்கான இந்தியாவின் முதன்மை திட்டமாகும்."
Reference data not available.,குறிப்பு தரவு கிடைக்கவில்லை.
Hot Cooked Meal (HCM) given in last 30 days,கடந்த 30 நாட்களில் வழங்கப்பட்ட சூடான சமைத்த உணவு (HCM)
English Bazar Adl,இங்கிலிஷ் பஜார் அடிஷனல்
"Dhalpukhuri Icds Project, Hojai.","தல்புகுரி ஐ. சி. டி. எஸ். புராஜக்ட், ஹோஜாய்."
Underweight (Weight for Age)-,குறைந்த எடை (வயதுக்கு ஏற்ற எடை)-
Uploading of Data of Anganwadi Services Schemes in Poshan Tracker,போஷன் டிராக்கரில் அங்கன்வாடி சேவைகள் திட்டங்களின் தரவைப் பதிவேற்றுதல்
On the Map,மேப்பில்
Prayagraj City 2,பிரயாக்ராஜ் நகரம் 1
Poshan Tracker Process Flow,போஷன் டிராக்கர் செயல்முறை ஓட்டம்
New Khar Santacruz,நியூ கார் சாந்தாகுரூஸ்
Enter Date of Birth,பிறந்த தேதியை உள்ளிடவும்
0 months to 5 years,0 மாதங்கள் முதல் 5 வயது வரை
Delhi Project 1,டெல்லி புராஜக்ட் 1
The Poshan Tracker generates automated alerts to the critical last-mile beneficiaries.,போஷன் டிராக்கர் ஆனது முக்கியமான கடைசி மைல் பயனாளிகளுக்கு தானியங்கி விழிப்பூட்டல்களை உருவாக்குகிறது.
It also ensures efficient audit of the delivery system by documenting real time attendance of beneficiaries and duty bearers.,பயனாளிகள் மற்றும் கடமை தாங்குபவர்களின் உண்மையான நேர வருகையை ஆவணப்படுத்துவதன் மூலம் திறமையான தணிக்கையையும் இது உறுதி செய்கிறது.
"This management information system will help the nutrition programme to scale efficiently, thereby generating and documenting positive impact","இந்த மேலாண்மை தகவல் அமைப்பு ஊட்டச்சத்து திட்டத்தை திறம்பட அளவிடுவதற்கும், நேர்மறையான தாக்கத்தை உருவாக்கி ஆவணப்படுத்துவதற்கும் உதவும்"
How can one Download Poshan Tracker App?,போஷன் டிராக்கர் அபிபி ஐ எவ்வாறு பதிவிறக்கம் செய்யலாம்?
AWC Opening and AWW behaviour,AWC திறப்பு மற்றும் AWW நடத்தை
