eng,ta
"We own the intellectual property rights in the Site and Content.We may change the Content and features of the Site at any time.The registered and unregistered trademarks, logos, and service marks displayed on the Site are owned by us or our licensors.You may not use our trademarks, logos, and service marks in any way without our prior written permission.Material featured on this website may be reproduced free of charge.However, no part of the Site and no Content may be copied, republished, reproduced, uploaded, posted, displayed publicly, encoded, translated, transmitted or distributed in any way to any other computer, server, Web site or other medium for publication in a derogatory manner or in a misleading context.You may use information available on the Site, provided that you will (1) use such information only for your personal, non-commercial informational purpose and do not copy or post such information on any networked computer or broadcast it in any media, (2) not make any modifications to any such information and any additional representations or warranties relating to such documents and Content.Wherever the material is being published or issued to others, the source must be prominently acknowledged.However, the permission to reproduce this material shall not extend to any material which is identified as being copyright of a third party.","தளம் மற்றும் உள்ளடக்கத்தில் அறிவுசார் சொத்துரிமைகளை நாங்கள் வைத்திருக்கிறோம்.நாங்கள் எந்த நேரத்திலும் தளத்தின் உள்ளடக்கம் மற்றும் அம்சங்களை மாற்றலாம்.தளத்தில் காட்டப்படும் பதிவுசெய்யப்பட்ட மற்றும் பதிவுசெய்யப்படாத வர்த்தக முத்திரைகள், லோகோக்கள் மற்றும் சேவை முத்திரைகள் எங்களுக்கு அல்லது எங்கள் உரிமதாரர்களுக்கு சொந்தமானது.எங்களின் முன் எழுத்துப்பூர்வ அனுமதியின்றி எங்களின் வர்த்தக முத்திரைகள், லோகோக்கள் மற்றும் சேவை முத்திரைகளை நீங்கள் எந்த வகையிலும் பயன்படுத்தக்கூடாது.இந்த இணையதளத்தில் இடம்பெற்றுள்ள பொருள் இலவசமாக மீண்டும் உருவாக்கப்படலாம்.எவ்வாறாயினும், தளத்தின் எந்தப் பகுதியும் மற்றும் உள்ளடக்கம் எதையும் நகலெடுக்கவோ, மறுபிரசுரம் செய்யவோ, மறுஉருவாக்கம் செய்யவோ, பதிவேற்றவோ, இடுகையிடவோ, பொதுவில் காட்டவோ, குறியிடவோ, மொழிபெயர்க்கவோ, அனுப்பவோ அல்லது எந்த வகையிலும் இழிவான முறையில் அல்லது தவறாக வழிநடத்தும் சூழலில் பிற கணினி, சர்வர், இணையதளம் அல்லது பிற ஊடகங்களில் வெளியிடப்படக்கூடாது.(1)உங்கள் தனிப்பட்ட, வணிகம் சாராத தகவல் நோக்கங்களுக்காக மட்டுமே நீங்கள் அத்தகைய தகவலைப் பயன்படுத்தினால், எந்தவொரு நெட்வொர்க் கணினியிலும் அத்தகைய தகவலை நகலெடுக்கவோ அல்லது இடுகையிடவோ அல்லது எந்த ஊடகத்திலும் ஒளிபரப்பவோ கூடாது எனில், தளத்தில் கிடைக்கும் தகவலை நீங்கள் பயன்படுத்தலாம்.(2)அத்தகைய தகவல்கள் மற்றும் அத்தகைய ஆவணங்கள் மற்றும் உள்ளடக்கம் தொடர்பான கூடுதல் பிரதிநிதித்துவங்கள் அல்லது உத்தரவாதங்களை நீங்கள் எந்த மாற்றங்களையும் செய்யக்கூடாது.உள்ளடக்கம் எங்கு வெளியிடப்பட்டாலும் அல்லது பிறருக்கு வழங்கப்பட்டாலும், ஆதாரம் முக்கியமாக ஒப்புக் கொள்ளப்பட வேண்டும்.எவ்வாறாயினும், மூன்றாம் தரப்பினரின் பதிப்புரிமை என அடையாளம் காணப்பட்ட எந்தவொரு பொருளுக்கும் இந்த உள்ளடக்கத்தை மீண்டும் உருவாக்குவதற்கான அனுமதி நீட்டிக்கப்படாது."
Galsi - II,கல்ஸி- II
MPIN can be easily reset by any AWW/AWC user.,எந்த அடபிள்யூடபிள்யூ / அடபிள்யூசி பயனரால் எம்பின் ஐ எளிதாக மீட்டமைக்க முடியும்.
"You are required to click on Forgot MPIN, and enter your registered mobile number.","மறந்துவிட்ட எம்பின் ஐக் கிளிக் செய்து, உங்கள் பதிவுசெய்த மொபைல் எண்ணை உள்ளிடவும்."
You will receive and OTP on your registered mobile number and you can ealily reset your MPIN,"உங்கள் பதிவுசெய்யப்பட்ட மொபைல் எண்ணில் நீங்கள் பெறுவீர்கள் மற்றும் OTP பெறுவீர்கள், மேலும் உங்கள் எம்பின் ஐ நீங்கள் எளிதாக மீட்டமைக்கலாம்."
The Poshan Tracker is a job-aid to the Anganwadi worker for efficient delivery of services along with reflection of their efforts.,போஷன் டிராக்கர் என்பது அங்கன்வாடி பணியாளர்களின் முயற்சியின் பிரதிபலிப்புடன் சேவைகளை திறம்பட வழங்க உதவுகிறது.
It is a critical and beneficiary-centric service delivery Application under POSHAN Abhiyaan which will promote real time data with analytics,"இது போஷன் அபியான் கீழ் முக்கியமான மற்றும் பயனாளிகளை மையமாகக் கொண்ட சேவை வழங்கல் விண்ணப்பமாகும், இது பகுப்பாய்வுகளுடன் நிகழ் நேரத் தரவை ஊக்குவிக்கும்"
Shahid Bhagat Singh Nagar,ஷாஹித் பகத் சிங் நகர்
Matigara ICDS Project( Addl ),மதிகரா ஐ. சி. டி. எஸ். புராஜக்ட் (அடிஷனல்)
Goapokher- II Addl.,கோவாபோகேர் - II அடிஷனல்
Sonbhadra Banshi Suryapur,சோன்பத்ரா பன்ஷி சூர்யாபூர்
Please enter valid Date of Birth,சரியான பிறந்த தேதியை உள்ளிடவும்
Jugijan Icds Project,ஜூகிஜான் ஐ. சி. டி. எஸ். புராஜக்ட்
Ketugram - I,கேதுர்கிராம் - I
How to revive your Health?,உங்கள் ஆரோக்கியத்தை எவ்வாறு மீட்டெடுப்பது?
West Garo Hills,மேற்கு கரோ ஹில்ஸ்
West Singhbhum - Jharkhand,மேற்கு சிங்பும் - ஜார்க்கண்ட்
Delhi Project 2,டெல்லி புராஜக்ட் 2
2.2. Communicate with you.,2.2. உங்களுடன் தொடர்பு கொள்ளுங்கள்.
Who is eligible for additional supplementary food?,கூடுதல் துணை உணவுக்கு யார் தகுதியானவர்?
CHAUTH KA BARWARA,சவுத் கா பர்வாரா
Namchi Rural Project,நாம்ச்சி கிராமப்புற திட்டம்
"We reserve the unconditional right to change, modify, add, or remove any part of these Terms at any time, without specifically notifying you of such changes.","மாற்றங்களை உங்களுக்குத் தெரிவிக்காமல், எந்த நேரத்திலும் இந்த விதிமுறைகளின் எந்தப் பகுதியையும் மாற்ற, திருத்த, சேர்க்க அல்லது அகற்ற நிபந்தனையற்ற உரிமையை நாங்கள் வைத்திருக்கிறோம்."
Any changes or updates will be effective immediately.,ஏதேனும் மாற்றங்கள் அல்லது புதுப்பிப்புகள் செய்யப்பட்டால் அவை உடனடியாக நடைமுறைக்கு வரும்.
You take the responsibility to check these Terms of Use periodically for changes.,இந்த பயன்பாட்டு விதிமுறைகளை மாறுதல்களை அவ்வப்போது சரிபார்ப்பது உங்களுடைய பொறுப்பு.
Your continued use of the platform post such revision shall constitute acceptance of the modified Terms.,"அத்தகைய திருத்தத்திற்குப் பிறகு நீங்கள் இயங்குதளத்தைத் தொடர்ந்து பயன்படுத்துவது, மாற்றியமைக்கப்பட்ட விதிமுறைகளை ஏற்றுக்கொள்வதாக அமையும்."
Project - Iii,புராஜக்ட் - III
In case AWW is unsuccessful in registering themselves there might be 2 possibilities:Their mobile number is not present in the data provided by the states to the MoWCDThey are newly added to the system and their mobile number is not yet provided by the state cell to the MoWCD.,"அங்கன்வாடிஊழியர்கள் தங்களை பதிவு செய்ய முடியாமைக்கு இரண்டு காரணங்கள்ஃ மோடபிள்யூசிடி க்கு மாநிலங்கள் வழங்கிய தரவுகளில் அவற்றின் மொபைல் எண் இல்லைஅவை கணினியில் புதிதாக சேர்க்கப்பட்டுள்ளன, அவற்றின் மொபைல் எண் இன்னும் மாநில கலத்தால் மோடபிள்யூசிடி க்கு வழங்கப்படவில்லை."
In both the above cases state nodal officers are empowered to add/ edit/Activate/Deactivate any of the AWW.,மேற்கூறிய இரண்டு நிகழ்வுகளிலும் அடபிள்யூடபிள்யூ ஐ சேர்க்க / திருத்த / செயல்படுத்த / செயலிழக்க மாநில நோடல் அதிகாரிகளுக்கு அதிகாரம் உண்டு.
Bilkhawthlir Icds Project,பில்காவ்த்லிர் ஐ. சி. டி. எஸ். திட்டம்
No Record to Show,காண்பிக்க பதிவேடு இல்லை
Kailashahar District H.Q,கைலாஷாஹர் மாவட்டத் தலைநகரம்
How many different types of reports can be generated over Poshan Tracker Dashboard?,போஷன் டிராக்கர் டாஷ்போர்டில் எத்தனை வகையான அறிக்கைகளை உருவாக்க முடியும்?
WHO standards are,WHO தரநிலைகள்
Murarai-II ICDS Project,முராரை-II ஐ. சி. டி. எஸ். புராஜக்ட்
South East Delhi,தென்கிழக்கு டெல்லி
Ashoknagar- Kalyangarh (U),அஷோக்நகர் - கல்யாண்கர் (யு)
How to revive your health if you are Severely Wasted (SAM),நீங்கள் கடுமையான ஊட்டச்சத்து குறைபாடு உள்ளவராக இருந்தால் (SAM) உங்கள் ஆரோக்கியத்தை எவ்வாறு மீட்டெடுப்பது
Baba Belkhar Nath Dham,பாபா பேல்கர் நாத் தாம்
Firozabad City 2,ஃபிரோஸ்பாத் நகரம் 2
What is Poshan Calculator,போஷன் கால்குலேட்டர் என்றால் என்ன
Binpur - I,பின்பூர்- I
Ldh Urban 2,லூதியானா அர்பன் 2
"See assessment charts for Stunted, Wasted and Underweight parameters","குன்றிய, ஊட்டச்சத்து குறைபாடுள்ள மற்றும் எடை குறைந்த அளவுருக்களுக்கான மதிப்பீட்டு விளக்கப்படங்களைப் பார்க்கவும்"
Visit state page,மாநிலப் பக்கத்தைப் பார்வையிடவும்
Best performing districts,சிறப்பாக செயல்படும் மாவட்டங்கள்
Sandeshkhali - I,சந்தேஷ்காலி - I
Resources for growth monitoring and general awareness,வளர்ச்சியைக் கண்காணித்தல் மற்றும் பொதுவான புரிதலுக்கான வளங்கள்
AWW are required to enter details related to infrastructure present in a particular Anganwadi centre.,ஒரு குறிப்பிட்ட அங்கன்வாடி மையத்தில் இருக்கும் உள்கட்டமைப்பு தொடர்பான விவரங்களை அடபிள்யூடபிள்யூ உள்ளிட வேண்டும்.
"This includes structure, basic amenities, facilities, sanitization, drinking water etc.","இதில் கட்டமைப்பு, அடிப்படை வசதிகள், வசதிகள், சுத்திகரிப்பு, குடிநீர் போன்றவை அடங்கும்."
Lactating mothers who received Take Home Ration (THR),டேக் ஹோம் ரேஷன் (THR) பெற்ற பாலூட்டும் தாய்மார்கள்
Balurghat (U),பாலூர்கட் (யு)
Last updated on,கடைசியாக புதுப்பிக்கப்பட்டது
"Poshan Tracker reserve the unconditional right to change, modify, add, or remove any part of this Privacy Policy at any time, without specifically notifying you of such changes.","போஷன் டிராக்கர் இந்த தனியுரிமைக் கொள்கையின் எந்தப் பகுதியையும், எந்த நேரத்திலும், அத்தகைய மாற்றங்களைப் பற்றி உங்களுக்குத் தெரிவிக்காமல், எந்த நேரத்திலும் மாற்ற, மாற்ற, சேர்க்க அல்லது அகற்ற நிபந்தனையற்ற உரிமையைப் பெற்றுள்ளார்."
Any changes or updates will be effective immediately.,ஏதேனும் மாற்றங்கள் அல்லது புதுப்பிப்புகள் செய்யப்பட்டால் அவை உடனடியாக நடைமுறைக்கு வரும்.
You should review this Privacy Policy regularly for changes.,மாற்றங்களுக்கு இந்த தனியுரிமைக் கொள்கையை நீங்கள் தொடர்ந்து மதிப்பாய்வு செய்ய வேண்டும்.
"We will use commercially reasonable efforts to generally notify all users of any material changes to this Privacy Policy, such as through a notice on the System.","இந்த தனியுரிமைக் கொள்கையில் ஏதேனும் பொருள் மாற்றங்கள் இருந்தால், சிஸ்டத்தில் அறிவிப்பு மூலம் அனைத்துப் பயனர்களுக்கும் பொதுவாகத் தெரிவிக்க வணிக ரீதியாக நியாயமான முயற்சிகளைப் பயன்படுத்துவோம்."
"However, as a user of the System, you should regularly check the Privacy Policy for any changes.","இருப்பினும், கணினியின் பயனராக, ஏதேனும் மாற்றங்கள் இருந்தால் தனியுரிமைக் கொள்கையை நீங்கள் தொடர்ந்து சரிபார்க்க வேண்டும்."
"We will also update the “Last Updated” date at the top of this Privacy Policy, which reflects the effective date of this Privacy Policy.","இந்தத் தனியுரிமைக் கொள்கையின் மேலே உள்ள ""கடைசியாகப் புதுப்பிக்கப்பட்ட"" தேதியையும் நாங்கள் புதுப்பிப்போம், இது இந்தத் தனியுரிமைக் கொள்கையின் நடைமுறைத் தேதியைப் பிரதிபலிக்கிறது."
Your continued access or use of the System after the date of the new Privacy Policy constitutes your acceptance of the new Privacy Policy.,புதிய தனியுரிமைக் கொள்கையின் தேதிக்குப் பிறகு உங்கள் தொடர்ச்சியான அணுகல் அல்லது கணினியைப் பயன்படுத்துவது புதிய தனியுரிமைக் கொள்கையை நீங்கள் ஏற்றுக்கொள்வதைக் குறிக்கிறது.
"If you do not agree to the new Privacy Policy, you must stop accessing and/or using the System.","புதிய தனியுரிமைக் கொள்கையை நீங்கள் ஏற்கவில்லை என்றால், நீங்கள் கணினியை அணுகுவதையும்/அல்லது பயன்படுத்துவதையும் நிறுத்த வேண்டும்."
"You hereby acknowledge that any collection, storage, processing or other use of your information shall be governed by the Privacy Policy as applicable at the time of such collection, storage, processing or other use.","எந்தவொரு சேகரிப்பு, சேமிப்பகம், செயலாக்கம் அல்லது உங்கள் தகவலின் பிற பயன்பாடு, அத்தகைய சேகரிப்பு, சேமிப்பகம், செயலாக்கம் அல்லது பிற பயன்பாட்டின் போது பொருந்தக்கூடிய தனியுரிமைக் கொள்கையால் நிர்வகிக்கப்படும் என்பதை நீங்கள் இதன்மூலம் ஒப்புக்கொள்கிறீர்கள்."
JOYNAGAR-II ICDS PROJECT,ஜாய்நகர்-II ஐ. சி. டி. எஸ். புராஜக்ட்
What is the eligibility of a beneficiary?,ஒரு பயனாளியின் தகுதி என்ன?
Stunting and Underweight Growth Parameters,தடைபட்ட மற்றும் எடைக்குறைவு வளர்ச்சி அளவுருக்கள்
NALHATI-I ICDS PROJECT (NGO),நல்ஹதி-I ஐ. சி. டி. எஸ். புராஜக்ட் (என் ஜி ஓ)
Enter Height in centimeter,உயரத்தை சென்டிமீட்டரில் உள்ளிடவும்
Joynagar - I,ஜாய்நகர் - I
CDPO OFFICE BATHINDA,சிடிபிஓ அலுவலகம் பதிண்டா
Severely Wasted (SAM),கடுமையான ஊட்டச்சத்து குறைபாடு (SAM)
"No, Poshan Tracker is available only for Android version","இல்லை, போஷன் டிராக்கர் ஆண்ட்ராய்டு பதிப்பை மட்டுமே கிடைக்கிறது"
Harishchandrapur - I,ஹரிஸ்சந்திரபூர்- I
 XV. INDEMNITY AND LIMITATION OF LIABILITY, XV. இழப்பீடு மற்றும் பொறுப்பு வரம்பு
2.1. Deliver our services.,2.1. எங்கள் சேவைகளை வழங்கவும்.
Growth monitoring report for all health indicators,எல்லா ஆரோக்கியக் குறியீடுகளுக்கும் வளர்ச்சி கண்காணிப்பு அறிக்கை
Take Home Ration (THR) given in last 30 days,கடந்த 30 நாட்களில் கொடுக்கப்பட்ட டேக் ஹோம் ரேஷன் (THR)
Please select District,தயவு செய்து மாவட்டத்தைத் தேர்ந்தெடுக்கவும்
District’s Quarterly Performance,மாவட்டத்தின் காலாண்டு செயல்திறன்
3.1. Tracking health progress.,3.1. சுகாதார முன்னேற்றத்தைக் கண்காணித்தல்.
Raghunathpur - II,ரகுநாத்பூர் - II
Kultali ICDS Project,குல்தலி ஐ. சி. டி. எஸ். புராஜக்ட்
CDPO Worli Kandivali Urban,சிடிபிஓ வொர்லி கண்டிவலி அர்பன்
Please enter Name,தயவு செய்து பெயரை உள்ளிடவும்
Balurghat Rural Ad,பாலூர்கட் ரூரல் அடிஷனல்
Children are defined as stunted if their height-for-age is more than two standard deviations below the WHO Child Growth Standards median,"WHO குழந்தை வளர்ச்சித் தரநிலையின் சராசரிக்குக் கீழே குழந்தைகளின் உயரம் அவர்களின் வயதுக்கு இரண்டு நிலையான விலகல்களுக்கு மேல் இருந்தால், அவர்கள் வளர்ச்சி குன்றியவர்களாக வரையறுக்கப்படுகிறார்கள்"
South 24 Parganas,தெற்கு 24 பர்கானாக்கள்
Deoghar Cum Jasidih,தியோகர் கம் ஜஸிதிஹ்
