eng,as,translation_text
It is built using centralized data architecture that also aligns with the digital technology systems of other ministries and programs.,ইযাক কেন্দ্ৰীকৃত ডাটা আৰ্কিটেকচাৰ ব্যৱহাৰ কৰি সাজি উলিওৱা হয যি আন মন্ত্ৰালয আৰু প্ৰগ্ৰাম সমূহৰ ডিজিটেল প্ৰযুক্তি চিষ্টেমৰ সৈতে সমৰৈখিক হয।, This is designed using a centralized data architecture that is consistent with other ministries and programs' digital technology systems.
The public dashboard helps to impart transparency on services delivered to beneficiaries,ৰাজহুৱা ডেশ্ববোৰ্ডে হিতাধিকাৰীসকললৈ আগবঢোৱা সেৱা সমূহৰ ওপৰত স্বচ্চতা প্ৰদান কৰাত সহায কৰে,eng public dashboard helps to provide transparency on the services offered to the beneficiaries.
Translations on the Poshan Tracker Portal & App Chabot are done by third party translators.,পোষণ ট্ৰেকাৰ পৰ্টেল আৰু এপ চাটব'টৰ অনুবাদ তৃতীয পক্ষ অনুবাদকৰ দ্বাৰা সম্পন্ন হয।, The translation of the Poshnan Tracker portal and app chatbot is done by a third party translator.
"While the translations are done on a best effort basis, some of the parts may be incorrect.","যদিও অনুবাদ সমূহ সৰ্বোত্তম প্ৰযাসেৰে সম্পন্ন কৰা হয, কিছু অংশ অশুদ্ধও হৈ ৰব পাৰে।"," Although translations are done with the best of effort, some parts may still be impure."
Certain files and other items on the website cannot be translated.,ৱেবচাইটটোৰ কিছুমান ফাইল বা আন সামগ্ৰী অনুবাদ কৰিব পৰা নাযায।, Some files or other content on the website may not be translatable.
"In addition, on translation, some applications and/or services may not function as expected, due to language barriers.","ইযাৰ উপৰি, অনুবাদত, কিছুমান এপ্লিকেচন আৰু/বা সেৱাই ভাষাৰ অন্তৰাযৰ ফলত, আশানুৰূপ ভাৱে কাম নকৰিব পাৰে।","eng, dictionary translation, some applications and/or service language interference may not work as expected."
"We are working constantly to rectify any errors, omissions, or ambiguities in the translations provided on this portal.","আমি এই পৰ্টেলত আগবঢোৱা অনুবাদ সমূহত যিকোনো ত্ৰুটি, বাদ পৰা তথ্য, বা অন্য সম্ভাৱনা সংশোধন কৰিবলৈ অবিৰত কাম কৰি আছো।","/I am working tirelessly to correct any errors, omitted information, or other possibilities in the translations provided on this portal."
"The MGRS collected primary growth data and related information from approximately 8500 children from widely different ethnic backgrounds and cultural settings (Brazil, Ghana, India, Norway, Oman and the USA)","MGRS-যে ব্যাপক ৰূপত বিভিন্ন নৃগোষ্ঠীগত পটভূমি আৰু সাংস্কৃতিক পৃষ্ঠভূমিৰ (ব্ৰাজিল, ঘানা, ভাৰত, নৰৱে, ওমন আৰু USA) পৰা প্ৰায 8500 গৰাকী শিশুৰ পৰা প্ৰাথমিক বিকাশত তথ্য আৰু সম্পৰ্কিত তথ্য সংগ্ৰহ কৰিছিল।","eng.org MGRS-that collected data and related data from about 8,500 children in early development from various ethnic and cultural backgrounds (Brazil, Ghana, India, Norway, Oman and USA) in a comprehensive manner."
Children of different age groups are monitored on monthly basis by AWWs.,বিভিন্ন বযসৰ শিশু সকল মাহেকীযা ভিত্তিত AWW সকলৰ দ্বাৰা নিৰীক্ষিত হয।, All children of different ages are tested by MAKEIA-based AWWs.
"Health indicators like Stunting, Wasting and Underweight prevalence are measured as per WHO standards.","বাওনা হোৱা, পুষ্টিহীনতাত ভোগা আৰু কম ওজনৰ বিস্তাৰৰ দৰে স্বাস্থ্যজনিত সূচক সমূহ WHO মান অনুসৰি জোখা হয।","eng, malnutrition, and low-weight prevalence are all health indicators measured according to WHO standards."
Regular growth monitoring helps AWWs to provide relevant and timely assistance to children,নিযমীযা বৃদ্ধিৰ নিৰীক্ষণে AWW সকলক শিশুসকললৈ প্ৰাসংগিক আৰু সমযমতে সহযোগিতা আগবঢোৱাত সহায কৰে, AWW helps all children develop cooperation that is relevant and timely to all children.
"Awareness for Children Stunting, Wasting to prevent malnutrition in children","শিশুসকলৰ মাজত শিশু বাওনা হোৱা, বিষমপপুষ্টিক বাধা দিবলৈ পুষ্টিহীনতাৰ বাবে সজাগতা","engas, kelelaan, kelelaan, kelelaan, kelelaan, kelelaan, kelelaan, kelelaan, kelelaan, kelelaan, kelelaan, kelelaan, kelelaan, kelelaan, kelelaan, kelelaan, kelelaan, kelelaan, kelelaan, kelelaan, kelelaan, kelelaan, kelelaan, kelelaan, kelelaan, kelelaan, kelelaan, kelelaan, kelelaan, kelelaan, kelelaan, kelelaan, kelelaan, kelelaan, kelelaan, kelelaan, kelelaan, kelelaan, kelelaan, kelelaan, kelelaan, kelelaan, kelelaan, kelelaan, kelelaan, kelelaan, kelelaan, kelelaan, kelelaan, kelelaan,"
Poshan Tracker adds new application features,পোশান ট্ৰেকাৰে নতুন এপ্লিকেচন সুবিধা যোগ কৰে,eng tracker adds new application features
Making or Updating Home Visit Planner and Initiating home visits,হোম ভিজিটৰ প্লেনাৰ প্ৰস্তুত কৰা বা আপডেট কৰা আৰু হোপ ভিজিটৰ সূচনা কৰা, Preparing or updating a home visit plan and starting a hopas visit
Poshan Calculator is designed to measure growth of the child based on standards defined by World Health Organization (WHO),পোষণ কেলকুলেটৰ বিশ্ব স্বাস্থ্য সংস্থা (WHO) ৰ দ্বাৰা নিৰ্ধাৰিত মানৰ ওপৰত ভিত্তি কৰি শিশুৰ বিকাশ জুখিবলৈ সাজি উলিওৱা হৈছে,engas kalkulusasi nutrisi telah dirancang untuk mengukur perkembangan bayi berdasarkan standar yang ditetapkan oleh WHO.
Migrated from one category to another,এটা শ্ৰেণীৰ পৰা আন এটা শ্ৰেণীলৈ প্ৰব্ৰজন কৰা হৈছে, One class to another is being migrated to another class.
It usually occurs when a person has not had food of adequate quality and quantity and/or they have had frequent or prolonged illnesses,ই সাধাৰণতে তেতিযা সংঘটিত হয যেতিযা এগৰাকী লোকে পৰ্যাপ্ত মানদণ্ডৰ আৰু পৰিমাণৰ খাদ্য লাভ নকৰে আৰু/বা তেওঁলোকৰ ঘনাই হৈ থকা বা দীিৰ্গাযিত ৰোগ হয, This usually occurs when a person does not get enough food in sufficient quantity and quality and/or they have a chronic or chronic illness.
Malnutrition is one of the most important challenges facing contemporary India.,মালনিউট্রিশন ২ ওযান অফ টি মোস্ট ইম্পরট্যান্ট চ্যালেঞ্জেস ফাকিং কনটেম্পোরারি ইন্ডিযা.,eng2 ocean of tea most important challenges fucking contemporary india.
Nutrition is acknowledged as central to the achievement of National and Global Sustainable Development Goals.,নিউট্রিশন ২ অকনোলেজড এস সেন্ট্রাল তো টি অ্যাচিভমেন্ট অফ ন্যাশনাল এন্ড গ্লোবাল সুস্টাইনাবলে ডেভেলপমেন্ট গোলস.,eng2 UnknownSentral To T Achievement of National and Global Sustainable Development Goals.
"Optimum and appropriate nutrition is essential for women and children to survive, thrive and break the intergenerational cycle of poor health and poverty in the community.","অপটিমাম এন্ড অপপ্রোপ্রিযেতে নিউট্রিশন ২ এসএনটিযাল ফর ওমেন এন্ড চিলড্রেন তো সুরভিভে, থ্রিভে এন্ড ব্র্যাক ইন্টারগেনেরাশনাল সাইকেল অফ পুওর হেলথ এন্ড পভার্টি ইন টি কমিউনিটি.",engengengengengengengengengengengengengengengengengengengengengengengengengengengengengengengengengengengengengengengengengengengengengengengengengengengengengengengengengengengengengengengengengengengengengengengengengengengengengengengengengengengengengengengengengengengengengengengengengengengengengengengengengengengengengengengengengengengengengengengengengengengengengengengengengengengengengengengengengengengengengengengengengengengengengengengengengengengengengengengengengengengengengengengengengengengengengengengengengengengengengengengengengengengengengengengengengengengengengengeng
"Poshan Abhiyaan is India’s flagship programme to improve nutritional outcomes for children, adolescents, pregnant women and lactating mothers by leveraging technology, a targeted approach and convergence.","শিশু, বযঃসন্ধিকাল, গৰ্ভাৱস্থাৰ বাবে পুষ্টিৰ ফলাফল উন্নত কৰাৰ বাবে পোষণ অভিযান হৈছে ভাৰতৰ মুখ্য কাৰ্যসূচী।"," ""Pushana Mission"" is India's flagship program to improve nutritional outcomes for children, adolescents, and pregnant women."
Hot Cooked Meal (HCM) given in last 30 days,হট কুকড মীল (এইচচিএম) শেষৰ ৩০ দিনত দিযা হয,eng (HCM) has been given in the last 30 days.
Uploading of Data of Anganwadi Services Schemes in Poshan Tracker,পোষণ ট্ৰেকাৰত অংগনৱাডী সেৱাসমূহৰ আঁচনি সমূহৰ ডাটা আপলোড হৈ আছে,engwadi services schemes data are uploaded to the Poshana Tracker.
The Poshan Tracker generates automated alerts to the critical last-mile beneficiaries.,পোষণ ট্ৰেকাৰে গুৰুত্বপূৰ্ণ অন্তিম পৰ্যাযৰ হিতাধিকাৰীসকললৈ অটোমেটেড এলাৰ্ট উৎপাদন কৰে।,eng tracker generates automated alerts to the beneficiaries of the critical last stage.
It also ensures efficient audit of the delivery system by documenting real time attendance of beneficiaries and duty bearers.,ই হিতাধিকাৰী আৰু ডিউটি কৰা সকলৰ বাস্তৱ সমযৰ উপস্থিতি নথিভুক্ত কৰাৰ দ্বাৰা ডেলিভাৰী চিষ্টেমৰ নিপুণ অডিট সুনিশ্চিত কৰে।, It ensures the competent audit of the delivery system by documenting the real-time presence of the beneficiaries and the debtors.
"This management information system will help the nutrition programme to scale efficiently, thereby generating and documenting positive impact","এই মেনেজমেন্ট ইনফৰ্মেচন চিষ্টেমে নিপুণভাৱে জোখ লোৱাত, এনেদৰে ধনাত্মক প্ৰভাৱ উৎপন্ন কৰি আৰু নথিভুক্ত কৰি পৰিপুষ্টিৰ অনুষ্ঠানক সহায কৰিব","eng sistem informasi manajemen ini akan membantu program gizi dengan cara mengolahnya dengan baik, menghasilkan dan mendokumentasikan dampak positif serta"
How can one Download Poshan Tracker App?,পোষণ ট্ৰেকাৰ এপ কেনেকৈ ডাউনলোড কৰিব পাৰি?,eng tracker apps download cara downloadnya gimana ya?
