eng,hi,translation_text
The public dashboard helps to impart transparency on services delivered to beneficiaries,पब्लिक डैसबोर्ड का प्रमुख कार्य लाभार्थी को प्रदत सेवा में पारदर्शिता को बनाए रखने में सहायता प्रदान करना है।, Public Dashboard's main function is to help the beneficiary maintain transparency in the services provided.
Translations on the Poshan Tracker Portal & App Chabot are done by third party translators.,पोषण ट्रैकर पोर्टल और ऐप चैट-बोट पर तीसरे पक्ष के अनुवादकों द्वारा अनुवाद किया जाता है।, Nutrition Tracker Portal and App on Chat-Bot are translated by third party translators.
"While the translations are done on a best effort basis, some of the parts may be incorrect.","हालाँकि, अनुवाद की श्रेणी को सर्वोत्तम रखने का प्रयास किया जाता है, फिर भी इसमें संभावित रूप से कुछ त्रुटियाँ पाई जा सकती हैं।","eng, meskipun upaya untuk menjaga kategori terjemahan yang terbaik, namun masih mungkin terdapat beberapa kesalahan."
Certain files and other items on the website cannot be translated.,इस वेबसाइट पर उपलब्ध कुछ फाइलों और अन्य सामग्रियों का अनुवाद नहीं किया जा सकता है।, Certain files and other materials available on this website cannot be translated.
"In addition, on translation, some applications and/or services may not function as expected, due to language barriers.","इसके अलावा, अनुवाद के संदर्भ में भाषा की बाधाओं के कारण कुछ एप्लिकेशन और/या सेवाएँ अपेक्षित रूप से कार्य नहीं कर सकती हैं।","eng, karena keterbatasan bahasa dalam hal terjemahan, beberapa aplikasi dan/atau layanan mungkin tidak berfungsi sebagaimana mestakan."
"We are working constantly to rectify any errors, omissions, or ambiguities in the translations provided on this portal.","हम इस पोर्टल पर उपलब्ध कराए गए अनुवादों में किसी भी प्रकार की त्रुटि, चूक या अस्पष्टता को सुधारने के लिए निरंतर कार्य कर रहे हैं।"," We are continuously working to correct any type of error, defect or ambiguity in the translations made available on this portal."
"The MGRS collected primary growth data and related information from approximately 8500 children from widely different ethnic backgrounds and cultural settings (Brazil, Ghana, India, Norway, Oman and the USA)","MGRS ने व्यापक रूप से विभिन्न जातीय और सांस्कृतिक पृष्ठभूमि (ब्राजील, घाना, भारत, नॉर्वे, ओमान और यूएसए) से लगभग 8500 बच्चों का प्राथमिक विकास का आँकडा और संबंधित जानकारी एकत्र की।","eng MGhiRS has extensively collected the primary development data and related information of about 8500 children from various ethnic and cultural backgrounds (Brazil, Ghana, India, Norway, Oman and USA)."
Children of different age groups are monitored on monthly basis by AWWs.,AWW द्वारा मासिक आधार पर विभिन्न आयु वाले बच्चों की निगरानी करना।, Monitoring children of different ages on a monthly basis by AWhiW.
"Health indicators like Stunting, Wasting and Underweight prevalence are measured as per WHO standards.","स्वास्थ्य संकेतक जैसे-स्टंटिंग, वेस्टिंगऔर कम वजन से संबंधित मामलों को विश्व स्वास्थ्य संगठन के मानक के अनुसार मापा जाता है।","engisindikator kesehatan seperti stunting, wasting,dan kasus berat badan rendah diukur sesuai dengan standar Organisasi Kesehatan Dunia."
Regular growth monitoring helps AWWs to provide relevant and timely assistance to children,बच्चों को प्रासंगिक और आवधिक सहायता प्रदान करने में नियमित विकास निगरानी आँगनवाडी कार्यकर्ताओं को सक्षम बनाता है।, Regular growth monitoring enables yard workers to provide relevant and periodic assistance to children.
"Awareness for Children Stunting, Wasting to prevent malnutrition in children","बच्चों में कुपोषण को रोकने के लिए स्टंटिंग, वेस्टिंग के प्रति जागरुकता","eng, waste, awareness to prevent malnutrition in children."
Poshan Tracker adds new application features,पोषण ट्रैकर ने नई एप्लिकेशन फीचर जोडा है,eng nutrition tracker has added a new application feature
Making or Updating Home Visit Planner and Initiating home visits,देखभाल कर्ता की गृह यात्रा संबंधी योजनाओं का निर्माण करना और उन्हें अद्यतित करते रहना,eng: To build and keep updated caregiver's home travel plans.
Poshan Calculator is designed to measure growth of the child based on standards defined by World Health Organization (WHO),विश्व स्वास्थ्य संगठन द्वारा परिभाषित मानकों के आधार पर बच्चों के विकास को मापने के लिए पोषण मापक का निर्माण किया गया।, Nutrition gauge was developed to measure children's development based on standards defined by the World Health Organization.
Migrated from one category to another,एक श्रेणी से दूसरी श्रेणी में स्थानांतरण,eng: Transference from one category to another category
It usually occurs when a person has not had food of adequate quality and quantity and/or they have had frequent or prolonged illnesses,यह आमतौर पर तब होता है जब किसी व्यक्ति ने पर्याप्त गुणवत्ता और मात्रा का भोजन नहीं किया होता है और/या उन्हें बार-बार या लंबी बीमारी होती है,"eng, biasanya terjadi ketika seseorang tidak makan makanan yang berkualitas dan berjumlah yang cukup dan/atau mengalami penyakit berulang atau menular."
"Poshan Abhiyaan is India’s flagship programme to improve nutritional outcomes for children, adolescents, pregnant women and lactating mothers by leveraging technology, a targeted approach and convergence.","पोषण अभियान, एक लक्षित दृष्टिकोण और अभिसरण द्वारा बच्चों, किशोरों, गर्भवती महिलाओं और स्तनपान कराने वाली माताओं के लिए पोषण संबंधी परिणामों में सुधार करने के लिए भारत का प्रमुख कार्यक्रम है।"," The NIH Nutrition Campaign is India's flagship program to improve nutritional outcomes for children, adolescents, pregnant women and breastfeeding mothers through a targeted approach and convergence."
Hot Cooked Meal (HCM) given in last 30 days,पिछले 30 दिनों में दिया गया गर्म पकाया हुआ भोजन (एचसीएम),eng: Hot cooked food (HCM) served in the last 30 days
Uploading of Data of Anganwadi Services Schemes in Poshan Tracker,पोषण ट्रैकर में आँगनवाडी सेवा योजनाओं के आँकडे को अपलोड करना, Uploading data on Anganwadi Service Schemes into the Nutrition Tracker
The Poshan Tracker generates automated alerts to the critical last-mile beneficiaries.,पोषण ट्रैकर लाभार्थियों के महत्वपूर्ण स्व-चालित संकेतकों का निर्माण करता है।,eng nutrition tracker builds critical self-driving indicators of beneficiaries.
It also ensures efficient audit of the delivery system by documenting real time attendance of beneficiaries and duty bearers.,यह लाभार्थियों और कर्तव्य धारकों की वास्तविक सामयिक उपस्थिति का दस्तावेजीकरण करके वितरण प्रणाली की कुशल लेखा परीक्षा की भी सुनिश्चितता करता है।, It also ensures efficient audit of the distribution system by documenting the actual timely presence of beneficiaries and duty holders.
"This management information system will help the nutrition programme to scale efficiently, thereby generating and documenting positive impact",यह प्रबंधन सूचना प्रणाली पोषण कार्यक्रम और उससे संबंधित दस्तावेजीकरण की कुशलता से वृद्धि करते हुए सकारात्मक प्रभाव को उत्पन्न करने में सहायता करेगी।,eng sistem informasi manajemen ini akan membantu menghasilkan dampak positif dengan meningkatkan efisiensi program nutrition dan dokumentasi terkait.
How can one Download Poshan Tracker App?,पोषण ट्रैकर ऐप को कैसे डाउनलोड किया जा सकता है?, Nutrition Tracker App How can you download the Nutrition Tracker app?
along with status update once resolved,एक बार हल हो जाने पर स्थिति अपडेट के साथ, Once solved with a status update
"The Poshan Tracker system is regularly audited by auditors engaged by MWCD, for security and scalability of the system.",इस प्रणाली की सुरक्षा और मापनीयता के लिए MWCD द्वारा नियुक्त लेखापरीक्षकों द्वारा पोषण ट्रैकर प्रणाली का नियमित रूप से लेखा-परीक्षण किया जाता है।,eng sistematron diet tracker sistematron diet tracker sistematron diet tracker sistematron diet tracker sistematron diet tracker sistematron diet tracker sistematron diet tracker sistematron diet tracker sistematron diet tracker sistematron diet tracker sistematron diet tracker sistematron diet tracker sistematron diet tracker sistematron diet tracker sistematron diet tracker sistematron diet tracker sistematron diet tracker sistematron diet tracker sistematron diet tracker sistematron diet tracker sistematron diet tracker sistematron diet tracker sistematron diet tracker sistematron diet diet diet diet diet diet diet diet diet diet diet diet diet diet diet diet diet diet diet diet diet diet diet diet diet diet diet diet diet diet diet diet diet diet diet diet diet diet diet diet diet diet diet diet diet diet diet diet diet diet diet diet diet diet diet diet diet
The records may be used for such audits.,ऐसे लेखा-परीक्षण के लिए अभिलेखों का उपयोग किया जा सकता है।, Archives can be used for such audits.
Poshan Tracker adds new Resources on Website,पोषण ट्रैकर ने वेबसाइट सुविधा पर नई संसाधन जोडा है,eng Nutrition Tracker has added new resources to the website feature.
"Technology under Poshan Tracker is being leveraged for dynamic identification of stunting, wasting, under-weight prevalence among children and last mile tracking of nutrition service delivery","पोषण ट्रैकर के तहत प्रौद्यौगिकी का उपयोग स्टंटिंग, वेस्टिंग, कम वजन वाले बच्चों की पहचान और पोषण सेवा के वितरण को गतिशील पहचान देने में किया जा सकता है।"," Nutrition Tracker technology can be used to dynamically identify stunting, wasting, identifying low-weight children and distributing nutrition services."
