eng,hi,translation_text
The Site is directed to the people residing in India.,यह साइट भारत में रहने वाले लोगों के लिए निर्देशित है।,eng.co.uk - This site is directed to people living in India.
We do not represent that Content available on or through the Site is appropriate or available in other locations.,हम इस साइट पर या उसके माध्यम से उपलब्ध सामग्री की उपयुक्तता या अन्य स्थानों पर इसकी उपलब्धता का आश्वासन नहीं देते हैं।,/We do not guarantee the suitability of the content available on or through this site or its availability elsewhere.
We may limit the availability of the Site or any service or product described on the Site to any person or geographic area at any time.,हम किसी भी समय किसी भी व्यक्ति या भौगोलिक क्षेत्र में साइट या साइट पर वर्णित किसी सेवा या उत्पाद की उपलब्धता को सीमित कर सकते हैं।,eng.co.uk - We may at any time restrict the availability of any service or product described on the site to any person or geographic area in any given time.
"If you choose to access the Site from outside India, you do so at your own risk.","यदि आप भारत के बाहर से साइट के उपयोग का चयन करते हैं, तो ऐसा आप अपने जोखिम पर कर सकते हैं।"," If you choose to use the site from outside India, you can do so at your own risk."
Please go back to the homepage,कृपया मुखपृष्ठ पर वापस जाएं,eng biko go back to the homepage
Please enter Height greater than 29.99 and less than 140.01,"कृपया, 29.99 से अधिक और 140.01 से कम ऊँचाई दर्ज करें","eng, please enter height above 29.99 and below 140.01"
"While login to the Poshan Tracker App, AWWs are required to enter the MPIN set by them.","पोषण ट्रैकर ऐप में लॉगिन करते समय, एडब्ल्यूडब्ल्यू को उनके द्वारा निर्धारित एमपीआई में प्रवेश करना होता है।"," When logging into the Nutrition Tracker app, AWW has to enter the MPI they set."
This MPIN will act as a passcode to run the Poshan Tracker App and entering the information in the beneficiaries forms.,यह एमपीआईएन पोषण ट्रैकर ऐप चलाने और लाभार्थियों के फॉर्म में जानकारी दर्ज करने के लिए एक पासकोड के रूप में कार्य करेगा।, This will act as a passcode for running the MPIN Nutrition Tracker app and entering information in the beneficiaries form.
How to ensure timely initiation of complementary feeding,पूरक पोषण की आवधिक सुनिश्चितता कैसे करें, How to ensure periodicity of supplementary nutrition
Poshan Tracker App can only be installed in Android Phone with Android version 6.0 and above.,पोषण ट्रैकर ऐप केवल एंड्रॉइड फोन में एंड्रॉइड संस्करण 6.0 और इसके बाद के संस्करण में स्थापित किया जा सकता है।,eng Nutrition Tracker app can only be installed on Android phones in Android version 6.0 and later.
General Awareness about Growth Monitoring of Children,बच्चों के विकास से संबंधित निगरानी के बारे में सामान्य जागरूकता,engekerjaan umum kesadaran tentang pengawasan yang berhubungan dengan perkembangan anakhi
Wasting is defined as low weight-for-height,वेस्टिंग को वजन के अनुपात में ऊँचाई के न होने के रूप में परिभाषित किया गया है,eng.co.uk: Wasting is defined as having no height in weight ratio.
Hot Cooked Meal (HCM) Given Today,आज दिया गया गरम पका हुआ भोजन (एचसीएम) लें, Eat the hot cooked meal (HCM) given today.
There are 6 categories for beneficiariesPregnant WomenLactating MotherChildren from 0 to 6 monthsChildren from 6 months to 3 yearsChildren from 3 years to 6 yearsAdolescent girls,यहाँ लाभार्थियों की 6 श्रेणियाँ हैंगर्भवती महिलास्तनपान कराने वाली माता0-6 माह तक के बच्चे6 माह - 3 वर्ष तक के बच्चे6 वर्ष - 3 वर्ष तक के बच्चेकिशोरी लडकियाँ/बालिकाएँ,eng: Here are 6 categories of beneficiaries: Pregnant women Breastfeeding mothers0-6 months to children6 months to 3 years to children6 years to children3 years to childrenTiny girls/girls
 VIII. LIMITATIONS OF MULTI- LINGUAL INTERFACE, VIII. बहुभाषी इंटरफेस की सीमाएँ,eng.Permaniasi antarmuka multibahasa
Srijangram I. C. D. S. Project,श्रीजंगग्राम आईसीडीएस परियोजना,engram icsds project
"We may investigate any violation of these Terms, including unauthorized use of the Site.",हम इस साइट के अनधिकृत उपयोग सहित इन शर्तों के किसी भी प्रकार के उल्लंघन की जाँच कर सकते हैं।," We may investigate any breach of these terms, including unauthorized use of this site."
We may provide law enforcement with information you provide to us related to your transactions to assist in any investigation or prosecution of you.,हम किसी भी जाँच या वाद के संदर्भ में सहायता प्रदान करने हेतु आपके लेनदेन से संबंधित सूचना को कानूनी रूप से प्रवर्तन निर्देशालय को प्रदान कर सकते हैं।, We may provide the Legal Enforcement Directorate with information related to your transaction to assist in the handling of any inquiries or disputes.
We may take legal action that we feel is appropriate.,हम किसी भी प्रकार के वाद या उल्लंघन से संबंधित मामलों में उपयुक्त कानूनी कार्रवाई कर सकते हैं।, We may take appropriate legal action in cases relating to any kind of claim or breach.
Poshan Calculator helps to identify various health conditions of the child as per World Health Organization (WHO) standards,विश्व स्वास्थ्य संगठन के अनुसार पोषण मापक बच्चों के विभिन्न प्रकार के स्वास्थ्य स्थितियों की पहचान करने में सहायता प्रदान करता है, The Nutrition Scale (NMS) is a nutritional meter used by the World Health Organization to help identify various health conditions in children.
How to take care of weak newborn with the help of Kangaroo Mother Care,कंगारु मदर केयर के साथ अपने कमजोर नवजात बच्चों की देखभाल कैसे करें,engaru mother care how to care for your vulnerable newborn babies with kangaru mother care
"Any liabilities civil or criminal, arising out of any incorrect data, shall solely lie with the concerned ASP.",किसी भी गलत आँकडे से उत्पन्न होने वाली सिविल या आपराधिक देनदारियाँ पूर्णतः संबंधित ASP के पास होंगी।,: Any false statistics resulting from any wrongful statements will be entirely held by the relevant ASP.
Poshan Tracker App is available over Google playstore https://play. google. com/store/apps/details?,पोषण ट्रैकर ऐप गूगल प्ले स्टोर  https://play.google.com/store/apps/details?,/store/aphips/details?
Can App be accessed without internet?,क्या ऐप को इंटरनेट के बिना अभिगम किया जा सकता है?,eng.co.id - Is the app accessible without internet?
The Government has taken several initiatives to break the intergenerational cycle of malnutrition in children.,बच्चों में कुपोषण के अंतरजनपदीय चक्र को तोडने के लिए सरकार ने कई पहल की हैं।," ""The government has taken several initiatives to break the interpersonal cycle of malnutrition in children."
"Adopting a life-cycle approach, interventions have been designed to meet the nutritional requirement of adolescent girls and boys, pregnant women, lactating mothers and children.","जीवन-चक्र के दृष्टिकोण को अपनाते हुए, किशोर लडकियों और लडकों, गर्भवती महिलाओं, स्तनपान कराने वाली माताओं और बच्चों की पोषण संबंधी आवश्यकता को पूरा करने के लिए हस्तक्षेपों को डिजाइन किया गया है।","eng, adopting a life-cycle approach, the interventions are designed to meet the nutritional needs of teenage girls and boys, pregnant women, breastfeeding mothers and children."
Awareness for Pregnancy in Preventing Anemia,गर्भावस्था के दौरान एनीमिया से बचाव पर जागरूकता,eng.org - Awareness on defending against anemia during pregnancy
"Howrah North (U) I. C. D. S. Project, Howrah","हावडा उत्तर (यू) आईसीडीएस परियोजना, हावडा","eng Hawada North (U) ICDS Project, Hawada"
Birth Preparedness- For Institutional and Home Delivery,जन्म से पूर्व तैयारी-नैदानिकों और गृह प्रसव के संदर्भ में, Pre-natal preparation - clinicians and home delivery - in terms of home delivery
New beneficiary addition with skip OTP option,स्किप ओटीपी विकल्प के साथ नई  लाभार्थी संयोजन, A new beneficiary combination with the skip OTP option
We are now available on Video Conference,अब हम वीडियो कॉन्फ्रेंस पर उपलब्ध हैं, We are now available via videoconferencing.
"Poshan Tracker App is meant for Aanganwadi workers, Anganwadi centers to enter beneficiaries data in the forms.",पोषण ट्रैकर ऐप आंगनवाडी कार्यकर्ताओं के लिए है जो आंगनवाडी केंद्रों के लाभार्थियों के डेटा को प्रपत्रों में दर्ज करता है।,engadi workers app nutrition tracker app is for anganwadi workers app which records data of the beneficiaries of anganwadi centers in forms.
It is not at all developed for general public.,यह आम जनता के लिए बिल्कुल भी विकसित नहीं है।,eng.it is not developed at all for the general public.
Swastha Balak/Balika Spardha Mission is about celebrating the health of children in India.,Swastha Balak/Balika Spardha Mission is about celebrating the health of children in India., Swhiastha Balak/Balika Spardha Mission is about celebrating the health of children in India.
It entails identification and awareness of health conditions and providing necessary support wherever required.,It entails identification and awareness of health conditions and providing necessary support wherever required.,"eng, e.g. identification and awareness of health conditions and providing necessary support wherever needed."
”Our Privacy Policy applies when you use our Services (described below).,"""Our Privacy Policy applies when you use our Services (described below).","eng ""Kebijakan Privasi kami berlaku ketika Anda menggunakan Layanan kami (dikritikasi di bawah)."
"This Privacy Policy is meant to help you understand what information we collect, why we collect it, and how it is used and shared.","This Privacy Policy is meant to help you understand what information we collect, why we collect it, and how it is used and shared.",engengengengengengengengengengengengengengengengengengengengengengengengengengengengengengengengengengengengengengengengengengengengengengengengengengengengengengengengengengengengengengengengengengengengengengengengengengengengengengengengengengengengengengengengengengengengengengengengengengengengengengengengengengengengengengengengengengengengengengengengengengengengengengengengengengengengengengengengengengengengengengengengengengengengengengengengengengengengengengengengengengengengengengengengengengengengengengengengengengengengengengengengengengengengengengengengengengengengengengeng
The collecting and retaining agency in respect of your information is Ministry of Women and Child Development.,The collecting and retaining agency in respect of your information is Ministry of Women and Child Development., The only agency collecting and retaining your information is the Ministry of Women and Child Development.
We are committed to protecting the security of your personal information and safeguarding your privacy.,We are committed to protecting the security of your personal information and safeguarding your privacy.,eng.co.uk Kami berkomitmen untuk melindungi keamanan informasi pribadi Anda dan melindungi privasi Anda.
How to revive your health if you are Underweight,"यदि आप कम वजन वाले हैं, तो अपने स्वास्थ्य को पुनर्जीवित कैसे करें","eng, if you are low weight, how to revive your health"
Can a beneficiary change his/her AWC?,क्या कोई लाभार्थी अपना आँगनवाडी केंद्र परिवर्तित कर सकता है?,engekontributor bisa mengubah pusat pangkalan mereka?
"We use the information we have, to help verify accounts.",खातों को सत्यापित करने में सहायता के लिए हम अपने पास मौजूद सूचना का उपयोग करते हैं।," To help verify accounts, we use the information we have at our disposal."
The records may be used for verification of health status for the purposes of Poshan Tracker control and response.,पोषण ट्रैकर नियंत्रण और प्रतिक्रिया के प्रयोजनों के लिए रिकॉर्ड का उपयोग स्वास्थ्य स्थिति के सत्यापन के लिए किया जा सकता है।, Nutrition Tracker Records for control and response purposes can be used to verify a health status.
Scan the QR Code to Download the App,ऐप डाउनलोड करने के लिए क्यूआर कोड को स्कैन करें,eng kode QR untuk download aplikasi
Who is eligible for Hot Cooked Meal?,गर्म पके हुए भोजन के लिए कौन पात्र है?,eng.org Siapa yang layak makan makanan panas?
Identifying and preventing Severe Acute Malnutrition,गंभीर कुपोषण की पहचान और बचाव, Identify and prevent severe malnutrition
Children who are identified as deficit on nutrition are eligible for additional food supplements.,पोषण की कमी वाले बच्चों के रूप में पहचाना जाने वाले बच्चे अतिरिक्त पूरक आहार के लिए पात्र हैं।, Children identified as malnourished children are eligible for additional dietary supplements.
Who is eligible for additional supplementary food.,अतिरिक्त पूरक भोजन के लिए कौन पात्र है।,eng.hi Siapa yang layak untuk makanan tambahan.
Children between 6 months - 3 years,6 महीने से 3 साल के बीच के बच्चे,eng bayi umur 6 bulan 3 tahun
"Ministry of Women and Child Development, Government of India, Shastri Bhawan, New Delhi","महिला एवं बाल विकास मंत्रालय, भारत सरकार, शास्त्री भवन, नई दिल्ली","eng Ministry of Women and Child Development, Government of India, Shastri Bhawan, New Delhi"
Care of the weak newborn baby - How many weak babies are we missing?,कमजोर नवजात शिशु की देखभाल- हमारे द्वारा कितने कमजोर शिशुओं की अनदेखी हुई है?,eng bayi-bahaya lemah-berapa bayi lemah kita telah mengabaikan?
Underweight children who received Supplementary Nutrition,पूरक पोषण प्राप्त करने वाले कम वजन के बच्चे, Children with low weight who receive supplemental nutrition
This defense and indemnification obligation will survive this Agreement and your use of the Service and Website/App.,यह रक्षा और क्षतिपूर्ति दायित्व इस वेबसाइट/ऐप केअनुबंध और सेवा आपके उपयोग से बचे रहेंगे।, This protection and compensation obligation of this website/app will be exempt from your use of the contract and service.
Identification and care of a Weak Newborn baby,कमजोर नवजात शिशु की पहचान और देखभाल,eng.org Identify and care of vulnerable newborn babies
1.2. Information from use of services.,1.2. सेवाओं के उपयोग से प्राप्त सूचनाएँ।,eng.1.2hi - Notifications obtained from the use of the Services.
Please contact your respective Anganwadi Centre.,"कृपया, अपने संबंधित आँगनवाडी केंद्र से संपर्क करें।","eng, mangga hubungi pusat angganwadi yang relevan."
GOBARDANGA I. C. D. S PROJECT(U),गोबरदंगा आईसीडीएस परियोजना (यू),engoranda ICDS project (U)
Please fill in the form below to create a new ticket.,नया टिकट बनाने के लिए कृपया नीचे दिए गए प्रपत्र को भरें।," To create a new ticket, please fill out the form below."
Anganwadi Worker will reach out to you within 48 hours.,आँगनबाडी कार्यकर्ता 48 घंटे के अंदर आपसे संपर्क करेगी।,engbadhi worker will contact you within 48 hours.
Please note down the ticket number for future reference.,कृपाकए भविष्यक सन्दर्भ लेल टिकट संख्या नोट करू।, Please note the ticket number for future reference.
Poshan Tracker is a project of Ministry of Women and Child Development.,पोषण ट्रैकर महिला एवं बाल विकास मंत्रालयक एकटा परियोजना अछि।," ""Putrient Tracker"" is a project of the Ministry of Women and Child Development."
Digital India Corporation is the technical partner of MoWCD.,डिजिटल इंडिया कॉर्पोरेशन महिला एवं बाल विकास मंत्रालय (MoWCD) केँ एकटा तकनीकी भागीदार अछि।,eng Digital India Corporation is a technical partner to the Ministry of Women and Child Development (MoWCD).
Poshan Tracker focuses on eradication of malnutrition from India.,पोषण ट्रैकर भारत मे कुपोषणक उन्मूलन पर केंद्रित अछि।,eng nutrition tracker focuses on eliminating malnutrition in india.
It serves as a mechanism to monitor and improvise on the service delivery under Poshan Abhiyaan,सेवा वितरण पर निगरानी आ सुधार करबाक लेल पोषण अभियान केर अधीनस्थ ई एकटा तंत्रक रूप मे कार्य करैत अछि, E.N.H.E. operates as a single mechanism to monitor and improve the delivery of services.
Is poshan trackers app available over Apple I Store also?,क्या ऐप्पल आई स्टोर पर भी पोषण ट्रैक ऐप उपलब्ध है?,eng.co.uk - Is the Nutrition Trackhi app available on the Apple I Store?
Number of records becoming inactive and number of records migrating from one category to another,निष्क्रिय होने वाले रिकॉर्डों  की संख्या और एक श्रेणी से दूसरी श्रेणी में जाने वाले रिकॉर्डों  की संख्या, The number of records that are deactivated and the number of records that are moved from one category to another category.
In How many languages the Poshan Tracker App is available?,पोषण ट्रैकर ऐप कितनी भाषाओं में उपलब्ध है?,eng Nutrition Tracker app is available in how many languages?
AWWs are requested to enter their mobile numbers in the Login screen.,एडब्ल्यूडब्ल्यू से अनुरोध है कि लॉगिन स्क्रीन में अपने मोबाइल नंबर दर्ज करें।,.au.au.au.au.au.au.au.au.au.au.au.au.au.au.au.au.au.au.au.au.au.au.au.au.au.au.au.au.au.au.au.au.au.au.au.au.au.au.au.au.au.au.au.au.au.au.au.au.au.au.au.au.au.au.au.au.au.au.au.au.au.au.au.au.au.au.au.au.au.au.au.au.au.au.au.au.au.au.au.au.au.au.au.au.au.au.au.au.au.au.au.au.au.au.au.au.au.au
"An OTP will be sent to your registered mobile number, post which you are required too set your MPIN.","आपके पंजीकृत मोबाइल नंबर पर एक ओटीपी भेजा जाएगा जिसकी आपको आवश्यकता है, अपना एमपीआईएन स्थापित करें।","eng.exe OTP akan dikirim ke nomor mobile anda yang terdaftar, anda perlu, install MPIN anda."
Measles Containing vaccine (MCV)/MR-2JE-2**DiphtheriaPertussis & Tetanus (DPT)-Booster-1OPV –Booster,खसरा युक्त टीका (MCV)/MR-2JE-2**डिप्थीरियापर्टुसिस और टिटनेस (DPT)-बूस्टर-1OPV-बूस्टर,eng/MR-2JE-2**Diptheriapertucis and Tittness (DPT) -Booster-1OPV-Booster
The Poshan Tracker enables real-time monitoring and tracking of all AWCs and beneficiaries on defined indicators.,यह पोषण ट्रैकर परिभाषित संकेतकों के आधार पर वास्तविक समयावधि और सभी आँगनवाडी कार्यकर्ताओं के साथ-साथ लाभार्थियों की ट्रैकिंग और निगरानी सक्षम बनाता है।, This nutrition tracker enables real-time and monitoring of all courtyard workers as well as beneficiaries based on the indicators defined by the nutrition tracker.
It is built using centralized data architecture that also aligns with the digital technology systems of other ministries and programs.,इसका निर्माण केंद्रीकृत आँकडों के ढाँचों का उपयोग करके किया जाता है जिसमें अन्य मंत्रालय और उनके कार्यक्रम डिजिटल प्रणाली द्वारा एक संरेखित होते हैं।,eng.io) - It is constructed using centralized data structures in which other ministries and their programs are aligned by a digital system.
