eng,ta,translation_text
How many different types of reports can be generated over Poshan Tracker Dashboard?,போஷன் டிராக்கர் டாஷ்போர்டில் எத்தனை வகையான அறிக்கைகளை உருவாக்க முடியும்?,engengengengengengengengengengengengengengengengengengengengengengengengengengengengengengengengengengengengengengengengengengengengengengengengengengengengengengengengengengengengengengengengengengengengengengengengengengengengengengengengengengengengengengengengengengengengengengengengengengengengengengengengengengengengengengengengengengengengengengengengengengengengengengengengengengengengengengengengengengengengengengengengengengengengengengengengengengengengengengengengengengengengengengengengengengengengengengengengengengengengengengengengengengengengengengengengengengengengengengeng
How to revive your health if you are Severely Wasted (SAM),நீங்கள் கடுமையான ஊட்டச்சத்து குறைபாடு உள்ளவராக இருந்தால் (SAM) உங்கள் ஆரோக்கியத்தை எவ்வாறு மீட்டெடுப்பது, If you are severely malnourished (SAM) how to restore your health
"See assessment charts for Stunted, Wasted and Underweight parameters","குன்றிய, ஊட்டச்சத்து குறைபாடுள்ள மற்றும் எடை குறைந்த அளவுருக்களுக்கான மதிப்பீட்டு விளக்கப்படங்களைப் பார்க்கவும்","eng, malnutrition, and weight loss ratings chart."
Resources for growth monitoring and general awareness,வளர்ச்சியைக் கண்காணித்தல் மற்றும் பொதுவான புரிதலுக்கான வளங்கள்,engasaprekerjaan untuk memantau perkembangan dan sumber daya untuk pemahaman umum
AWW are required to enter details related to infrastructure present in a particular Anganwadi centre.,ஒரு குறிப்பிட்ட அங்கன்வாடி மையத்தில் இருக்கும் உள்கட்டமைப்பு தொடர்பான விவரங்களை அடபிள்யூடபிள்யூ உள்ளிட வேண்டும்.,/APAW must enter details of the infrastructure at a particular Anganwadi center.
"This includes structure, basic amenities, facilities, sanitization, drinking water etc.","இதில் கட்டமைப்பு, அடிப்படை வசதிகள், வசதிகள், சுத்திகரிப்பு, குடிநீர் போன்றவை அடங்கும்.","eng, infrastruktur, fasilitas, pemurnian, air minum, dll."
Lactating mothers who received Take Home Ration (THR),டேக் ஹோம் ரேஷன் (THR) பெற்ற பாலூட்டும் தாய்மார்கள்,engengengengengengengengengengengengengengengengengengengengengengengengengengengengengengengengengengengengengengengengengengengengengengengengengengengengengengengengengengengengengengengengengengengengengengengengengengengengengengengengengengengengengengengengengengengengengengengengengengengengengengengengengengengengengengengengengengengengengengengengengengengengengengengengengengengengengengengengengengengengengengengengengengengengengengengengengengengengengengengengengengengengengengengengengengengengengengengengengengengengengengengengengengengengengengengengengengengengengengeng
"Poshan Tracker reserve the unconditional right to change, modify, add, or remove any part of this Privacy Policy at any time, without specifically notifying you of such changes.","போஷன் டிராக்கர் இந்த தனியுரிமைக் கொள்கையின் எந்தப் பகுதியையும், எந்த நேரத்திலும், அத்தகைய மாற்றங்களைப் பற்றி உங்களுக்குத் தெரிவிக்காமல், எந்த நேரத்திலும் மாற்ற, மாற்ற, சேர்க்க அல்லது அகற்ற நிபந்தனையற்ற உரிமையைப் பெற்றுள்ளார்."," PostionTracker reserves the unconditional right to modify, alter, add or remove any part of this Privacy Policy at any time without notice to you of such changes."
Any changes or updates will be effective immediately.,ஏதேனும் மாற்றங்கள் அல்லது புதுப்பிப்புகள் செய்யப்பட்டால் அவை உடனடியாக நடைமுறைக்கு வரும்.," If any changes or updates are made, they will come into effect immediately."
You should review this Privacy Policy regularly for changes.,மாற்றங்களுக்கு இந்த தனியுரிமைக் கொள்கையை நீங்கள் தொடர்ந்து மதிப்பாய்வு செய்ய வேண்டும்., You should review this privacy policy regularly for changes.
"We will use commercially reasonable efforts to generally notify all users of any material changes to this Privacy Policy, such as through a notice on the System.","இந்த தனியுரிமைக் கொள்கையில் ஏதேனும் பொருள் மாற்றங்கள் இருந்தால், சிஸ்டத்தில் அறிவிப்பு மூலம் அனைத்துப் பயனர்களுக்கும் பொதுவாகத் தெரிவிக்க வணிக ரீதியாக நியாயமான முயற்சிகளைப் பயன்படுத்துவோம்."," If there are any material changes to this privacy policy, we will use commercially reasonable efforts to inform all users in general by means of a notice on the system."
"However, as a user of the System, you should regularly check the Privacy Policy for any changes.","இருப்பினும், கணினியின் பயனராக, ஏதேனும் மாற்றங்கள் இருந்தால் தனியுரிமைக் கொள்கையை நீங்கள் தொடர்ந்து சரிபார்க்க வேண்டும்.","eng, sebagai pengguna komputer, anda harus terus-menerus memeriksa kebijakan privasi jika ada perubahan."
"We will also update the “Last Updated” date at the top of this Privacy Policy, which reflects the effective date of this Privacy Policy.","இந்தத் தனியுரிமைக் கொள்கையின் மேலே உள்ள ""கடைசியாகப் புதுப்பிக்கப்பட்ட"" தேதியையும் நாங்கள் புதுப்பிப்போம், இது இந்தத் தனியுரிமைக் கொள்கையின் நடைமுறைத் தேதியைப் பிரதிபலிக்கிறது."," We will also update the ""last updated"" date above this Privacy Policy, which reflects the effective date of this Privacy Policy."
Your continued access or use of the System after the date of the new Privacy Policy constitutes your acceptance of the new Privacy Policy.,புதிய தனியுரிமைக் கொள்கையின் தேதிக்குப் பிறகு உங்கள் தொடர்ச்சியான அணுகல் அல்லது கணினியைப் பயன்படுத்துவது புதிய தனியுரிமைக் கொள்கையை நீங்கள் ஏற்றுக்கொள்வதைக் குறிக்கிறது.,eng.ta's continued access or use of your computer after the date of the new privacy policy means that you accept the new privacy policy.
"If you do not agree to the new Privacy Policy, you must stop accessing and/or using the System.","புதிய தனியுரிமைக் கொள்கையை நீங்கள் ஏற்கவில்லை என்றால், நீங்கள் கணினியை அணுகுவதையும்/அல்லது பயன்படுத்துவதையும் நிறுத்த வேண்டும்.","eng.at Jika anda tidak setuju dengan kebijakan privasi baru, anda harus berhenti mengakses dan/atau menggunakan komputer anda."
What is the eligibility of a beneficiary?,ஒரு பயனாளியின் தகுதி என்ன?,eng.ta Apakah kualifikasi penerima manfaat?
"No, Poshan Tracker is available only for Android version","இல்லை, போஷன் டிராக்கர் ஆண்ட்ராய்டு பதிப்பை மட்டுமே கிடைக்கிறது","eng, Postion Tracker is only available in Android version."
 XV. INDEMNITY AND LIMITATION OF LIABILITY, XV. இழப்பீடு மற்றும் பொறுப்பு வரம்பு,eng. XVta. Limitasioner dan Liability Limitasioner dan Liability Limitasioner
Growth monitoring report for all health indicators,எல்லா ஆரோக்கியக் குறியீடுகளுக்கும் வளர்ச்சி கண்காணிப்பு அறிக்கை,engat laporan pelacakan pertumbuhan untuk semua indeks kesehatan
Take Home Ration (THR) given in last 30 days,கடந்த 30 நாட்களில் கொடுக்கப்பட்ட டேக் ஹோம் ரேஷன் (THR),engeti tag home ration (THR) for the last 30 days.
Children are defined as stunted if their height-for-age is more than two standard deviations below the WHO Child Growth Standards median,"WHO குழந்தை வளர்ச்சித் தரநிலையின் சராசரிக்குக் கீழே குழந்தைகளின் உயரம் அவர்களின் வயதுக்கு இரண்டு நிலையான விலகல்களுக்கு மேல் இருந்தால், அவர்கள் வளர்ச்சி குன்றியவர்களாக வரையறுக்கப்படுகிறார்கள்","eng.co.uk. - ""If the height of children below the average of the child development standard is more than two fixed deviations from their age, they are defined as retarded""."
What is the purpose of Launching Poshan Tracker?,போஷன் டிராக்கரைத் தொடங்குவதன் நோக்கம் என்ன?, What is the purpose of starting a Bosta Tracker?
"As a registered user, you have the right to access your profile at any time.","பதிவுசெய்யப்பட்ட பயனராக, எந்த நேரத்திலும் உங்கள் சுயவிவரத்தை அணுக உங்களுக்கு உரிமை உள்ளது.","engasupplier, you have the right to access your profile at any time."
"Although, the changes can only be done as prescribed by the Poshan Tracker system from time to time.","இருப்பினும், போஷன் டிராக்கர் அமைப்பால் அவ்வப்போது பரிந்துரைக்கப்பட்ட மாற்றங்களை மட்டுமே செய்ய முடியும்.","eng, postion tracker system can only make the recommended changes from time to time."
You cannot manage the communications that you receive from us or how you receive them.,எங்களிடமிருந்து நீங்கள் பெறும் தகவல்தொடர்புகளையோ அல்லது அவற்றை எவ்வாறு பெறுகிறீர்கள் என்பதையோ உங்களால் நிர்வகிக்க முடியாது., You cannot control the communications you receive from us or how you receive them.
" XIII. COMPLIANCE WITH LAW, THIRD PARTY RIGHTS, AND OTHER TERMS OF SERVICE"," XIII. சட்டம், மூன்றாம் தரப்பினரின் உரிமைகள் மற்றும் பிற சேவை விதிமுறைகளுடன் இணங்குதல்","eng.Legis XIII, hak pihak ketiga, dan ketentuan layanan lainnya."
"repeated infection, and inadequate psychosocial stimulation","தொற்று, மற்றும் போதிய உளவியல் தூண்டுதல்","eng, dan cukup instigator psikologis."
Beneficiary migration from one AWC to another AWC,பயனாளர் ஒரு AMC-இலிருந்து இன்னொரு AMC-க்கு மாறுதல்,/User switching from one AMC to another AMC
"Training on ICT Platform under POSHAN Abhiyaan (02 February, 2021)","போஷன் அபியான் (02 பிப்ரவரி, 2021) இன் கீழ் ஐ. சி. டி இயங்குதளத்தில் பயிற்சி"," Training at the ICT platform under the Botha Bhushan Abhiyan (02 February, 2021)"
You may browse the Site without registering for an account.,நீங்கள் ஒரு கணக்கிற்கு பதிவு செய்யாமல் தளத்தில் உலாவலாம்., You can browse the site without registering for an account.
"You will be required to register for an account with your mobile number, if you intent to use certain features or services offered by the Site.","தளம் வழங்கும் சில அம்சங்கள் அல்லது சேவைகளைப் பயன்படுத்த நீங்கள் விரும்பினால், உங்கள் மொபைல் எண்ணுடன் ஒரு கணக்கைப் பதிவு செய்ய வேண்டும்.",eng.co.uk.uk.uk.uk.uk.uk.uk.uk.uk.uk.uk.uk.uk.uk.uk.uk.uk.uk.uk.uk.uk.uk.uk.uk.uk.uk.uk.uk.uk.uk.uk.uk.uk.uk.uk.uk.uk.uk.uk.uk.uk.uk.uk.uk.uk.uk.uk.uk.uk.uk.uk.uk.uk.uk.uk.uk.uk.uk.uk.uk.uk.uk.uk.uk.uk.uk.uk.uk.uk.uk.uk.uk.uk.uk.uk.uk.uk.uk.uk.uk.uk.uk.uk.uk.uk.uk.uk.uk.uk.uk.uk.uk.uk.uk.uk.uk.uk.uk
You are solely responsible for maintaining the confidentiality of your personal information and registration and all activities that might result from you failing from keeping this information secure.,உங்கள் தனிப்பட்ட தகவல்கள் மற்றும் பதிவுகளைப் பாதுகாப்பாக வைத்திருக்கத் தவறியதன் விளைவாக ஏற்படக்கூடிய அனைத்து நடவடிக்கைகளின் இரகசியத்தன்மையைப் பேணுவதற்கு நீங்கள் மட்டுமே பொறுப்பு., You are solely responsible for maintaining the confidentiality of all actions that may result from failure to keep your personal information and records secure.
Your registration or mobile number shall be kept confidentialYou undertake that:You have obtained consent from the concerned individuals for creating their records through your account.,உங்கள் பதிவு அல்லது மொபைல் எண் ரகசியமாக வைக்கப்படும்நான் மேற்கொள்வதுஃஉங்கள் கணக்கு மூலம் சம்பந்தப்பட்ட நபர்களிடமிருந்து அவர்களின் பதிவுகளை உருவாக்குவதற்கு நீங்கள் அவர்களிடம் ஒப்புதல் பெற்றுள்ளீர்கள்.,engekerjaan:Anda telah memperoleh izin dari mereka untuk membuat catatan dari orang yang terlibat melalui akun anda.
Your account or mobile number shall not include the name of another person with the intent to impersonate that person.,உங்கள் கணக்கு அல்லது மொபைல் எண்ணில் அந்த நபரைப் போல் ஆள்மாறாட்டம் செய்யும் நோக்கத்துடன் மற்றொரு நபரின் பெயர் இடம்பெறக்கூடாது.,: Your account or mobile number should not contain another person's name with the intent to pretend to be that person.
You shall not use another user's account without their permission.,மற்றொரு பயனரின் அனுமதியின்றி நீங்கள் அவர்களுடைய கணக்கைப் பயன்படுத்தக் கூடாது., You must not use their account without the permission of another user.
"You shall immediately notify us in writing, if you discover any unauthorized use of your account or other account-related security breach.","உங்கள் கணக்கின் அங்கீகரிக்கப்படாத பயன்பாடு அல்லது கணக்கு தொடர்பான பாதுகாப்பு மீறல் ஏதேனும் இருந்தால், உடனடியாக எங்களுக்கு எழுத்துப்பூர்வமாகத் தெரிவிக்க வேண்டும்."," If there is any unauthorized use of your account or any account-related security breach, you should immediately notify us in writing."
"If we receive a complaint that your account violates someone else's rights, or violates our policies we may cancel or block your account.",உங்கள் கணக்கு வேறொருவரின் உரிமைகளை மீறுகிறது அல்லது எங்கள் கொள்கைகளை மீறுகிறது என்ற புகாரை நாங்கள் பெற்றால் உங்கள் கணக்கை நாங்கள் ரத்து செய்வோம்.," If we receive a complaint that your account violates someone else's rights or violates our policies, we will cancel your account."
"You shall not attempt to conceal your identity by using multiple Internet Protocol addresses or mobile no, or by any other means, to register participants on the Site","பல இணைய நெறிமுறை முகவரிகள் அல்லது மொபைல் எண்ணைப் பயன்படுத்தி உங்கள் அடையாளத்தை மறைக்க முயற்சிக்காதீர்கள் அல்லது வேறு எந்த வழியிலும், பங்கேற்பாளர்களை தளத்தில் பதிவு செய்ய வேண்டாம்"," Do not attempt to hide your identity using multiple Internet protocol addresses or mobile numbers or in any other way, do not register participants on the site."
Poshan Tracker App is available in 22 different languagesThe various languages available are:EnglishHindiGujaratiPunjabiMarathiBanglaKannadaTamilTeluguMalyalamOdiaAssameseNepaliDogriKonkaniSindhiBodoMaithiliManipuriSanthaliUrduKashmiri,போஷன் டிராக்கர் பயன்பாடு 22 வெவ்வேறு மொழிகளில் கிடைக்கிறதுகிடைக்கும் பல்வேறு மொழிகள்ஃஆங்கிலம்இந்திகுஜராத்திபஞ்சாபிமராத்திபங்களாகன்னடம்தமிழ்தெலுங்குமல்லியம்ஒடியாஅசாமிNepaliDogriKonkaniSindhiBodoMaithiliManipuriSanthaliUrduKashmiri,englishindigujaratipanjabimarapambiparapambiparapambiparapambiparapambiparapambiparapambiparapambiparapambiparapambiparapambiparapambiparapambiparapambiparapambiparapambiparapambiparapambiparapambiparapambiparapambiparapambiparapambiparapambiparapambiparapambiparapambiparapambiparapambiparapambiparapambiparapambiparapambiparapambiparapambiparapambiparapambiparapambiparapambiparapambiparapambiparapambiparapambiparapambiparapambiparapambiparapambiparapambiparapambiparapambiparapambiparapambiparapambiparapambiparapambiparapambiparapambiparapambiparapambiparapambiparapambiparapambiparapambipar
How to Login in Poshan Tracker App?,போஷன் டிராக்கர் பயன்பாட்டில் உள்நுழைவது எப்படி?, How do I sign in to the Bosta Tracker app?
Height and weight of child has not been measured,குழந்தையின் உயரம் மற்றும் எடை அளவீடு செய்யப்படவில்லை,enganak's height and weight have not been measured
TAKE HOME RATION (THR) GIVEN TODAY,இன்று கொடுக்கப்பட்ட டேக் ஹோம் ரேஷன் (THR), The current home ration (THR)
A beneficiary is eligible for THR for at least 21 days in a month.,ஒரு பயனாளி ஒரு மாதத்தில் குறைந்தது 21 நாட்களுக்கு THRக்கு தகுதியுடையவர்.,eng.org - A beneficiary is eligible for THR for at least 21 days a month.
 III. NOTICE REGARDING FUTURE CHANGES TO TERMS:, III. விதிமுறைகளில் எதிர்கால மாற்றங்கள் குறித்த அறிவிப்புஃ,eng. iii. Pengumuman perubahan masa depan dalam ketentuan:
Planning And Organising Community Based Events At AWC,AWC இல் சமூக அடிப்படையிலான நிகழ்வுகளைத் திட்டமிடுதல் மற்றும் ஏற்பாடு செய்தல், Planning and organizing community-based events at AWC
Please find the following steps to LoginStep 1- Click on Poshan Tracker Website https://poshantracker.,Please find the following steps to LoginStep 1- Click on Poshan Tracker Website https://poshantracker., Please find the following steps to LoginStep 1- Click on Poshan Tracker Website https://poshantracker.com/posthan-tracker/
inStep 2- Enter your registered Mobile Number and pre-set 4 digit MPIN.,inStep 2- Enter your registered Mobile Number and pre-set 4 digit MPIN.,engato 2-Ketikkan Nomor Ponsel terdaftar dan pra-set MPIN 4 digit.
How AWWS can sign up on the app if they are unable to register via their mobile numbers?,"மொபைல் மொபைல் எண்கள் வழியாக பதிவு செய்ய முடியாவிட்டால், அங்கன்வாடி ஊழியர்கள் பயன்பாட்டில் எவ்வாறு பதிவுபெற முடியும்?","eng if not via mobile phone numbers, how can anganwadi employees register on the app?"
Poshan Tracker adds new Reports feature,ரோஷன் டிராக்கர் புதிய அறிக்கைகள் அம்சத்தைச் சேர்க்கிறது, RotaRotation Tracker adds a new reporting feature.
General Awareness about preventing illness in Children,குழந்தைகளுக்கு ஏற்படும் நோய்களைத் தடுப்பது பற்றிய பொதுவான விழிப்புணர்வு,eng.org/fr/FB/FB/FB/FB/FB/FB/FB/FB/FB/FB/FB/FB/FB/FB/FB/FB/FB/FB/FB/FB/FB/FB/FB/FB/FB/FB/FB/FB/FB/FB/FB/FB/FB/FB/FB/FB/FB/FB/FB/FB/FB/FB/FB/FB/FB/FB/FB/FB/FB/FB/FB/F/FB/F/F/F/F/F/F/F/F/F/F/F/F/F/F/F/F/F/F
2. HOW WE USE PERSONAL INFORMATION,2. தனிப்பட்ட தகவலை நாங்கள் எவ்வாறு பயன்படுத்துகிறோம்,eng.and How We Use Personal Information 2.and How We Use Personal Information We use personal information as we use personal information as we use personal information as we use personal information as we use personal information as we use personal information as we use personal information as we use personal information as we use personal information as we use personal information as we use personal information as we use personal information as we use personal information as we use personal information as we use personal information as we use personal information as we use personal information as we use personal information as we use personal information as we use personal information as we use personal information as we use personal information as we use personal information as we use personal information as we use personal information as we use personal information as we use personal information as we use personal information as we use personal information as we use personal information as we use personal information as we use personal information as we use personal information as we use personal information as we use personal information as we use personal information as we use personal information
