eng,ta,translation_text
AWWs are requested to enter their mobile numbers in the Login screen.,அங்கன்வாடி ஊழியர்கள் உள்நுழைவுத் திரையில் தங்கள் மொபைல் எண்களை உள்ளிடுமாறு கேட்டுகொள்ளப்படுகின்றனர்.,engwaddy employees are asked to enter their mobile numbers on the login screen.
"An OTP will be sent to your registered mobile number, post which you are required too set your MPIN.","உங்கள் பதிவுசெய்யப்பட்ட மொபைல் எண்ணுக்கு ஒரு OTP அனுப்பப்படும்,அதற்கு பிறகு உங்கள் எம்பின் ஐ அமைக்கவும்.",", dan akan dikirim OTP ke nomor handphone anda yang terdaftar,dan kemudian setup empin anda."
Measles Containing vaccine (MCV)/MR-2JE-2**DiphtheriaPertussis & Tetanus (DPT)-Booster-1OPV –Booster,தட்டம்மை கொண்ட தடுப்பூசி (MCV)/MR-2JE-2**தொண்டை அடைப்பான் நோய்பெர்டுசிஸ் & டெட்டனஸ் (DPT)-பூஸ்டர்-1OPV - பூஸ்டர்,eng Vaccine with Vaccine (MCV) /MRta-2JE-2**Totalis neuroprotector neuroptertucis & tetanus (DPT) -booster-1OPV - booster
The Poshan Tracker enables real-time monitoring and tracking of all AWCs and beneficiaries on defined indicators.,போஷன் டிராக்கர் ஆனது அனைத்து AWCகள் மற்றும் பயனாளிகளின் நிகழ்நேர கண்காணிப்பு மற்றும் வரையறுக்கப்பட்ட குறிகாட்டிகளில் கண்காணிப்பதை செயல்படுத்துகிறது., Postion Tracker enables real-time monitoring of all AWCs and beneficiaries and tracking in limited indicators.
It is built using centralized data architecture that also aligns with the digital technology systems of other ministries and programs.,இது மற்ற அமைச்சகங்கள் மற்றும் திட்டங்களின் டிஜிட்டல் தொழில்நுட்ப அமைப்புகளுடன் இணைந்த மையப்படுத்தப்பட்ட தரவு கட்டமைப்பைப் பயன்படுத்தி கட்டமைக்கப்பட்டுள்ளது., It is structured using a centralized data structure in conjunction with other ministries and projects' digital technology systems.
The public dashboard helps to impart transparency on services delivered to beneficiaries,public dashboard பயனாளிகளுக்கு வழங்கப்படும் சேவைகளில் வெளிப்படைத்தன்மையை வழங்க உதவுகிறது,eng public dashboard helps to provide transparency in the services provided to the beneficiaries.
Translations on the Poshan Tracker Portal & App Chabot are done by third party translators.,போஷன் டிராக்கர் போர்ட்டல் & ஆப் சாட்போட் இல் மொழிபெயர்ப்புகள் மூன்றாம் தரப்பு மொழிபெயர்ப்பாளர்களால் செய்யப்படுகின்றன., Translations on the Porta & App Chatbot are performed by third-party translators.
"While the translations are done on a best effort basis, some of the parts may be incorrect.","மொழிபெயர்ப்புகள் சிறந்த முயற்சியின் அடிப்படையில் செய்யப்பட்டாலும், சில பகுதிகள் தவறாக இருக்கலாம்.","eng. -Although the translations are done on the basis of best efforts, some parts may be wrong."
Certain files and other items on the website cannot be translated.,இணையதளத்தில் உள்ள சில கோப்புகள் மற்றும் பிற உருப்படிகளை மொழிபெயர்க்க முடியாது.,eng.org - Some files and other items on the website cannot be translated.
"In addition, on translation, some applications and/or services may not function as expected, due to language barriers.","கூடுதலாக, மொழிபெயர்ப்பில், மொழி தடைகள் காரணமாக, சில பயன்பாடுகள் அல்லது சேவைகள் மொழி தடைகள் காரணமாக எதிர்பார்த்தபடி செயல்படாமல் போகலாம்.","eng, dictionaries, dictionaries, dictionaries, dictionaries, dictionaries, dictionaries, dictionaries, dictionaries, dictionaries, dictionaries, dictionaries, dictionaries, dictionaries, dictionaries, dictionaries, dictionaries, dictionaries, dictionaries, dictionaries, dictionaries, dictionaries, dictionaries, dictionaries, dictionaries, dictionaries, dictionaries, dictionaries, dictionaries, dictionaries, dictionaries, dictionaries, dictionaries, dictionaries, dictionaries, dictionaries, dictionaries, dictionaries, and dictionaries, and other languages may not work as expected due to language restrictions."
"We are working constantly to rectify any errors, omissions, or ambiguities in the translations provided on this portal.","இந்த போர்ட்டலில் வழங்கப்பட்டுள்ள மொழிபெயர்ப்புகளில் ஏதேனும் பிழைகள், தவறுகள் அல்லது தெளிவின்மைகள் இருந்தால் அவற்றைத் திருத்துவதற்கு நாங்கள் தொடர்ந்து பணியாற்றி வருகிறோம்."," If there are any errors, errors or ambiguities in the translations provided on this portal, we are continuously working to correct them."
"The MGRS collected primary growth data and related information from approximately 8500 children from widely different ethnic backgrounds and cultural settings (Brazil, Ghana, India, Norway, Oman and the USA)","MGRS ஆனது பல்வேறு இனப் பின்னணிகள் மற்றும் கலாச்சார அமைப்புகளைச் சேர்ந்த (பிரேசில், கானா, இந்தியா, நார்வே, ஓமன் மற்றும் அமெரிக்கா) சுமார் 8500 குழந்தைகளிடமிருந்து முதன்மை வளர்ச்சித் தரவு மற்றும் தொடர்புடைய தகவல்களைச் சேகரித்தது","eng.org MGRSta recruited primary development data and related information from approximately 8500 children from various racial and cultural backgrounds (Brazil, Ghana, India, Norway, Oman and the United States) and related information from approximately 8500 children from various ethnic and cultural backgrounds (Brazil, Ghana, India, Norway, Oman and the United States)."
Children of different age groups are monitored on monthly basis by AWWs.,வெவ்வேறு வயது குழந்தைகள் AWW களால் மாதாந்திர அடிப்படையில் கண்காணிக்கப்படுகிறார்கள்.,engat usia yang berbeda-beda dipantau AWW setiap bulan.
"Health indicators like Stunting, Wasting and Underweight prevalence are measured as per WHO standards.","உடல் வளர்ச்சி குன்றிய நிலை, உடல் தேய்மானம் மற்றும் எடை குறைவாக இருப்பது போன்ற சுகாதார குறிகாட்டிகள் WHO தரத்தின்படி அளவிடப்படுகிறது.","eng, obesity, and weight loss are measured according to WHO standards."
Regular growth monitoring helps AWWs to provide relevant and timely assistance to children,வளர்ச்சி கண்காணிப்பு AWW கள் குழந்தைகளுக்கு பொருத்தமான மற்றும் சரியான நேரத்தில் உதவி வழங்க உதவுகிறது,eng.org/frw/Forex Monitoring Development Monitoring helps AWWs provide appropriate and timely assistance to children.
"Awareness for Children Stunting, Wasting to prevent malnutrition in children",குழந்தைகளின் வளர்ச்சி குன்றியிருப்பதற்கான விழிப்புணர்வு மற்றும் குழந்தைகளின் ஊட்டச்சத்து குறைபாட்டை தடுப்பதற்கான விழிப்புணர்வு,engeti awareness of child development stagnation and awareness of preventing child malnutrition
Poshan Tracker adds new application features,ரோஷன் டிராக்கர் புதிய பயன்பாடு அம்சங்களைச் சேர்க்கிறது, Rotation Tracker adds new app features to the app.
Making or Updating Home Visit Planner and Initiating home visits,ஹோம் விசிட் பிளானரை உருவாக்குதல் அல்லது புதுப்பித்தல் மற்றும் வீட்டுச் சந்திப்புகளைத் தொடங்குதல், Developing or updating a Home Visit Planner and starting home visits.
Poshan Calculator is designed to measure growth of the child based on standards defined by World Health Organization (WHO),உலக சுகாதார அமைப்பு (WHO) வரையறுத்துள்ள தரநிலைகளின் அடிப்படையில் குழந்தையின் வளர்ச்சியை அளவிடும் வகையில் போஷன் கால்குலேட்டர் வடிவமைக்கப்பட்டுள்ளது, A pose calculator is designed to measure a child's development based on standards defined by the World Health Organization (WHO).
Migrated from one category to another,ஒரு பிரிவிலிருந்து இன்னொன்றுக்கு மாறி இருக்கிறார், He has moved from one department to another.
It usually occurs when a person has not had food of adequate quality and quantity and/or they have had frequent or prolonged illnesses,"ஒரு நபர் நல்ல தரமான மற்றும் போதுமான அளவு உணவை உட்கொள்ளாதபோதும், அடிக்கடி உடல்நிலை சரியில்லாமல் போவதும் அல்லது நீண்ட கால நோய்களை கொண்டிருக்கும்போதும் இது பொதுவாக நிகழ்கிறது",": This usually happens when a person does not eat good quality and sufficient food, often gets sick or has chronic illnesses."
"Poshan Abhiyaan is India’s flagship programme to improve nutritional outcomes for children, adolescents, pregnant women and lactating mothers by leveraging technology, a targeted approach and convergence.","போஷன் அபியான் என்பது குழந்தைகள், இளம் பருவத்தினர், முன்னுரிமைக்கான ஊட்டச்சத்து விளைவுகளை மேம்படுத்துவதற்கான இந்தியாவின் முதன்மை திட்டமாகும்."," ""Boshan Abhiyan"" is India's flagship program to promote the nutritional effects of children, adolescents, priority."
Hot Cooked Meal (HCM) given in last 30 days,கடந்த 30 நாட்களில் வழங்கப்பட்ட சூடான சமைத்த உணவு (HCM),eng.co.uk hot cooked food (HCM) delivered in the last 30 days
Uploading of Data of Anganwadi Services Schemes in Poshan Tracker,போஷன் டிராக்கரில் அங்கன்வாடி சேவைகள் திட்டங்களின் தரவைப் பதிவேற்றுதல்,engwadi services projects data uploading in the poshantracker
The Poshan Tracker generates automated alerts to the critical last-mile beneficiaries.,போஷன் டிராக்கர் ஆனது முக்கியமான கடைசி மைல் பயனாளிகளுக்கு தானியங்கி விழிப்பூட்டல்களை உருவாக்குகிறது., The Bosta Tracker creates automatic alerts for the beneficiaries of the critical last mile.
It also ensures efficient audit of the delivery system by documenting real time attendance of beneficiaries and duty bearers.,பயனாளிகள் மற்றும் கடமை தாங்குபவர்களின் உண்மையான நேர வருகையை ஆவணப்படுத்துவதன் மூலம் திறமையான தணிக்கையையும் இது உறுதி செய்கிறது., It also ensures efficient auditing by documenting real-time attendance of beneficiaries and obligors.
"This management information system will help the nutrition programme to scale efficiently, thereby generating and documenting positive impact","இந்த மேலாண்மை தகவல் அமைப்பு ஊட்டச்சத்து திட்டத்தை திறம்பட அளவிடுவதற்கும், நேர்மறையான தாக்கத்தை உருவாக்கி ஆவணப்படுத்துவதற்கும் உதவும்"," This management information system will help you effectively scale the nutrition program, create and document a positive impact."
How can one Download Poshan Tracker App?,போஷன் டிராக்கர் அபிபி ஐ எவ்வாறு பதிவிறக்கம் செய்யலாம்?,engengengengengengengengengengengengengengengengengengengengengengengengengengengengengengengengengengengengengengengengengengengengengengengengengengengengengengengengengengengengengengengengengengengengengengengengengengengengengengengengengengengengengengengengengengengengengengengengengengengengengengengengengengengengengengengengengengengengengengengengengengengengengengengengengengengengengengengengengengengengengengengengengengengengengengengengengengengengengengengengengengengengengengengengengengengengengengengengengengengengengengengengengengengengengengengengengengengengengengeng
"Clarification regarding Cost of Smart phones (03 June, 2021)","ஸ்மார்ட் போன்களின் விலை தொடர்பான தெளிவுபடுத்தல் (03 ஜூன், 2021)","engekapaice price of smartphones (03 June, 2021)"
along with status update once resolved,நிலை புதுப்பித்தலுடன் சேர்த்து ஒருமுறை தீர்க்கப்பட்டது,engatupdatenyaatupdatenyaatupdatenyaatupdatenyaatupdatenyaatupdatenyaatupdatenyaatupdatenyaatupdatenyaatupdatenyaatupdatenyaatupdatenyaatupdatenyaatupdatenyaatupdatenyaatupdatenyaatupdatenyaatupdatenyaatupdatenyaatupdatenyaatupdatenyaatupdatenyaatupdatenyaatupdatenyaatupdatenyaatupdatenyaatupdatenyaatupdatenyaatupdatenyaatupdatenyaatupdatenyaatupdatenyaatupdatenyaatupdatenyaatupdatenyaatupdatenyaatupdatenyaatupdatenyaatupdatenyaatupdatenyaatupdatenyaatupdatenyaatupdatenyaatupdatenyaatupdatenyaatupdatenyaatupdatenyaatupdatapapap
"The Poshan Tracker system is regularly audited by auditors engaged by MWCD, for security and scalability of the system.","போஷன் டிராக்கர் அமைப்பு, அமைப்பின் பாதுகாப்பு மற்றும் அளவிடுதல் ஆகியவற்றிற்காக, MWCD ஆல் ஈடுபட்டுள்ள தணிக்கையாளர்களால் தொடர்ந்து தணிக்கை செய்யப்படுகிறது.","eng sistem Postion Tracker, for system security and measurement, is continuously audited by MWCD's auditors."
The records may be used for such audits.,அத்தகைய தணிக்கைகளுக்கு பதிவுகள் பயன்படுத்தப்படலாம்.," For such audits, records may be used."
Poshan Tracker adds new Resources on Website,ரோஷன் இணையதள அம்சத்தில் புதிய வளங்களைச் சேர்க்கிறது, RotaRation is adding new resources to its website feature.
"If this is your first time contacting us or you've lost the ticket number, please open a new ticket","நீங்கள் எங்களைத் தொடர்புகொள்வது இதுவே முதல் முறை என்றால் அல்லது டிக்கெட் நம்பரைத் தொலைத்துவிட்டால், தயவுசெய்து புதிய டிக்கெட்டைத் திறக்கவும்","eng.co.uk Jika ini pertama kalinya anda menghubungi kami atau anda kehilangan nomor tiket, silakan buka tiket baru."
"Technology under Poshan Tracker is being leveraged for dynamic identification of stunting, wasting, under-weight prevalence among children and last mile tracking of nutrition service delivery","போஷான் டிராக்கரின் கீழ் உள்ள தொழில்நுட்பம், குழந்தைகளிடையே வளர்ச்சி குன்றிய நிலை, உடல் எடை குறைதல், உடல் எடை குறைவாக இருப்பது மற்றும் ஊட்டச்சத்து சேவை விநியோகத்தின் கடைசி மைல் கண்காணிப்பு போன்றவற்றின் ஆற்றல்மிக்க அடையாளத்திற்காக பயன்படுத்தப்படுகிறது"," ""Technology under the BOSHON TRACKER"" is used to dynamically identify the developmental decline in children, weight loss, weight loss, and last mile monitoring of nutrition service delivery."
The System also takes feedback about system performance and experience.,கணினி செயல்திறன் மற்றும் அனுபவம் பற்றிய கருத்துக்களையும் கணினி எடுத்துக்கொள்கிறது., The computer also takes on ideas about computer performance and experience.
