eng,ta,translation_text
The Site is directed to the people residing in India.,இந்த தளம் இந்தியாவில் வசிக்கும் மக்களுக்கு மட்டுமே., This site is only for people living in India.
We do not represent that Content available on or through the Site is appropriate or available in other locations.,தளத்தில் கிடைக்கும் உள்ளடக்கம் சரியானது அல்லது பிற இடங்களில் உள்ளது என்பதை நாங்கள் குறிப்பிடவில்லை., We do not mention whether the content available on the site is valid or elsewhere.
We may limit the availability of the Site or any service or product described on the Site to any person or geographic area at any time.,எந்த நேரத்திலும் எந்தவொரு நபருக்கும் அல்லது புவியியல் பகுதிக்கும் தளத்தில் விவரிக்கப்பட்டுள்ள தளம் அல்லது எந்தவொரு சேவை அல்லது தயாரிப்பின் கிடைக்கும் தன்மையை நாங்கள் கட்டுப்படுத்தலாம்., We may at any time restrict the availability of any site or service or product described on the site to any person or geographic area.
"If you choose to access the Site from outside India, you do so at your own risk.","இந்தியாவிற்கு வெளியே இருந்து தளத்தை அணுக நீங்கள் தேர்வுசெய்தால், உங்கள் சொந்த ஆபத்தில் அதைச் செய்கிறீர்கள்."," If you choose to access the site from outside India, you do so at your own risk."
Please go back to the homepage,முகப்புப்பக்கத்திற்குச் செல்லவும்,eng page page page page page page page page page page page page page page page page page page page page page page page page page page page page page page page page page page page page page page page page page page page page page page page page page page page page page page page page page page page page page page page page page page page page page page page page page page page page page page page page page page page page page page page page page page page page page page page page page page page page page page page page page page page page page page page page page page page page page page page page page page page page page page page page page page page page page page page page page page page page page page page page page page page page page page page page page page page page page page page page page page page page page page page page page page page page page page page page page page page page page page page page page page page page page page page page page page page page page page
Please enter Height greater than 29.99 and less than 140.01,29.99 க்கும் அதிகமான உயரம் மற்றும் 140.01 க்கும் குறைவான உயரத்தை உள்ளிடவும்,engengengengengengengengengengengengengengengengengengengengengengengengengengengengengengengengengengengengengengengengengengengengengengengengengengengengengengengengengengengengengengengengengengengengengengengengengengengengengengengengengengengengengengengengengengengengengengengengengengengengengengengengengengengengengengengengengengengengengengengengengengengengengengengengengengengengengengengengengengengengengengengengengengengengengengengengengengengengengengengengengengengengengengengengengengengengengengengengengengengengengengengengengengengengengengengengengengengengengengeng
"While login to the Poshan Tracker App, AWWs are required to enter the MPIN set by them.","போஷன் ட்ராக்ஜெர் பயன்பாட்டில் உள்நுழையும்போது, அங்கன்வாடி ஊழியர்கள் அவர்கள் அமைத்த எம்பின் ஐ உள்ளிட வேண்டும்."," When logging into the Postion Tracker app, Anganwadi employees must enter the mpin they have set up."
This MPIN will act as a passcode to run the Poshan Tracker App and entering the information in the beneficiaries forms.,இந்த எம்பிநான்என் போஷன் டிராக்கர் பயன்பாட்டை இயக்குவதற்கான கடவுக்குறியீடாக செயல்படும் மற்றும் பயனாளிகளின் படிவங்களில் தகவல்களை உள்ளிடும்., This MpNN Position Tracker acts as a password to run the application and enters information in the beneficiary's forms.
How to ensure timely initiation of complementary feeding,துணை உணவுகளை சரியான நேரத்தில் தொடங்குவதை எவ்வாறு உறுதிப்படுத்துவது,eng.org - How to make sure supplements start on time?
Poshan Tracker App can only be installed in Android Phone with Android version 6.0 and above.,போஷான் டிராக்கர் பயன்பாட்டை ஆண்ட்ராய்டு பதிப்பு 6.0 மற்றும் அதற்கு மேற்பட்ட ஆண்ட்ராய்டு தொலைபேசியில் மட்டுமே நிறுவ முடியும்., The BOSHON TRACKER app can only be installed on Android phones with Android version 6.0 and above.
General Awareness about Growth Monitoring of Children,குழந்தைகளின் வளர்ச்சி கண்காணிப்பு பற்றிய பொது விழிப்புணர்வு,eng.org - Public awareness of child development monitoring and child development monitoring
Wasting is defined as low weight-for-height,ஊட்டச்சத்து குறைபாடு என்பது குறைந்த எடை-உயரம் என வரையறுக்கப்படுகிறது, A malnutrition is defined as being underweight or obese.
Hot Cooked Meal (HCM) Given Today,இன்று கொடுக்கப்பட்ட சூடான சமைத்த உணவு (HCM), Hot-cooked meals (HCM) given today
There are 6 categories for beneficiariesPregnant WomenLactating MotherChildren from 0 to 6 monthsChildren from 6 months to 3 yearsChildren from 3 years to 6 yearsAdolescent girls,பயனாளிகளுக்கு 6 பிரிவுகள் உள்ளனகர்ப்பிணி பெண்கள்பாலூட்டும் தாய்மார்கள்0 முதல் 6 மாதங்கள் வரை உள்ள குழந்தைகள்6 மாதங்கள் முதல் 3 ஆண்டுகள் வரை உள்ள குழந்தைகள்3 வயது முதல் 6 வயது வரையிலான குழந்தைகள்வாலிபப் பெண்கள்,engorgoners have 6 categoriesGaberent womenBreastfeeding mothersChildren0 to 6 monthsChildren6 months to 3 yearsChildren3 years to 6 yearsChildren3 years to 6 yearsGaberent women
"Data Plan for Mobile Application (01 March, 2021)","மொபைல் பயன்பாட்டிற்கான தரவு திட்டம் (01 மார்ச், 2021)",engata Data Plan for Mobile Application (01 March 2021)
 VIII. LIMITATIONS OF MULTI- LINGUAL INTERFACE, VIII. பல மொழி இடைமுகத்தின் வரம்புகள்,eng.VIII.Limitations of multilingual interface
Srijangram I. C. D. S. Project,ஸ்ரீஜான்கிராம் ஐ. சி. டி. எஸ். புராஜக்ட்,engram ICTS Project
"We may investigate any violation of these Terms, including unauthorized use of the Site.","தளத்தின் அங்கீகரிக்கப்படாத பயன்பாடு உட்பட, இந்த விதிமுறைகளை மீறினால் நாங்கள் விசாரிக்கலாம்.","eng, Inc. We may investigate violations of these terms, including unauthorized use of the site."
We may provide law enforcement with information you provide to us related to your transactions to assist in any investigation or prosecution of you.,உங்கள் பரிவர்த்தனைகள் தொடர்பாக நீங்கள் எங்களுக்கு வழங்கிய தகவலை சட்ட அமலாக்கத்திற்கு நாங்கள் வழங்கலாம்., We may provide law enforcement with the information you provide to us in connection with your transactions.
We may take legal action that we feel is appropriate.,பொருத்தமற்றதாக நாங்கள் கருதும் தகவலின் மீது சட்ட நடவடிக்கை எடுக்கலாம்., We may take legal action against information we deem inappropriate.
Poshan Calculator helps to identify various health conditions of the child as per World Health Organization (WHO) standards,உலக சுகாதார அமைப்பின் (WHO) தரநிலைகளின்படி குழந்தையின் பல்வேறு சுகாதார நிலைமைகளை கண்டறிய போஷன் கால்குலேட்டர் உதவுகிறது,/POSATION Calculator helps to detect various health conditions of a child according to the World Health Organization (WHO) standards.
How to take care of weak newborn with the help of Kangaroo Mother Care,கங்காரு மதர் கேரின் உதவியுடன் பலவீனமான புதிதாகப் பிறந்த குழந்தையை எவ்வாறு பராமரிப்பது,engaru mother care how to care for a weak newborn baby with the help of kangaru mother care
"Any liabilities civil or criminal, arising out of any incorrect data, shall solely lie with the concerned ASP.","தவறான தரவுகளிலிருந்து எழும், எந்தவொரு சிவில் அல்லது கிரிமினல் பொறுப்புகள், ஏதேனும் சம்பந்தப்பட்ட ஏஎஸ்பியிடம் மட்டுமே இருக்கும்.","engadata, any civil or criminal liability, will only be to any concerned ASP."
Poshan Tracker App is available over Google playstore https://play. google. com/store/apps/details?,கூகிள் பிளேஸ்டோர் மூலம் போஷன் டிராக்கர் பயன்பாடு https://play. google. com/store/apps/details?,/store/apps/details?
Can App be accessed without internet?,இணையம் இல்லாமல் அபிபி ஐ அணுக முடியுமா?,eng.co.id - Is it possible to access ABB without internet?
The Government has taken several initiatives to break the intergenerational cycle of malnutrition in children.,குழந்தைகளில் ஊட்டச்சத்து குறைபாட்டின் இடைநிலை சுழற்சியை உடைக்க அரசாங்கம் பல முயற்சிகளை எடுத்துள்ளது., The government has taken several initiatives to break the intermittent cycle of malnutrition in children.
"Adopting a life-cycle approach, interventions have been designed to meet the nutritional requirement of adolescent girls and boys, pregnant women, lactating mothers and children.","வாழ்க்கைச் சுழற்சி அணுகுமுறையை ஏற்றுக்கொள்வது, இளம் பருவ பெண்கள் மற்றும் சிறுவர்கள், கர்ப்பிணிப் பெண்கள், பாலூட்டும் தாய்மார்கள் மற்றும் குழந்தைகளின் ஊட்டச்சத்து தேவைகளைப் பூர்த்தி செய்ய தலையீடுகள் வடிவமைக்கப்பட்டுள்ளன.","engatupting lifecycle approach, the interventions are designed to meet the nutritional needs of teenage girls and boys, pregnant women, nursing mothers and children."
Awareness for Pregnancy in Preventing Anemia,கர்ப்ப காலத்தில் இரத்த சோகை வராமல் தடுப்பது குறித்த விழிப்புணர்வு,eng.org - Awareness about preventing bleeding during pregnancy
"Howrah North (U) I. C. D. S. Project, Howrah","ஹௌரா வடக்கு (யு) ஐ. சி. டி. எஸ். புராஜக்ட், ஹௌரா"," Haura North (U) ICTS Project, Haura"
Birth Preparedness- For Institutional and Home Delivery,பிறப்புத் தயார்நிலை- நிறுவன மற்றும் வீட்டுப் பிரசவத்திற்கு,engatinanegarahanakananakatananakatananakatananakatananakatananakatananakatananakatananakatananakatananakatananakatananakatananakatananakatananakatananakatananakatananakatananakatananakatananakatananakatananakatananakatananakatananakatananakatananakatananakatananakatananakatananakatananakatananakatananakatananakatananakatananakatananakatananakatananakatananakatananakatananakatananakatananakatananakatananakatananakatananakatananakatananakatananakatananakatananakatananakatananakatananakatananakatananakatananakatananakatananakatananakatananakatananakatananakatananakatananakatananakatananakatananakatananakatananakatananakatananakatananakatananakatananakatananakatananakatananakatananakatananakatananakatananakatananakatananakatananakatananakatananakatananakatananakatananakatananakatananak
New beneficiary addition with skip OTP option,ஓ டி பியைத் தவிர்க்கும் விருப்பத் தேர்வுடனான புதிய பயனாளர் சேர்ப்பு, New user addition with opt-out option that avoids OTAB
We are now available on Video Conference,வீடியோ கான்பரன்ஸ் மூலம் தற்போது நாம், We are currently using videoconferencing as a way to
"Poshan Tracker App is meant for Aanganwadi workers, Anganwadi centers to enter beneficiaries data in the forms.","போஷன் டிராக்கர் ஆப் என்பது ஆங்கன்வாடி தொழிலாளர்கள், அங்கன்வாடி மையங்கள் பயனாளிகளின் தரவை படிவங்களில் உள்ளிடுவதற்கானது.","engwadie workers, angwanwadie centers beneficiaries data to enter in forms."
It is not at all developed for general public.,இது பொது மக்களுக்காக உருவாக்கப்படவில்லை., And it's not designed for the general public.
Swastha Balak/Balika Spardha Mission is about celebrating the health of children in India.,Swastha Balak/Balika Spardha Mission is about celebrating the health of children in India., Swastha Balak/Balika Spardha Mission is about celebrating the health of children in India.
It entails identification and awareness of health conditions and providing necessary support wherever required.,It entails identification and awareness of health conditions and providing necessary support wherever required.,"eng, e.g. identification and awareness of health conditions and providing necessary support wherever needed."
”Our Privacy Policy applies when you use our Services (described below).,"""Our Privacy Policy applies when you use our Services (described below).",eng our Privacy Policy applies when you use our Services (described below).
"This Privacy Policy is meant to help you understand what information we collect, why we collect it, and how it is used and shared.","This Privacy Policy is meant to help you understand what information we collect, why we collect it, and how it is used and shared.","engKeynotePrivacy PolicyThis Privacy Policy is meant to help you understand what information we collect, why we collect it, and how it is used and shared."
The collecting and retaining agency in respect of your information is Ministry of Women and Child Development.,The collecting and retaining agency in respect of your information is Ministry of Women and Child Development.,eng.ta Badan pengumpulan dan retensi informasi anda adalah Kementerian Perempuan dan Pembangunan Anak.
We are committed to protecting the security of your personal information and safeguarding your privacy.,We are committed to protecting the security of your personal information and safeguarding your privacy.,eng.ta We are committed to protecting the security of your personal information and safeguarding your privacy.ta
How to revive your health if you are Underweight,நீங்கள் எடை குறைவாக இருந்தால் உங்கள் ஆரோக்கியத்தை எவ்வாறு மீட்டெடுப்பது," If you are underweight, how can you restore your health?"
Can a beneficiary change his/her AWC?,ஒரு பயனாளி தனது AWCயை மாற்ற முடியுமா?,eng.org - Can a beneficiary change their AWC?
"We use the information we have, to help verify accounts.",கணக்குகளைச் சரிபார்க்க எங்களிடம் உள்ள தகவலைப் பயன்படுத்துகிறோம்., We use the information we have to verify accounts.
The records may be used for verification of health status for the purposes of Poshan Tracker control and response.,"போஷன் டிராக்கர் கட்டுப்பாடு, பதிலளிப்பு நோக்கங்களுக்காக மற்றும் சுகாதார நிலையை சரிபார்ப்பதற்காக பதிவுகள் பயன்படுத்தப்படலாம்.","eng postion tracker records can be used for control, response purposes and health status checks."
Scan the QR Code to Download the App,பயன்பாட்டை ப்பதிவிறக்க க்யூஆர் குறியீட்டை ஸ்கேன் செய்யவும்,eng aplikasi download scan QR code
Who is eligible for Hot Cooked Meal?,சூடான சமைத்த உணவுக்கு யார் தகுதியானவர்?,eng.org Siapa yang layak makan makanan panas?
Identifying and preventing Severe Acute Malnutrition,கடுமையான ஊட்டச்சத்துக் குறைபாட்டைக் கண்டறிந்து தடுப்பது,engeti detecting and preventing severe malnutrition.
Children who are identified as deficit on nutrition are eligible for additional food supplements.,ஊட்டச்சத்து குறைபாடு உள்ள குழந்தைகள் கூடுதல் உணவுப் பொருட்களுக்கு தகுதியுடையவர்கள்.,engekekekekekekekekekekekekekekekekekekekekekekekekekekekekekekekekekekekekekekekekekekekekekekekekekekekekekekekekekekekekekekekekekekekekekekekekekekekekekekekekekekekekekekekekekekekekekekekekekekekekekekekekekekekekekekekekekekekekekekekekekekekekekekekekekekekekekekekekekekekekekekekekekekekekekekekekekekekekekekekekekekekekekekekekekekekekekekekekekekekekekekekekekekekekekekekekekekekekekek
Who is eligible for additional supplementary food.,கூடுதல் துணை உணவுக்கு யார் தகுதியானவர்.,eng.org - Who is eligible for the supplementary supplementary meal?
"Uploading of Data of Anganwadi Services Schemes in Poshan Tracker (24 May, 2021)","போஷன் டிராக்கரில் அங்கன்வாடி சேவைத் திட்டங்களின் தரவைப் பதிவேற்றம் செய்தல் (24 மே, 2021)","engwadi service plans uploading data to the phota position tracker (May 24, 2021)"
Children between 6 months - 3 years,6 மாதங்கள் -3 வயதுக்கு இடைப்பட்ட குழந்தைகள்,eng.org - 6 months to 3 years old
"Ministry of Women and Child Development, Government of India, Shastri Bhawan, New Delhi","பெண்கள் மற்றும் குழந்தைகள் மேம்பாட்டு அமைச்சகம், இந்திய அரசு, சாஸ்திரி பவன், புது தில்லி","eng Ministry of Women and Child Development, Government of India, Shastri Bhavan, New Delhi"
Care of the weak newborn baby - How many weak babies are we missing?,பலவீனமான புதிதாகப் பிறந்த குழந்தையின் பராமரிப்பு - எத்தனை பலவீனமான குழந்தைகளை நாம் காணவில்லை?,engengengengengengengengengengengengengengengengengengengengengengengengengengengengengengengengengengengengengengengengengengengengengengengengengengengengengengengengengengengengengengengengengengengengengengengengengengengengengengengengengengengengengengengengengengengengengengengengengengengengengengengengengengengengengengengengengengengengengengengengengengengengengengengengengengengengengengengengengengengengengengengengengengengengengengengengengengengengengengengengengengengengengengengengengengengengengengengengengengengengengengengengengengengengengengengengengengengengengengeng
Underweight children who received Supplementary Nutrition,கூடுதல் ஊட்டச்சத்து பெற்ற எடை குறைந்த குழந்தைகள்,eng.org - From low-weight to over-nutrient children
Identification and care of a Weak Newborn baby,புதிதாகப் பிறந்த பலவீனமான குழந்தையை அடையாளம் காணுதல் மற்றும் பராமரித்தல்,eng.org Identifying and caring for a newborn vulnerable baby
1.2. Information from use of services.,1.2. சேவைகளின் பயன்பாட்டிலிருந்து தகவல்.,eng.1.2a Informasi dari penggunaan layanan.
Please contact your respective Anganwadi Centre.,உங்கள் அங்கன்வாடி மையத்தைத் தொடர்பு கொள்ளவும்.,engada to your Anganwadi Centre.
GOBARDANGA I. C. D. S PROJECT(U),கோபர்தங்கா ஐ. சி. டி. எஸ். புராஜக்ட்(யு),eng Kopardanga ICTS Project (U)
Please fill in the form below to create a new ticket.,புதிய டிக்கெட்டை உருவாக்க கீழே உள்ள படிவத்தை நிரப்பவும்.," To create a new ticket, fill out the form below."
Anganwadi Worker will reach out to you within 48 hours.,அங்கன்வாடி பணியாளர் 48 மணி நேரத்திற்குள் உங்களைத் தொடர்புகொள்வார்.,engwanwadi employee will contact you within 48 hours.
Your request is received.Please note down the ticket number for future reference.,உங்கள் கோரிக்கை வரப்பெற்றது எதிர்காலக் குறிப்புக்காக தயவு செய்து டிக்கட் எண்ணைக் குறித்துக் கொள்ளவும்," Your request has been received and for future reference, please indicate the ticket number."
Is poshan trackers app available over Apple I Store also?,ஆப்பிள் ஐ ஸ்டோரிலும் போஷன் டிராக்ஸ் பயன்பாடு கிடைக்குமா?,eng.co.uk - Will the Pose Tracks app be available on the Apple I-Store as well?
Number of records becoming inactive and number of records migrating from one category to another,செயலற்றவையாக ஆகிக் கொண்டிருக்கும் பதிவுகளின் எண்ணிக்கை மற்றும் ஒரு வகையிலிருந்து இன்னொன்றுக்கு மாறும் பதிவுகளின் எண்ணிக்கை, The number of records that are inactive and the number of records that move from one type to another.
In How many languages the Poshan Tracker App is available?,போஷன் டிராக்கர் பயன்பாடு எத்தனை மொழிகளில் கிடைக்கிறது?, The Bosta Tracker app is available in how many languages?
