eng,as,indic_trans_translated
Certain files and other items on the website cannot be translated.,ৱেবচাইটটোৰ কিছুমান ফাইল বা আন সামগ্ৰী অনুবাদ কৰিব পৰা নাযায।,Some files or other items on the website could not be translated.
"In addition, on translation, some applications and/or services may not function as expected, due to language barriers.","ইযাৰ উপৰি, অনুবাদত, কিছুমান এপ্লিকেচন আৰু/বা সেৱাই ভাষাৰ অন্তৰাযৰ ফলত, আশানুৰূপ ভাৱে কাম নকৰিব পাৰে।","Moreover, translation, some applications and / or services may not work as expected, due to language barriers."
"We are working constantly to rectify any errors, omissions, or ambiguities in the translations provided on this portal.","আমি এই পৰ্টেলত আগবঢোৱা অনুবাদ সমূহত যিকোনো ত্ৰুটি, বাদ পৰা তথ্য, বা অন্য সম্ভাৱনা সংশোধন কৰিবলৈ অবিৰত কাম কৰি আছো।","We are constantly working to correct any errors, omissions, or other possible translation errors that may have crept into this portal."
"The MGRS collected primary growth data and related information from approximately 8500 children from widely different ethnic backgrounds and cultural settings (Brazil, Ghana, India, Norway, Oman and the USA)","MGRS-যে ব্যাপক ৰূপত বিভিন্ন নৃগোষ্ঠীগত পটভূমি আৰু সাংস্কৃতিক পৃষ্ঠভূমিৰ (ব্ৰাজিল, ঘানা, ভাৰত, নৰৱে, ওমন আৰু USA) পৰা প্ৰায 8500 গৰাকী শিশুৰ পৰা প্ৰাথমিক বিকাশত তথ্য আৰু সম্পৰ্কিত তথ্য সংগ্ৰহ কৰিছিল।","MGRS collected data and information on early development of around 8500 children from a wide range of ethnic and cultural backgrounds (Brazil, Ghana, India, Norway, Oman and USA)."
Children of different age groups are monitored on monthly basis by AWWs.,বিভিন্ন বযসৰ শিশু সকল মাহেকীযা ভিত্তিত AWW সকলৰ দ্বাৰা নিৰীক্ষিত হয।,Children of different ages are tested on a monthly basis by AWW.
"Health indicators like Stunting, Wasting and Underweight prevalence are measured as per WHO standards.","বাওনা হোৱা, পুষ্টিহীনতাত ভোগা আৰু কম ওজনৰ বিস্তাৰৰ দৰে স্বাস্থ্যজনিত সূচক সমূহ WHO মান অনুসৰি জোখা হয।","Health indicators such as undernourished, undernourished and underweight prevalence are in line with WHO standards."
Regular growth monitoring helps AWWs to provide relevant and timely assistance to children,নিযমীযা বৃদ্ধিৰ নিৰীক্ষণে AWW সকলক শিশুসকললৈ প্ৰাসংগিক আৰু সমযমতে সহযোগিতা আগবঢোৱাত সহায কৰে,Regular growth monitoring helps AWWs to provide relevant and timely support to children
"Awareness for Children Stunting, Wasting to prevent malnutrition in children","শিশুসকলৰ মাজত শিশু বাওনা হোৱা, বিষমপপুষ্টিক বাধা দিবলৈ পুষ্টিহীনতাৰ বাবে সজাগতা",Awareness among children on malnutrition to prevent malnourishment
Poshan Tracker adds new application features,পোশান ট্ৰেকাৰে নতুন এপ্লিকেচন সুবিধা যোগ কৰে,Adds new application feature to the Poshan Tracker
Making or Updating Home Visit Planner and Initiating home visits,হোম ভিজিটৰ প্লেনাৰ প্ৰস্তুত কৰা বা আপডেট কৰা আৰু হোপ ভিজিটৰ সূচনা কৰা,Preparation or updating of Home Visitor Planes and launch of Hope Visitor
Poshan Calculator is designed to measure growth of the child based on standards defined by World Health Organization (WHO),পোষণ কেলকুলেটৰ বিশ্ব স্বাস্থ্য সংস্থা (WHO) ৰ দ্বাৰা নিৰ্ধাৰিত মানৰ ওপৰত ভিত্তি কৰি শিশুৰ বিকাশ জুখিবলৈ সাজি উলিওৱা হৈছে,The POSHAN Calculator is designed to ensure child development based on the standards set by the World Health Organization (WHO)
Migrated from one category to another,এটা শ্ৰেণীৰ পৰা আন এটা শ্ৰেণীলৈ প্ৰব্ৰজন কৰা হৈছে,Migrating from one class to another
It usually occurs when a person has not had food of adequate quality and quantity and/or they have had frequent or prolonged illnesses,ই সাধাৰণতে তেতিযা সংঘটিত হয যেতিযা এগৰাকী লোকে পৰ্যাপ্ত মানদণ্ডৰ আৰু পৰিমাণৰ খাদ্য লাভ নকৰে আৰু/বা তেওঁলোকৰ ঘনাই হৈ থকা বা দীিৰ্গাযিত ৰোগ হয,It usually occurs when a person does not get adequate quality and quantity of food and / or has a chronic disease
Malnutrition is one of the most important challenges facing contemporary India.,মালনিউট্রিশন ২ ওযান অফ টি মোস্ট ইম্পরট্যান্ট চ্যালেঞ্জেস ফাকিং কনটেম্পোরারি ইন্ডিযা.,Malnutrition 2 Owns of the Most Important Challenges Facing Contemporary India.
Nutrition is acknowledged as central to the achievement of National and Global Sustainable Development Goals.,নিউট্রিশন ২ অকনোলেজড এস সেন্ট্রাল তো টি অ্যাচিভমেন্ট অফ ন্যাশনাল এন্ড গ্লোবাল সুস্টাইনাবলে ডেভেলপমেন্ট গোলস.,Nutrition 2 Unreached S Central to T Achievements of National and Global Sustainability Goals.
"Optimum and appropriate nutrition is essential for women and children to survive, thrive and break the intergenerational cycle of poor health and poverty in the community.","অপটিমাম এন্ড অপপ্রোপ্রিযেতে নিউট্রিশন ২ এসএনটিযাল ফর ওমেন এন্ড চিলড্রেন তো সুরভিভে, থ্রিভে এন্ড ব্র্যাক ইন্টারগেনেরাশনাল সাইকেল অফ পুওর হেলথ এন্ড পভার্টি ইন টি কমিউনিটি.","Optimal and Optimal Nutrition 2 SANTIAL FOR OMEN AND CHILDREN To SURVIVE, THREEVE AND BRAC INTERNATIONAL BICYCLES OF POWER HEALTH AND POWERITY IN SOCIETY COMMUNITY."
"Poshan Abhiyaan is India’s flagship programme to improve nutritional outcomes for children, adolescents, pregnant women and lactating mothers by leveraging technology, a targeted approach and convergence.","শিশু, বযঃসন্ধিকাল, গৰ্ভাৱস্থাৰ বাবে পুষ্টিৰ ফলাফল উন্নত কৰাৰ বাবে পোষণ অভিযান হৈছে ভাৰতৰ মুখ্য কাৰ্যসূচী।","POSHAN Abhiyaan is India's flagship programme to improve the nutritional outcomes for children, adolescents and pregnant women."
Hot Cooked Meal (HCM) given in last 30 days,হট কুকড মীল (এইচচিএম) শেষৰ ৩০ দিনত দিযা হয,Hot Cooked Meal (HCM) provided in last 30 days
Uploading of Data of Anganwadi Services Schemes in Poshan Tracker,পোষণ ট্ৰেকাৰত অংগনৱাডী সেৱাসমূহৰ আঁচনি সমূহৰ ডাটা আপলোড হৈ আছে,Uploading data on schemes of Anganwadi Services to POSHAN tracker
The Poshan Tracker generates automated alerts to the critical last-mile beneficiaries.,পোষণ ট্ৰেকাৰে গুৰুত্বপূৰ্ণ অন্তিম পৰ্যাযৰ হিতাধিকাৰীসকললৈ অটোমেটেড এলাৰ্ট উৎপাদন কৰে।,POSHAN tracker manufactures automated alerts for key end users.
It also ensures efficient audit of the delivery system by documenting real time attendance of beneficiaries and duty bearers.,ই হিতাধিকাৰী আৰু ডিউটি কৰা সকলৰ বাস্তৱ সমযৰ উপস্থিতি নথিভুক্ত কৰাৰ দ্বাৰা ডেলিভাৰী চিষ্টেমৰ নিপুণ অডিট সুনিশ্চিত কৰে।,It ensures efficient audit of the delivery system by registering real time attendance of beneficiaries and all those on duty.
"This management information system will help the nutrition programme to scale efficiently, thereby generating and documenting positive impact","এই মেনেজমেন্ট ইনফৰ্মেচন চিষ্টেমে নিপুণভাৱে জোখ লোৱাত, এনেদৰে ধনাত্মক প্ৰভাৱ উৎপন্ন কৰি আৰু নথিভুক্ত কৰি পৰিপুষ্টিৰ অনুষ্ঠানক সহায কৰিব","The Management Information System (MIS) will help in better understanding, generating and documenting positive impact on the validation exercise"
How can one Download Poshan Tracker App?,পোষণ ট্ৰেকাৰ এপ কেনেকৈ ডাউনলোড কৰিব পাৰি?,How to download the POSHAN tracker app
