eng,gu,indic_trans_translated
"The MGRS collected primary growth data and related information from approximately 8500 children from widely different ethnic backgrounds and cultural settings (Brazil, Ghana, India, Norway, Oman and the USA)","MGRS એ વ્યાપકપણે વિવિધ વંશીય પૃષ્ઠભૂમિ અને સાંસ્કૃતિક સેટિંગ્સ (બ્રાઝિલ, ઘાના, ભારત, નોર્વે, ઓમાન અને યુએસએ) ના આશરે 8500 બાળકો પાસેથી પ્રાથમિક વૃદ્ધિ ડેટા અને સંબંધિત માહિતી એકત્રિત કરી","MGRS extensively collects primary growth data and related information from around 8500 children from various ethnic backgrounds and cultural settings (Brazil, Ghana, India, Norway, Oman and USA)"
Children of different age groups are monitored on monthly basis by AWWs.,AWWs દ્વારા વિવિધ વય જૂથોના બાળકોનું માસિક ધોરણે નિરીક્ષણ કરવામાં આવે છે.,AWWs monitor children of different age groups on a monthly basis.
"Health indicators like Stunting, Wasting and Underweight prevalence are measured as per WHO standards.","સ્વાસ્થ્ય સૂચકાંકો જેમ કે સ્ટંટિંગ, વેસ્ટિંગ અને ઓછા વજનનો વ્યાપ WHO ના ધોરણો મુજબ માપવામાં આવે છે.","Health indicators such as stunting, wasting and underweight prevalence are measured as per WHO standards."
Regular growth monitoring helps AWWs to provide relevant and timely assistance to children,નિયમિત વૃદ્ધિની દેખરેખ AWW ને બાળકોને સંબંધિત અને સમયસર સહાય પૂરી પાડવામાં મદદ કરે છે,Regular growth monitoring helps AWW to provide relevant and timely support to children
"Awareness for Children Stunting, Wasting to prevent malnutrition in children","બાળકોમાં કુપોષણને રોકવા માટે બાળકોના સ્ટંટિંગ, વેસ્ટિંગ અંગે જાગૃતિ","Awareness on child stunting, wasting to prevent malnutrition in children"
Poshan Tracker adds new application features,પોષણ ટ્રેકર નવા એપ્લિકેશનની વિશેષતા ઉમેરી,POSHAN TRACKER Adds New App Features
Making or Updating Home Visit Planner and Initiating home visits,ગૃહ મુલાકાતનું આયોજન બનાવવું અથવા અપડેટ કરવું અને ગૃહ મુલાકાત શરૂ કરવી,Planning or updating a home visit and starting a home visit
Poshan Calculator is designed to measure growth of the child based on standards defined by World Health Organization (WHO),વર્લ્ડ હેલ્થ ઓર્ગનાઈઝેશન(WHO) દ્વારા નિર્ધારિત ધોરણોના આધારે બાળકના વિકાસને માપવા માટે પોષણ કેલ્ક્યુલેટર ની રચના કરવામાં આવેલ છે,The POSHAN calculator is designed to measure the development of a child based on the standards set by the World Health Organization (WHO)
Migrated from one category to another,એક કેટેગરીમાંથી અન્ય કેટેગરીમાં સ્થળાંતરીત થયેલ,Migrated from one category to another
It usually occurs when a person has not had food of adequate quality and quantity and/or they have had frequent or prolonged illnesses,તે સામાન્ય રીતે ત્યારે થાય છે જ્યારે વ્યક્તિએ પર્યાપ્ત ગુણવત્તા અને માત્રામાં ખોરાક ન લીધો હોય અને/અથવા તેને વારંવાર અથવા લાંબા સમય સુધી બીમારીઓ હોય,This usually happens when the person has not taken adequate quality and quantity of food and / or has frequent or prolonged illness
"Poshan Abhiyaan is India’s flagship programme to improve nutritional outcomes for children, adolescents, pregnant women and lactating mothers by leveraging technology, a targeted approach and convergence.","બાળકો, કિશોરો, સગર્ભાઓ માટેના પોષક પરિણામોને સુધારવા માટે, પોશણ અભિયાન એ ભારતનો મુખ્ય કાર્યક્રમ છે.","POSHAN Abhiyaan is India's flagship programme to improve nutrition outcomes for children, adolescents and pregnant women."
Hot Cooked Meal (HCM) given in last 30 days,પાછલા 30 દિવસમા દેવામા આવેલ ગરમ રાંધેલ ભોજન (HCM),Hot cooked meals (HCM) served during last 30 days
Uploading of Data of Anganwadi Services Schemes in Poshan Tracker,પોષણ ટ્રેકરમાં આંગણવાડી સેવાઓને લગતી યોજનાઓના ડેટા અપલોડ કરવો,Uploading of scheme data related to Anganwadi Services in POSHAN tracker
The Poshan Tracker generates automated alerts to the critical last-mile beneficiaries.,પોશન ટ્રેકર છેલ્લા માઈલના મહત્ત્વના લાભાર્થીઓને સ્વયંસંચાલિત ચેતવણીઓ જનરેટ કરે છે.,The POSHAN tracker generates automated alerts to key beneficiaries of the last mile.
It also ensures efficient audit of the delivery system by documenting real time attendance of beneficiaries and duty bearers.,તે લાભાર્થીઓ અને ફરજ ધારકોની વાસ્તવિક સમયની હાજરીનું દસ્તાવેજીકરણ કરીને ડિલિવરી સિસ્ટમનું કાર્યક્ષમ ઓડિટ પણ સુનિશ્ચિત કરે છે.,It also ensures an efficient audit of the delivery system by documenting the real time attendance of the beneficiaries and the duty holders.
"This management information system will help the nutrition programme to scale efficiently, thereby generating and documenting positive impact","આ વ્યવસ્થાપન માહિતી પ્રણાલી પોષણ કાર્યક્રમને કાર્યક્ષમ રીતે માપવામાં મદદ કરશે, જેનાથી હકારાત્મક અસર પેદા થશે અને તેનું દસ્તાવેજીકરણ થશે","This Management Information System will help in effective measurement of POSHAN Abhiyaan, which will have a positive impact and will be documented"
How can one Download Poshan Tracker App?,પોષણ ટ્રેકર એપ્લિકેશન કેવી રીતે ડાઉનલોડ કરી શકાય છે?,How to download the POSHAN tracker app
"Clarification regarding Cost of Smart phones (03 June, 2021)","સ્માર્ટ ફોનની કિંમત અંગે સ્પષ્ટતા (03 જૂન, 2021)","Clarification regarding price of Smartphone (June 03, 2021)"
along with status update once resolved,એક વખત ઉકેલ મેળવી લેવામાં આવે એટલે સ્ટેટસ અપડેટેડ,Status updated once a solution is found
"The Poshan Tracker system is regularly audited by auditors engaged by MWCD, for security and scalability of the system.",સિસ્ટમની સુરક્ષા અને માપનીયતા માટે MWCD દ્વારા રોકાયેલા ઓડિટર્સ દ્વારા પોશન ટ્રેકર સિસ્ટમનું નિયમિતપણે ઓડિટ કરવામાં આવે છે.,The POSHAN tracker system is regularly audited by auditors engaged by MWCD for safety and scalability of the system.
The records may be used for such audits.,આવા ઓડિટ માટે રેકોર્ડનો ઉપયોગ થઈ શકે છે.,Records can be used for such audits.
Poshan Tracker adds new Resources on Website,વેબસાઈટની વિશેષતા અંગે પોષણ ટ્રેકર નવા સંશાધનો ઉમેરે છે,Poshan Tracker adds new resources to highlight the website
"Technology under Poshan Tracker is being leveraged for dynamic identification of stunting, wasting, under-weight prevalence among children and last mile tracking of nutrition service delivery","પોશાન ટ્રેકર હેઠળની ટેક્નોલોજીનો ઉપયોગ બાળકોમાં સ્ટંટિંગ, વેડિંગ, ઓછા વજનની ગતિશીલ ઓળખ અને પોશાન સેવા વિતરણના છેલ્લા માઇલ ટ્રેકિંગ માટે કરવામાં આવે છે","Technology under Poshan Tracker is being used for last mile tracking of child stunting, marriage, low weight dynamic identification and Poshan service delivery"
The System also takes feedback about system performance and experience.,સિસ્ટમ સિસ્ટમની કામગીરી અને અનુભવ વિશે પ્રતિસાદ પણ લે છે.,The system also takes feedback about the functioning and experience of the system.
"Information on name, mobile number, date of registration and health status may be used for these purposes","આ હેતુઓ માટે નામ, મોબાઇલ નંબર, નોંધણીની તારીખ અને આરોગ્યની સ્થિતિ વિશેની માહિતીનો ઉપયોગ કરી શકાય છે","Information regarding name, mobile number, date of registration and health status can be used for these purposes"
