eng,gu,indic_trans_translated
The Site is directed to the people residing in India.,આ સાઇટ ભારતમાં રહેતા લોકો માટે નિર્દેશિત છે.,The site is targeted for people residing in India.
We do not represent that Content available on or through the Site is appropriate or available in other locations.,અમે એવું પ્રતિનિધિત્વ કરતા નથી કે સાઇટ પર અથવા તેના દ્વારા ઉપલબ્ધ સામગ્રી યોગ્ય છે અથવા અન્ય સ્થળોએ ઉપલબ્ધ છે.,We do not represent that the content available on or through the site is correct or is available in other places.
We may limit the availability of the Site or any service or product described on the Site to any person or geographic area at any time.,અમે કોઈપણ સમયે કોઈપણ વ્યક્તિ અથવા ભૌગોલિક વિસ્તાર માટે સાઇટ અથવા સાઇટ પર વર્ણવેલ કોઈપણ સેવા અથવા ઉત્પાદનની ઉપલબ્ધતાને મર્યાદિત કરી શકીએ છીએ.,We may at any time limit the availability of any service or product described on the site or site to any person or geographical area.
"If you choose to access the Site from outside India, you do so at your own risk.","જો તમે ભારતની બહારથી સાઇટને એક્સેસ કરવાનું પસંદ કરો છો, તો તમે તમારા પોતાના જોખમે આમ કરો છો.","If you choose to access the site from outside India, you do so at your own risk."
Please go back to the homepage,કૃપા કરીને હોમપેજ પર પાછા જાઓ,Please return to homepage
Please enter Height greater than 29.99 and less than 140.01,કૃપા કરીને 37.99 કરતાં વધુ અને 150.01 કરતાં ઓછી ઊંચાઈ દાખલ કરો,Please enter a height of more than 37.99 and less than 150.01
"While login to the Poshan Tracker App, AWWs are required to enter the MPIN set by them.","પોષણ ટ્રેકર એપ્લિકેશન પર લૉગિન કરતાં સમયે, કાર્યકરોને તેમના દ્વારા સેટ કરેલ એમપિન દાખલ કરવો જરૂરી છે.","At the time of login to the POSHAN Tracker app, the workers are required to enter the MPIN set by them."
This MPIN will act as a passcode to run the Poshan Tracker App and entering the information in the beneficiaries forms.,આ એમપિન પોષણ ટ્રેકર એપ્લિકેશન ચલાવવા અને લાભાર્થીઓના ફોર્મમાં માહિતી દાખલ કરવા માટે પાસકોડ તરીકે કાર્ય કરશે.,This MPIN will serve as a passcode for running the POSHAN tracker application and entering information in the beneficiary's form.
How to ensure timely initiation of complementary feeding,સમયસર પૂરક ખોરાક શરૂઆત કર્યાની ખાત્રી કેવી રીતે કરવી,How to ensure you start on time
Poshan Tracker App can only be installed in Android Phone with Android version 6.0 and above.,પોષણ ટ્રેકર એપ્લિકેશન ફક્ત એન્ડ્રોઇડ 6.0 અને તેથી વધુનાં સંસ્કરણ વાળ ફોનમાં ઇન્સ્ટોલ કરી શકાય છે.,The POSHAN Tracker app can be installed on a hair phone only with Android 6.0 and above.
General Awareness about Growth Monitoring of Children,બાળકોના વૃધ્ધિ-વિકાસ વિશે સામાન્ય જાગૃતિ,General Awareness on Child Development
Wasting is defined as low weight-for-height,બગાડને ઊંચાઈ માટે ઓછા વજન તરીકે વ્યાખ્યાયિત કરવામાં આવે છે,Wastage is defined as low weight for height
Hot Cooked Meal (HCM) Given Today,આજે દેવામા આવેલ ગરમ રાંધેલ ભોજન (HCM),Hot Cooked Meals (HCM) distributed today
There are 6 categories for beneficiariesPregnant WomenLactating MotherChildren from 0 to 6 monthsChildren from 6 months to 3 yearsChildren from 3 years to 6 yearsAdolescent girls,લાભાર્થીઓ માટે 6 શ્રેણીઓ છેસગર્ભા સ્ત્રીઓસ્તનપાન કરાવતી માતા0 થી 6 મહિનાના બાળકો6 મહિનાથી 3 વર્ષ સુધીના બાળકો3 વર્ષથી 6 વર્ષ સુધીના બાળકોકિશોરવયની છોકરીઓ,"There are 6 categories of beneficiaries Pregnant Women, Lactating Mothers, Children 6 months to 6 months, Children 6 months to 3 years, Children 3 years to 6 years, Adolescent Girls"
"Data Plan for Mobile Application (01 March, 2021)","મોબાઇલ એપ્લિકેશન માટે ડેટા પ્લાન (01 માર્ચ, 2021)","Data plan for mobile application (March 01, 2021)"
 VIII. LIMITATIONS OF MULTI- LINGUAL INTERFACE, VIII. બહુભાષી ઇન્ટરફેસની મર્યાદાઓ,Limitations of Multilingual Interface
Srijangram I. C. D. S. Project,શ્રીજનગ્રામ આઈ. સી. ડી. એસ. પ્રોજેક્ટ,Srijangram ICDS Project
"We may investigate any violation of these Terms, including unauthorized use of the Site.",અમે સાઇટના અનધિકૃત ઉપયોગ સહિત આ શરતોના કોઈપણ ઉલ્લંઘનની તપાસ કરી શકીએ છીએ.,"We can investigate any violation of these conditions, including unauthorized use of the site."
We may provide law enforcement with information you provide to us related to your transactions to assist in any investigation or prosecution of you.,અમે કાયદાના અમલીકરણને તમારી કોઈપણ તપાસ અથવા કાર્યવાહીમાં મદદ કરવા માટે તમારા વ્યવહારોથી સંબંધિત તમે અમને પ્રદાન કરેલી માહિતી પ્રદાન કરી શકીએ છીએ.,We can provide you with the information you provide us regarding your transactions to help law enforcement in any of your investigations or proceedings.
We may take legal action that we feel is appropriate.,અમને યોગ્ય લાગે તે અમે કાનૂની પગલાં લઈ શકીએ છીએ.,We can take appropriate legal action.
Poshan Calculator helps to identify various health conditions of the child as per World Health Organization (WHO) standards,પોશન કેલ્ક્યુલેટર વર્લ્ડ હેલ્થ ઓર્ગેનાઈઝેશન (ડબ્લ્યુએચઓ) ના ધોરણો અનુસાર બાળકની વિવિધ આરોગ્ય સ્થિતિઓને ઓળખવામાં મદદ કરે છે,The POSHAN calculator helps to identify the various health conditions of the child as per World Health Organization (WHO) norms
How to take care of weak newborn with the help of Kangaroo Mother Care,કાંગારુ મધર કેરની મદદથી નબળા નવજાતની સંભાળ કેવી રીતે રાખવી,How to take care of a weak newborn with the help of Kangaroo Mother Care
"Any liabilities civil or criminal, arising out of any incorrect data, shall solely lie with the concerned ASP.","કોઈપણ ખોટા ડેટાને કારણે ઉદ્ભવતી કોઈપણ જવાબદારીઓ સિવિલ અથવા ફોજદારી, ફક્ત સંબંધિત ASP પાસે જ રહેશે.","Any liability arising out of any false data, whether civil or criminal, shall remain with the concerned ASP only."
Poshan Tracker App is available over Google playstore https://play. google. com/store/apps/details?,પોષણ ટ્રેકર એપ્લિકેશન ગૂગલ પ્લે સ્ટોર https://play. google. com/store/apps/details?,The POSHAN Tracker App is available on Google Play Store at https: / / play.google.com / store / apps / details? id = html
Can App be accessed without internet?,શું આ એપ્લિકેશનને ઇન્ટરનેટ વિના ચલાવી શકાય છે?,Can this application be run without internet?
The Government has taken several initiatives to break the intergenerational cycle of malnutrition in children.,બાળકોમાં કુપોષણના અંતર્ગત ચક્રને તોડવા સરકારે અનેક પહેલ કરી છે.,The Government has taken several initiatives to break the cycle of malnutrition among children.
"Adopting a life-cycle approach, interventions have been designed to meet the nutritional requirement of adolescent girls and boys, pregnant women, lactating mothers and children.","જીવન ચક્રના અભિગમને અપનાવી, દખલગીરી કિશોરવયની છોકરીઓ અને છોકરાઓ, સગર્ભા સ્ત્રીઓ, સ્તનપાન કરાવતી માતાઓ અને બાળકોની પોષક જરૂરિયાતને પહોંચી વળવા માટે બનાવવામાં આવી છે.","The interventions have been designed to address the nutritional needs of adolescent girls and boys, pregnant women, lactating mothers and children."
Awareness for Pregnancy in Preventing Anemia,સગર્ભાવસ્થામાં એનિમિયાની અટકાયત માટે જાગૃતિ,Awareness for prevention of Anaemia During Pregnancy
"Howrah North (U) I. C. D. S. Project, Howrah","હાવરા નોર્થ (યુ) આઈ. સી. ડી. એસ. પ્રોજેક્ટ, હાવરા","Howrah North (U) ICDS Project, Howrah"
Birth Preparedness- For Institutional and Home Delivery,જન્મની તૈયારી- સંસ્થાકીય અને ઘરે પ્રસૂતિ માટે,Birth Preparations for institutional and home delivery
New beneficiary addition with skip OTP option,OTP વિકલ્પ ઉમેરવા સાથે નવા લાભાર્થી ઉમેરવા,To add new beneficiary with OTP option
We are now available on Video Conference,અમે હવે વીડિયો કોન્ફરન્સ પર ઉપલબ્ધ છીએ,We are now available through video conference
"Poshan Tracker App is meant for Aanganwadi workers, Anganwadi centers to enter beneficiaries data in the forms.","ફોર્મમાં લાભાર્થીઓનો ડેટા દાખલ કરવા માટે પોષણ ટ્રેકર એપ્લિકેશન, આંગણવાડી કાર્યકરો, આંગણવાડી કેન્દ્રો માટે છે.","The POSHAN tracker application for entering beneficiary data in the form is for Anganwadi Workers, Anganwadi Centres."
It is not at all developed for general public.,તે સામાન્ય લોકો માટે બિલકુલ વિકસિત નથી.,It is not at all developed for the common man.
Swastha Balak/Balika Spardha Mission is about celebrating the health of children in India.,Swastha Balak/Balika Spardha Mission is about celebrating the health of children in India.,Swastha Balak / Balika Spardha Mission is about celebrating the health of children in India.
It entails identification and awareness of health conditions and providing necessary support wherever required.,It entails identification and awareness of health conditions and providing necessary support wherever required.,It indicates identification and awareness of health conditions and providing adequate support wherever required.
”Our Privacy Policy applies when you use our Services (described below).,"""Our Privacy Policy applies when you use our Services (described below).",Our Privacy Policy applications when you use our Services (described below).
"This Privacy Policy is meant to help you understand what information we collect, why we collect it, and how it is used and shared.","This Privacy Policy is meant to help you understand what information we collect, why we collect it, and how it is used and shared.","This Privacy Policy is meant to help you understand what information we collect, why we collect it, and how it is used and shared."
The collecting and retaining agency in respect of your information is Ministry of Women and Child Development.,The collecting and retaining agency in respect of your information is Ministry of Women and Child Development.,The collecting and retaining agency in respect of your information is Ministry of Women and Child Development.
We are committed to protecting the security of your personal information and safeguarding your privacy.,We are committed to protecting the security of your personal information and safeguarding your privacy.,We are committed to protecting the security of your personal information and protecting your privacy.
How to revive your health if you are Underweight,જો તમારું વજન ઓછું હોય તો તમારા સ્વાસ્થ્યને કેવી રીતે પુનર્જીવિત કરવું,How to restore your health if you are underweight
Can a beneficiary change his/her AWC?,શું લાભાર્થી તેનું AWC બદલી શકે છે?,Can the beneficiary change his AWC?
"We use the information we have, to help verify accounts.",અમે અમારી પાસેની માહિતીનો ઉપયોગ એકાઉન્ટ ચકાસવામાં મદદ કરવા માટે કરીએ છીએ.,We use the information we have to help us verify the account.
The records may be used for verification of health status for the purposes of Poshan Tracker control and response.,પોશન ટ્રેકર નિયંત્રણ અને પ્રતિભાવના હેતુઓ માટે આરોગ્યની સ્થિતિની ચકાસણી માટે રેકોર્ડનો ઉપયોગ કરી શકાય છે.,The records can be used to check the health status for the purposes of POSHAN tracker control and response.
Scan the QR Code to Download the App,એપ્લિકેશનને ડાઉનલોડ કરવા માટે ક્યૂઆર કોડ સ્કેન કરો,Scan the QR code to download the app
Who is eligible for Hot Cooked Meal?,ગરમ રાંધેલા ભોજન માટે કોણ પાત્ર છે?,Who is eligible for hot cooked meals?
Identifying and preventing Severe Acute Malnutrition,ગંભીર તીવ્ર કુપોષણની ઓળખ અને અટકાયત,Identification and Detention of Severe Acute Malnutrition
Children who are identified as deficit on nutrition are eligible for additional food supplements.,જે બાળકો પોષણની ઉણપ તરીકે ઓળખાય છે તેઓ વધારાના આહાર પૂરવણીઓ માટે પાત્ર છે.,Children who are known to be deficient in nutrition are eligible for additional food supplements.
Who is eligible for additional supplementary food.,વધારાના પૂરક ખોરાક માટે કોણ પાત્ર છે.,Who is eligible for additional supplementary food.
"Uploading of Data of Anganwadi Services Schemes in Poshan Tracker (24 May, 2021)","પોષણ ટ્રેકરમાં આંગણવાડી સેવા યોજનાઓનો માહિતી અદ્યતન કરવો (24 મે, 2021)","Updation of Anganwadi Services Scheme information in POSHAN tracker (24th May, 2021)"
Children between 6 months - 3 years,6 મહિનાથી 3 વર્ષનાં બાળકોની,Children (6 months to 3 years)
"Ministry of Women and Child Development, Government of India, Shastri Bhawan, New Delhi","મહિલા અને બાળ વિકાસ મંત્રાલય, ભારત સરકાર, શાસ્ત્રી ભવન, નવી દિલ્હી","Ministry of Women and Child Development, Government of India, Shastri Bhawan, New Delhi"
Care of the weak newborn baby - How many weak babies are we missing?,નબળા નવજાત બાળકની સંભાળ - આપણાથી કેટલા નબળા બાળકો છુટી જાય છે?,Care for Weak Newborns - How many of us are left out of it?
Underweight children who received Supplementary Nutrition,પૂરક પોષણ મેળવનાર ઓછા વજનવાળા બાળકો,Low birth weight children with supplementary nutrition
Identification and care of a Weak Newborn baby,નબળા નવજાત શિશુની ઓળખ અને સંભાળ,Identification and Care of a Vulnerable Newborn
1.2. Information from use of services.,1.2. સેવાઓના ઉપયોગની માહિતી.,1.2 Data on use of services.
Please contact your respective Anganwadi Centre.,કૃપા કરીને તમારા સંબંધિત આંગણવાડી કેન્દ્રનો સંપર્ક કરો.,Please contact your respective Anganwadi Centre.
GOBARDANGA I. C. D. S PROJECT(U),ગોબરદંગા આઈ. સી. ડી. એસ. પ્રોજેક્ટ (યુ),Gobardanga ICDS Project (U)
Please fill in the form below to create a new ticket.,નવી ટિકિટ બનાવવા માટે કૃપા કરીને નીચેનું ફોર્મ ભરો.,Please fill in the following form to get a new ticket:
Anganwadi Worker will reach out to you within 48 hours.,આંગણવાડી કાર્યકર 48 કલાકની અંદર તમારો સંપર્ક કરશે.,Anganwadi workers will contact you within 48 hours.
Please note down the ticket number for future reference.,ભવિષ્યના સંદર્ભ માટે કૃપા કરીને ટિકિટ નંબરની નોંધ કરી લો,Please note down the ticket number for future reference
Is poshan trackers app available over Apple I Store also?,શું પોષણ ટ્રેક્સ એપ્લિકેશન એપલ આઇ સ્ટોર ઉપર પણ ઉપલબ્ધ છે?,Is POSHAN Tracks app also available on Apple App Store?
Number of records becoming inactive and number of records migrating from one category to another,સંખ્યાબંધ રેકોર્ડ્સ નિષ્ક્રીય બની રહ્યો છે અને સંખ્યાબંધ રેકોર્ડ એક કેટેગરીમાંથી અન્ય કેટેગરીમાં સ્થળાંતરીત થઈ રહેલ છે,Number of records getting inactive and number of records getting transferred from one category to another category
In How many languages the Poshan Tracker App is available?,પોષણ ટ્રેકર એપ્લિકેશન કેટલી ભાષાઓમાં ઉપલબ્ધ છે?,How many languages is the POSHAN Tracker App available?
AWWs are requested to enter their mobile numbers in the Login screen.,આંગણ વાડી કાર્યકરોને લૉગિન સ્ક્રીન પર તેમનો મોબાઇલ નંબર દાખલ કરવા માટે વિનંતી કરવામાં આવે છે.,Anganwadi workers are requested to enter their mobile number on the login screen.
"An OTP will be sent to your registered mobile number, post which you are required too set your MPIN.","તમારા નોંધાવેલ મોબાઇલ નંબર પર એક ઓટીપી મોકલવામાં આવશે, ત્યાર પછી કે તમને એમપિન સેટ કરવું પડશે.","An OTP will be sent to your registered mobile number, after which you will have to set an MPIN."
Measles Containing vaccine (MCV)/MR-2JE-2**DiphtheriaPertussis & Tetanus (DPT)-Booster-1OPV –Booster,ઓરી ધરાવતી રસી (MCV)/MR-2JE-2**ડિપ્થેરિયાપેર્ટુસિસ એન્ડ ટેટેનસ (ડીપીટી)-બૂસ્ટર-1OPV - બૂસ્ટર,Covishield vaccine (MCV) / MR-2JE-2 * Diphtheria and Tetanus (DPT) -Booster-1OPV-Booster
The Poshan Tracker enables real-time monitoring and tracking of all AWCs and beneficiaries on defined indicators.,પોશન ટ્રેકર નિર્ધારિત સૂચકાંકો પર તમામ AWC અને લાભાર્થીઓનું રીઅલ-ટાઇમ મોનિટરિંગ અને ટ્રેકિંગ સક્ષમ કરે છે.,POSHAN tracker enables real-time monitoring and tracking of all AWCs and beneficiaries on prescribed indices.
It is built using centralized data architecture that also aligns with the digital technology systems of other ministries and programs.,તે કેન્દ્રિય ડેટા આર્કિટેક્ચરનો ઉપયોગ કરીને બનાવવામાં આવ્યું છે જે અન્ય મંત્રાલયો અને પ્રોગ્રામ્સની ડિજિટલ ટેક્નોલોજી સિસ્ટમ્સ સાથે પણ ગોઠવે છે.,It is built using the central data architecture that aligns with the digital technology systems of other ministries and programs.
The public dashboard helps to impart transparency on services delivered to beneficiaries,સાર્વજનિક ડેશબોર્ડ લાભાર્થીઓને આપવામાં આવતી સેવાઓમાં પારદર્શિતા લાવવામાં મદદ કરે છે,The Public Dashboard helps in bringing transparency in the services provided to the beneficiaries
Translations on the Poshan Tracker Portal & App Chabot are done by third party translators.,પોશન ટ્રેકર પોર્ટલ અને એપ ચાબોટ પરના અનુવાદો તૃતીય પક્ષ અનુવાદકો દ્વારા કરવામાં આવે છે.,Translations on the Potion Tracker Portal and App Chabots are done by third party translators.
"While the translations are done on a best effort basis, some of the parts may be incorrect.","જ્યારે અનુવાદો શ્રેષ્ઠ પ્રયાસના આધારે કરવામાં આવે છે, ત્યારે કેટલાક ભાગો ખોટા હોઈ શકે છે.","When translations are made on the basis of best effort, some parts may be wrong."
Certain files and other items on the website cannot be translated.,વેબસાઇટ પરની અમુક ફાઇલો અને અન્ય વસ્તુઓનું ભાષાંતર કરી શકાતું નથી.,Some files and other items on the website could not be translated.
"In addition, on translation, some applications and/or services may not function as expected, due to language barriers.","વધુમાં, ભાષાંતર પર, કેટલીક એપ્લિકેશનો અને/અથવા સેવાઓ ભાષા અવરોધોને લીધે, અપેક્ષા મુજબ કાર્ય કરી શકશે નહીં.","Further, on translation, some applications and / or services may not function as expected, due to language barriers."
"We are working constantly to rectify any errors, omissions, or ambiguities in the translations provided on this portal.","અમે આ પોર્ટલ પર પ્રદાન કરવામાં આવેલ અનુવાદોમાં કોઈપણ ભૂલો, ભૂલો અથવા અસ્પષ્ટતાઓને સુધારવા માટે સતત કામ કરી રહ્યા છીએ.","We are constantly working to correct any errors, errors or ambiguities in the translations provided on this portal."
