eng,mr,indic_trans_translated
"While the translations are done on a best effort basis, some of the parts may be incorrect.",भाषांतरे सर्वोत्कृष्ट प्रयत्नांच्या आधारावर केली जात असली तरी काही भाग चुकीचे असू शकतात.,"Though translations are based on best effort, they may be wrong in some respects."
Certain files and other items on the website cannot be translated.,वेबसाइटवरील काही फाइल्स आणि इतर गोष्टींचे भाषांतर केले जाऊ शकत नाही.,Some of the files and other things on the website cannot be translated.
"In addition, on translation, some applications and/or services may not function as expected, due to language barriers.","याव्यतिरिक्त, भाषांतरावर, भाषेच्या अडथळ्यांमुळे काही अनुप्रयोग आणि/किंवा सेवा अपेक्षेप्रमाणे कार्य करू शकत नाहीत.","Additionally, on translation, some applications and / or services may not work as expected due to language barriers."
"We are working constantly to rectify any errors, omissions, or ambiguities in the translations provided on this portal.","या पोर्टलवर प्रदान केलेल्या भाषांतरांमधील कोणत्याही त्रुटी, चूक किंवा अस्पष्टता सुधारण्यासाठी आम्ही सतत काम करत आहोत.","We are constantly working to rectify any errors, errors or ambiguities in the translations provided on this portal."
"The MGRS collected primary growth data and related information from approximately 8500 children from widely different ethnic backgrounds and cultural settings (Brazil, Ghana, India, Norway, Oman and the USA)","एमजीआरएसने मोठ्या प्रमाणावर भिन्न वांशिक पार्श्वभूमी आणि सांस्कृतिक सेटिंग्जमधील (ब्राझील, घाना, भारत, नॉर्वे, ओमान आणि यूएसए) अंदाजे 8500 मुलांकडून प्राथमिक वाढ डेटा आणि संबंधित माहिती गोळा केली","MGRS collected primary growth data and related information from approximately 8500 children across a wide range of ethnic backgrounds and cultural settings (Brazil, Ghana, India, Norway, Oman and USA)"
Children of different age groups are monitored on monthly basis by AWWs.,वेगवेगळ्या वयोगटातील मुलांचे मासिक आधारावर अंगणवाडी सेविकास् द्वारे निरीक्षण केले जाते.,The children of different age groups are monitored on a monthly basis by Anganwadi Sevikas.
"Health indicators like Stunting, Wasting and Underweight prevalence are measured as per WHO standards.","खुंटणे, अशक्तपणा आणि कमी वजनाचे प्रमाण यासारखे आरोग्य निर्देशक डब्ल्यूएचओ मानकांनुसार मोजले जातात.","Health indicators such as stunting, anaemia and low birth weight are measured in accordance with WHO standards."
Regular growth monitoring helps AWWs to provide relevant and timely assistance to children,नियमित वाढीचे निरीक्षण केल्याने अंगणवाडी सेविका ला मुलांना संबंधित आणि वेळेवर सहाय्य प्रदान करण्यात मदत होते,Regular monitoring of the growth of Anganwadi workers will help in providing relevant and timely support to the children
"Awareness for Children Stunting, Wasting to prevent malnutrition in children","मुलांमधील कुपोषण टाळण्यासाठी बुटकेपणा, लूकडेपणा याबाबत जनजागृती",Awareness on Stunting and Malnutrition among Children
Poshan Tracker adds new application features,पोशन ट्रॅकर नवीन ऍप्लिकेशन वैशिष्ट्ये जोडत आहे,Adding new application features to the POSHAN tracker
Making or Updating Home Visit Planner and Initiating home visits,गृह- भेटीचे नियोजन बनवणे किंवा अपडेट करणे आणि गृह- भेटी सुरू करणे,Planning or updating a home visit and starting home visits
Poshan Calculator is designed to measure growth of the child based on standards defined by World Health Organization (WHO),पोषण कॅल्क्युलेटर हे मुलांची वाढ मोजण्यासाठी डिझाइन केलेले आहे जे जागतिक आरोग्य संघटनेने (डब्ल्यूएचओ) परिभाषित केलेल्या मानकांच्या आधारे मूल्यमापन करते,The POSHAN calculator is designed to measure the growth of children which is evaluated on the basis of parameters defined by the World Health Organization (WHO)
Migrated from one category to another,एका श्रेणीतून दुसर्यात स्थलांतरित झाले,Migrating from one category to another
It usually occurs when a person has not had food of adequate quality and quantity and/or they have had frequent or prolonged illnesses,हे सहसा तेव्हा होते जेव्हा एखाद्या व्यक्तीने पुरेशा दर्जाचे आणि प्रमाणात अन्न घेतले नसते आणि/किंवा त्यांना वारंवार किंवा दीर्घकाळापर्यंत आजार होत असतात,This usually happens when a person does not take adequate quality and quantity of food and / or suffers from frequent or prolonged illness
"Poshan Abhiyaan is India’s flagship programme to improve nutritional outcomes for children, adolescents, pregnant women and lactating mothers by leveraging technology, a targeted approach and convergence.","मुले, किशोरवयीन मुले, गर्भवती महिला आणि स्तनपान करणार्या मातांना तंत्रज्ञानाचा लाभ देऊन, लक्ष्यित दृष्टिकोन आणि अभिसरण देऊन पौष्टिक परिणाम सुधारण्यासाठी पोषण अभियान हा भारताचा प्रमुख कार्यक्रम आहे.","POSHAN Abhiyaan is India's flagship programme to improve the nutritional outcomes of children, adolescents, pregnant women and lactating mothers by providing them access to technology, targeted approach and convergence."
Hot Cooked Meal (HCM) given in last 30 days,मागील ३० दिवसात दिलेली गरम शिजवलेले भोजन (एचसीएम),Hot Cooked Meals (HCM) served in last 30 days
Uploading of Data of Anganwadi Services Schemes in Poshan Tracker,पोषण ट्रॅकरमध्ये अंगणवाडी सेवा योजनांचा डेटा अपलोड करणे,Uploading of Anganwadi Services data in POSHAN tracker
The Poshan Tracker generates automated alerts to the critical last-mile beneficiaries.,पोषण ट्रॅकर शेवटच्या टप्प्यातील गंभीर लाभार्थ्यांना स्वयंचलित सूचना व्युत्पन्न करतो.,The POSHAN tracker generates automated notifications for critical beneficiaries in the last stage.
It also ensures efficient audit of the delivery system by documenting real time attendance of beneficiaries and duty bearers.,हे लाभार्थी आणि कर्तव्य धारकांच्या वास्तविक वेळेच्या उपस्थितीचे दस्तऐवजीकरण करून वितरण प्रणालीचे कार्यक्षम ऑडिट देखील सुनिश्चित करते.,It also ensures an efficient audit of the distribution system by documenting the real time attendance of the beneficiaries and the duty holders.
"This management information system will help the nutrition programme to scale efficiently, thereby generating and documenting positive impact","ही व्यवस्थापन माहिती प्रणाली पोषण कार्यक्रमास कार्यक्षमतेने मापन करण्यास मदत करेल, ज्यामुळे सकारात्मक प्रभाव निर्माण आणि दस्तऐवजीकरण होईल","This Management Information System will help in effective measurement of POSHAN Abhiyaan, which will create a positive impact and document it"
How can one Download Poshan Tracker App?,आपण पोशन ट्रॅकर अॅप डाउनलोड कसे करू शकतो?,How to download the Poshan Tracker App?
"Clarification regarding Cost of Smart phones (03 June, 2021)","स्मार्ट फोनच्या किंमतीबाबात स्पष्टीकरण (03 जून, 2021)","Clarification on Price of Smartphones (June 03, 2021)"
along with status update once resolved,निराकरण झाल्यानंतर स्थिती अपडेट सह,With status update after resolution
"The Poshan Tracker system is regularly audited by auditors engaged by MWCD, for security and scalability of the system.",प्रणालीच्या सुरक्षितता आणि मापनक्षमतेसाठी पोषण ट्रॅकर प्रणालीचे नियमितपणे एमडब्ल्यूसीडीद्वारे गुंतलेल्या ऑडिटर्सद्वारे ऑडिट केले जाते.,The POSHAN tracker system is regularly audited by auditors engaged by MWCD for safety and scalability of the system.
The records may be used for such audits.,अशा ऑडिटसाठी नोंदी वापरल्या जाऊ शकतात.,Records can be used for such audit.
Poshan Tracker adds new Resources on Website,पॉशन ट्रॅकर वेबसाइट वैशिष्ट्यावर नवीन संसाधने जोडते,Adds new resources to the position tracker website feature
"Technology under Poshan Tracker is being leveraged for dynamic identification of stunting, wasting, under-weight prevalence among children and last mile tracking of nutrition service delivery","मुलांमध्ये खुंटणे, अशक्तपणा, कमी वजनाचे प्रमाण आणि पोषण सेवा वितरणाचा शेवटचा माइल ट्रॅकिंग यासाठी पोषण ट्रॅकर अंतर्गत तंत्रज्ञानाचा वापर केला जात आहे","Technology is being used under POSHAN tracker for stunting, under-nutrition, low birth weight, and last-mile tracking of nutrition service delivery among children"
The System also takes feedback about system performance and experience.,ही यंत्रणा व्यवस्थेचे कार्यप्रदर्शन आणि अनुभवाबद्दल फीडबॅक देखील घेते.,The system also takes feedback on the performance and experience of the system.
"Information on name, mobile number, date of registration and health status may be used for these purposes","या उद्देशांसाठी नाव, मोबाईल नंबर, नोंदणीची तारीख आणि आरोग्य स्थिती यावरील माहिती वापरली जाऊ शकते","Information on name, mobile number, registration date and health status can be used for these purposes"
"We collect the content and other information that you provide when you use our Services, including when you sign up for an account.","तुम्ही आमच्या सेवा वापरता तेव्हा तुम्ही दिलेली सामग्री आणि इतर माहिती आम्ही गोळा करतो, ज्यामध्ये तुम्ही खात्यासाठी साइन अप करता तेव्हा.","When you use our services, we collect the content and other information you provide when you sign up for an account."
"You may, however, choose not to share personal data where providing the data is optional.","तथापि, तुम्ही वैयक्तिक डेटा शेअर न करणे निवडू शकता जेथे डेटा प्रदान करणे पर्यायी आहे.","However, you can choose not to share personal data where providing data is optional."
Tracking of services to the end beneficiary at a click of a button.,एका बटणाच्या क्लिकवर अंतिम लाभार्थीपर्यंत सेवांचा पाठपुरवठा करणे.,Delivery of services to the ultimate beneficiary at the click of a button.
"Services like Take Home Ration (THR) and Hot cooked Meal (HCM), vaccination for Infants and Pregnant Women","होम रेशन(टीएचआर) आणि गरम शिजवलेले जेवण (एचसीएम), नवजात बालकांसाठी आणि गर्भवती महिलांसाठी लसीकरण यासारख्या सेवा","Services like Home Ration (THR) and Hot Cooked Meals (HCM), Vaccination for Newborn and Pregnant Women"
"New Poshan Tracker App (13 January, 2021)","नवीन पोषण ट्रॅकर अॅप (१३ जानेवारी, २०२१)","New POSHAN Tracker App (13th January, 2021)"
Preventing illnesses to avert Malnutrition and Death,कुपोषण आणि मृत्यू टाळण्यासाठी आजारांना प्रतिबंध करणे,Preventing Malnutrition and Infectious Diseases
Scan the QR Code to Download the App,एप डाउनलोड करण्यासाठी क्यूआर कोड स्कॅन करा,Scan the QR code to download the app
Pregnant women who received Take Home Ration (THR),होम रेशन(टीएचआर) मिळालेल्या गर्भवती महिला,Pregnant women receiving Home Ration (THR)
General Awareness on SAM and MAM,गंभीर तीव्र कुपोषण आणि मध्यम तीव्र कुपोषण वर सामान्य जागरूकता,General Awareness on Severe and Medium Severe Malnutrition
"App can be accessed offline, currently daily tracking feature is available for offline data entry.Offline mode can store latest 3 days data.",वैध इंटरनेट कनेक्शनशिवाय अॅप कार्य करत नाही.,The app does not work without a valid internet connection.
These organizations will not use the APIs/ No-code webpage integration to encourage or promote illegal activity or violation of third-party rights including these Terms with Poshan Tracker.,पॉशन ट्रॅकरसह या अटींसह बेकायदेशीर क्रियाकलाप किंवा तृतीय-पक्ष अधिकारांचे उल्लंघन करण्यास प्रोत्साहन देण्यासाठी या संस्था एपीआय/ नो-कोड वेबपृष्ठ एकत्रीकरण वापरणार नाहीत.,These entities shall not use API / no-code webpage aggregation to promote unlawful activities or violation of third-party rights with these conditions including position tracker.
"Pregnant Women, Lactating Mothers, Children from 6 months to 3 years and adolescent girls.","गरोदर महिला, स्तनपान करणार्या माता, 6 महिने ते 3 वर्षे वयोगटातील मुले आणि किशोरवयीन मुली.","Pregnant women, lactating mothers, children in the age group of 6 months to 3 years and adolescent girls."
"New Poshan Tracker App : CSC-SPV Nodal Person (02 February, 2021)","नवीन पोषण ट्रॅकर अॅपः सीएससी-एसपीव्ही नोडल व्यक्ती (०२ फेब्रुवारी, २०२१)",New POSHAN Tracker App: CSC SPV Nodal Person (02 February 2021)
An AWW can use ‘Migrate Beneficiary’ option to migrate a beneficiary from one AWC to another AWC basis their Aadhaar number.,एक अंगणवाडी सेविका लाभार्थी एका अंगणवाडी केंद्र मधून दुसर्या अंगणवाडी केंद्र मध्ये त्यांच्या आधार क्रमांकाच्या आधारे स्थलांतरित करण्यासाठी 'माइग्रेट लाभार्थी' पर्याय वापरू शकतो.,One Anganwadi Worker can use the option of Migrate Beneficiary to migrate from one Anganwadi Centre to another based on their Aadhaar number.
A beneficiary is eligible for HCM for at least 21 days in a month.,एक लाभार्थी एका महिन्यात किमान 21 दिवस एचसीएम साठी पात्र असतो.,A beneficiary is eligible for HCM for a minimum period of 21 days in a month.
ABHA (Health ID) and its Benefits,एबीएचए (आरोग्य आयडी) आणि त्याचे फायदे,ABHA (Health ID) and its benefits
"We'ar sorry, the page you requested could not be found.","आम्ही दिलगीर आहोत, आपण विनंती केलेले पृष्ठ आढळू शकले नाही.","We are sorry, the page you requested could not be found."
Dadra & Nagar Haveli - Daman & Diu,दादरा आणि नगर हवेली - दमण आणि दीव,Dadra and Nagar Haveli Daman and Diu
Download Mobile App from Play Store,प्ले स्टोअर वरून मोबाईल एप डाउनलोड करा,Download the app from the Play Store
General Awareness on the Delivery of the child,्रसूतीबद्दल आणि बाळाच्या जन्माबद्दल सामान्य जागरूकता,General Awareness about Maternity and Childbirth
"We also use the data to operate our services, which includes analyzing our performance, meeting our legal obligations, developing our workforce, and doing research.","आम्ही आमच्या सेवा ऑपरेट करण्यासाठी देखील डेटा वापरतो, ज्यामध्ये आमच्या कार्यप्रदर्शनाचे विश्लेषण करणे, आमच्या कायदेशीर दायित्वांची पूर्तता करणे, आमचे कार्यबल विकसित करणे आणि संशोधन करणे समाविष्ट आहे.","We also use data to operate our services, which includes analysing our performance, fulfilling our legal obligations, developing our workforce and doing research."
Where can I enquire about Hot Cooked Meal?,मी गरम शिजवलेल्या जेवणाबद्दल कुठे चौकशी करू शकतो?,Where can I inquire about hot cooked food?
In how many languages AWW can enter the data while filling up the form?,फॉर्म भरताना किती भाषांमध्ये एडब्ल्यूडब्ल्यू किंवा एडब्ल्यूसी डेटा प्रविष्ट करू शकतात?,How many languages AWW or AWC can enter data while filling the form?
Children who are identified as deficit on nutrition are eligible for additional food supplements.,पोषणाची कमतरता म्हणून ओळखली जाणारी मुले अतिरिक्त आहार पूरक आहारांसाठी पात्र आहेत.,Children who are known to be deficient in nutrition are eligible for additional dietary supplements.
An underweight person is a person whose body weight is considered too low to be healthy,कमी वजनाची व्यक्ती अशी व्यक्ती असते ज्यांचे शरीराचे वजन निरोगी होण्यासाठी खूप कमी मानले जाते,A person with low body weight is considered very low in order to be healthy
When and how to use MPIN?,एमपीन कधी आणि कसा वापरावा?,How and when to apply?
Ensuring that complementary feeding improves over time,कालांतराने पूरक आहार सुधारत आहे याची खात्री करणे,Ensure that the supplements are improved over time
Using ABHA (Health ID) is the first step towards creating safer and efficient digital health records for you and your family.,एबीएचए (आरोग्य आयडी) याचा वापर हे तुमच्यासाठी आणि तुमच्या कुटुंबासाठी सुरक्षित आणि कार्यक्षम डिजिटल आरोग्य नोंदी तयार करण्याच्या दिशेने पहिले पाऊल आहे.,The use of ABHA (Health ID) is the first step towards creating a safe and efficient digital health record for you and your family.
ABHA (earlier known as Health ID) is an acronym for Ayushman Bharat Health Account.,एबीएचए (पूर्वी आरोग्य आयडी म्हणून ओळखले जाणारे) हे आयुष्मान भारत आरोग्य खात्याचे संक्षिप्त रूप आहे.,ABHA (formerly known as Arogya ID) is the acronym for Ayushman Bharat Health Department.
AWW/AWCs can only be added by nodal level official.Anybody in the above rank in the hierarchy.,"एडब्ल्यूडब्ल्यू / एडब्ल्यूसी फक्त नोडल स्तराच्या अधिकार्याद्वारे जोडले जाऊ शकतात.पदानुक्रमात वरीलपैकी कोणीही.राष्ट्रीय स्तराप्रमाणेच राज्य, जिल्हा, प्रकल्प आणि क्षेत्र पातळीवरील वापरकर्ता तयार करू शकतो.राज्यस्तरीय वापरकर्ता जिल्हा, प्रकल्प आणि क्षेत्र पातळीवरील वापरकर्ता तयार करू शकतो, जिल्हास्तरीय वापरकर्ता प्रकल्प आणि क्षेत्र पातळीचा वापरकर्ता तयार करू शकतो, प्रकल्प स्तराचा वापरकर्ता क्षेत्र स्तराचा वापरकर्ता तयार करू शकतो.",AWWs / AWCs can be connected only by a nodal officer.
Where can I enquire about take home ration?,होम रेशनबद्दल मी कुठे चौकशी करू शकतो?,Where can I enquire about home rations?
We use the information we collect from all our services for the following purposes:,आम्ही आमच्या सर्व सेवांमधून संकलित केलेली माहिती खालील उद्देशांसाठी वापरतोः,We use the data collected from all our services for the following purposes:
Identification & Referral of Sick Newborn,आजारी नवजात बाळाची ओळख आणि संदर्भ,Identification and Reference of Sick Newborn
