eng,mr,indic_trans_translated
MPIN can be easily reset by any AWW/AWC user.,एमपीआयएन सहजपणे कोणत्याही एडब्ल्यूडब्ल्यू / एडब्ल्यूसी वापरकर्त्याद्वारे रीसेट केले जाऊ शकते.,MPIN can be easily reset by any AWW / AWC user.
"You are required to click on Forgot MPIN, and enter your registered mobile number.","आपल्याला विसरलेले एमपीन वर क्लिक करणे आवश्यक आहे, आणि आपला नोंदणीकृत मोबाइल नंबर प्रविष्ट करणे आवश्यक आहे.","You need to click on the forgot MPIN, and enter your registered mobile number."
You will receive and OTP on your registered mobile number and you can ealily reset your MPIN,आपल्या नोंदणीकृत मोबाइल नंबरवर आपल्याला ओटीपी प्राप्त होईल आणि आपण आपल्या एमपीनला रीसेट करू शकता.,You will receive an OTP on your registered mobile number and you can reset your MPIN.
The Poshan Tracker is a job-aid to the Anganwadi worker for efficient delivery of services along with reflection of their efforts.,पोषण ट्रॅकर अंगणवाडी कर्मचार्यांना त्यांच्या प्रयत्नांचे प्रतिबिंब देऊन कार्यक्षमतेने सेवा पुरवण्यासाठी नोकरी-सहाय्य आहे.,"The POSHAN tracker is a job-oriented service delivery platform for Anganwadi workers to provide services in an efficient manner, reflecting their efforts."
It is a critical and beneficiary-centric service delivery Application under POSHAN Abhiyaan which will promote real time data with analytics,पोषण अभियानांतर्गत हा एक गंभीर आणि लाभार्थी-केंद्रित सेवा वितरण अनुप्रयोग आहे जो विश्लेषणासह वास्तविक वेळेच्या डेटाला प्रोत्साहन देईल,This is a serious and beneficiary-centric service delivery application under POSHAN Abhiyaan which will promote real-time data with analytics
Please enter valid Date of Birth,कृपया वैध जन्मतारीख प्रविष्ट करा,Please enter a valid date of birth
Who is eligible for additional supplementary food?,अतिरिक्त पूरक आहारासाठी कोण पात्र आहे?,Who is eligible for additional supplementary diet
"We reserve the unconditional right to change, modify, add, or remove any part of these Terms at any time, without specifically notifying you of such changes.","या अटींचा कोणताही भाग बदलण्याचा, सुधारण्याचा, जोडण्याचा किंवा काढून टाकण्याचा बिनशर्त अधिकार आम्ही राखून ठेवतो, अशा बदलांबद्दल तुम्हाला विशेषतः सूचित न करता.","We reserve the unqualified right to alter, amend, add or remove any of these conditions without specifically notifying you of such changes."
Any changes or updates will be effective immediately.,कोणतेही बदल किंवा अद्यतने त्वरित प्रभावी होतील.,Any changes or updates that come into effect immediately.
You take the responsibility to check these Terms of Use periodically for changes.,बदलांसाठी वेळोवेळी या वापर अटी तपासण्याची जबाबदारी तुम्ही घेणे.,You have the responsibility of checking these usage conditions from time to time for the changes.
Your continued use of the platform post such revision shall constitute acceptance of the modified Terms.,अशा पुनरावृत्तीनंतर तुम्ही प्लॅटफॉर्मचा सतत वापर केल्यास सुधारित अटींची स्वीकृती होईल.,"After such repetition, if you continue to use the platform, the revised terms will be accepted."
How many different types of reports can be generated over Poshan Tracker Dashboard?,पोषण ट्रॅकर डॅशबोर्डवर किती वेगवेगळ्या प्रकारचे अहवाल तयार केले जाऊ शकतात?,How many different types of reports can be generated on the POSHAN Tracker Dashboard
How to revive your health if you are Severely Wasted (SAM),तुम्ही गंभीरपणे अशक्त असाल (सॅम ) तुमचे आरोग्य कसे सुधारावे,"You might be seriously ill (Sam), how to improve your health."
"See assessment charts for Stunted, Wasted and Underweight parameters","बुटकेपणा, लूकडेपणा आणि कमी वजन या मापदंडांसाठी मूल्यांकन तक्ते पहा","Check the evaluation table for the criteria of obesity, obesity and low body weight"
Resources for growth monitoring and general awareness,ग्रोथ मॉनिटरिंग आणि सामान्य जागरूकता साठी संसाधने,Resources for Growth Monitoring and General Awareness
AWW are required to enter details related to infrastructure present in a particular Anganwadi centre.,एएनडब्ल्यूडब्ल्यूला विशिष्ट अंगणवाडी केंद्रात असलेल्या पायाभूत सुविधांशी संबंधित तपशील प्रविष्ट करणे आवश्यक आहे.,ANWW is required to enter the details related to the infrastructure available in the identified Anganwadi Centres.
"This includes structure, basic amenities, facilities, sanitization, drinking water etc.","यामध्ये संरचना, मूलभूत सुविधा, सुविधा, स्वच्छता, पिण्याचे पाणी इत्यादींचा समावेश आहे.","These include infrastructure, basic amenities, facilities, sanitation, drinking water etc."
Lactating mothers who received Take Home Ration (THR),होम रेशन(टीएचआर) मिळालेल्या स्तनदा माता,Breastfeeding mothers receiving Home Ration (THR)
"Poshan Tracker reserve the unconditional right to change, modify, add, or remove any part of this Privacy Policy at any time, without specifically notifying you of such changes.","पोषण ट्रॅकर या गोपनीयता धोरणाचा कोणताही भाग कोणत्याही वेळी बदलण्याचा, सुधारण्याचा, जोडण्याचा किंवा काढून टाकण्याचा बिनशर्त अधिकार राखून ठेवतो, विशेषतः अशा बदलांबद्दल तुम्हाला सूचित न करता.","Poshan Tracker reserves the unconditional right to change, modify, add or remove any part of this Privacy Policy at any time, especially without notifying you of such changes."
Any changes or updates will be effective immediately.,कोणतेही बदल किंवा अद्यतने त्वरित प्रभावी होतील.,Any changes or updates that come into effect immediately.
You should review this Privacy Policy regularly for changes.,बदलांसाठी तुम्ही या गोपनीयता धोरणाचे नियमितपणे पुनरावलोकन करावे.,You should regularly review this Privacy Policy for changes.
"We will use commercially reasonable efforts to generally notify all users of any material changes to this Privacy Policy, such as through a notice on the System.","आम्ही या गोपनीयता धोरणातील कोणत्याही भौतिक बदलांबद्दल सर्व वापरकर्त्यांना सूचित करण्यासाठी व्यावसायिकदृष्ट्या वाजवी प्रयत्न करू, जसे की सिस्टमवरील सूचना.","We will make a professional reasonable effort to inform all users about any physical changes to this privacy policy, such as instructions on the system."
"However, as a user of the System, you should regularly check the Privacy Policy for any changes.","तथापि, सिस्टमचा वापरकर्ता म्हणून, कोणत्याही बदलांसाठी तुम्ही नियमितपणे गोपनीयता धोरण तपासले पाहिजे.","However, as a user of the system, you must regularly check the privacy policy for any changes."
"We will also update the “Last Updated” date at the top of this Privacy Policy, which reflects the effective date of this Privacy Policy.","आम्ही या गोपनीयता धोरणाच्या शीर्षस्थानी \""अंतिम अद्यतनित\"" तारीख देखील अद्यतनित करू, जी या गोपनीयता धोरणाची प्रभावी तारीख दर्शवते.",""""" ""We will also update the"" """" ""Final Update"" """" ""date at the top of this Privacy Policy, which reflects the effective date of this Privacy Policy."" """""
Your continued access or use of the System after the date of the new Privacy Policy constitutes your acceptance of the new Privacy Policy.,नवीन गोपनीयता धोरणाच्या तारखेनंतर तुमचा सतत प्रवेश किंवा सिस्टमचा वापर नवीन गोपनीयता धोरणाची तुमची स्वीकृती बनवते.,Your continued access or use of the system after the date of the new privacy policy makes your acceptance of the new privacy policy.
"If you do not agree to the new Privacy Policy, you must stop accessing and/or using the System.","तुम्ही नवीन गोपनीयता धोरणाशी सहमत नसल्यास, तुम्ही सिस्टममध्ये प्रवेश करणे आणि/किंवा वापरणे थांबवणे आवश्यक आहे.","If you do not agree with the new privacy policy, you must log in and / or stop using the system."
What is the eligibility of a beneficiary?,लाभार्थीची पात्रता काय आहे?,What is the eligibility of the beneficiary
"No, Poshan Tracker is available only for Android version",पोषण ट्रॅकर केवळ अँड्रॉइड आवृत्तीसाठी उपलब्ध आहे.,The POSHAN tracker is available only for the Android version.
 XV. INDEMNITY AND LIMITATION OF LIABILITY, XV. नुकसानभरपाई आणि दायित्वाची मर्यादा,Compensation and Liability Limit
Growth monitoring report for all health indicators,सर्व आरोग्य निर्देशकांसाठी वाढ निरीक्षण अहवाल,Enhancement Monitoring Report for all Health Indicators
Take Home Ration (THR) given in last 30 days,मागील ३० दिवसात दिलेली होम रेशन (टीएचआर),Home Ration (THR) issued during last 30 days
Children are defined as stunted if their height-for-age is more than two standard deviations below the WHO Child Growth Standards median,डब्ल्यूएचओ चाइल्ड ग्रोथ स्टँडर्ड्स मेडिअनच्या खाली दोन मानक विचलनांपेक्षा जास्त वयाची उंची असल्यास मुलांची खुंटलेले म्हणून व्याख्या केली जाते,Children are defined as stunted if they are above the age of two standard deviations under the WHO Child Growth Standards Median
What is the purpose of Launching Poshan Tracker?,पोषण ट्रॅकर लॉन्च करण्याचा हेतू काय आहे ?,What is the purpose of launching POSHAN tracker?
"As a registered user, you have the right to access your profile at any time.","नोंदणीकृत वापरकर्ता म्हणून, तुम्हाला तुमच्या प्रोफाइलमध्ये प्रवेश करण्याचा अधिकार आहे.","As a registered user, you have the right to access your profile."
"Although, the changes can only be done as prescribed by the Poshan Tracker system from time to time.","तथापि, बदल केवळ पोषण ट्रॅकर प्रणालीद्वारे वेळोवेळी निर्धारित केल्यानुसारच केले जाऊ शकतात.","However, changes can be made only through the POSHAN tracker system as prescribed from time to time."
You cannot manage the communications that you receive from us or how you receive them.,तुम्ही आमच्याकडून प्राप्त झालेले संप्रेषण किंवा ते कसे प्राप्त करता ते तुम्ही व्यवस्थापित करू शकत नाही.,You cannot manage the communications you receive from us or how you receive them.
" XIII. COMPLIANCE WITH LAW, THIRD PARTY RIGHTS, AND OTHER TERMS OF SERVICE"," XIII. कायद्याचे पालन, तृतीय पक्षाचे अधिकार आणि इतर सेवा अटी","Enforcement of laws, rights of third parties and other conditions of service."
"repeated infection, and inadequate psychosocial stimulation","वारंवार संसर्ग, आणि अपुरी मनोसामाजिक उत्तेजना","Frequent infections, and insufficient psychosocial stimulation"
Beneficiary migration from one AWC to another AWC,एका एडब्ल्यूसी मधून दुसर्या एडब्ल्यूसी मध्ये लाभार्थी स्थलांतर,Beneficiary migration from one AWC to another AWC
"Training on ICT Platform under POSHAN Abhiyaan (02 February, 2021)","पोषण अभियानांतर्गत आयसीटी प्लॅटफॉर्मवर प्रशिक्षण (०२ फेब्रुवारी, २०२१)",Training on ICT Platform under POSHAN Abhiyaan (02 February 2021)
You may browse the Site without registering for an account.,तुम्ही खात्यासाठी नोंदणी न करता साइट ब्राउझ करू शकता.,You can browse the site without registering for the account.
"You will be required to register for an account with your mobile number, if you intent to use certain features or services offered by the Site.","साइटद्वारे ऑफर केलेली काही वैशिष्ट्ये किंवा सेवा वापरण्याचा तुमचा हेतू असल्यास, तुम्हाला तुमच्या मोबाइल नंबरसह खात्यासाठी नोंदणी करणे आवश्यक आहे.","If you intend to use any of the features or services offered by the site, you are required to register for the account with your mobile number."
You are solely responsible for maintaining the confidentiality of your personal information and registration and all activities that might result from you failing from keeping this information secure.,तुमची वैयक्तिक माहिती आणि नोंदणी आणि ही माहिती सुरक्षित ठेवण्यात तुम्ही अयशस्वी झाल्यामुळे होणार्या सर्व क्रियाकलापांची गोपनीयता राखण्यासाठी तुम्ही पूर्णपणे जबाबदार आहात.,You are fully responsible for maintaining confidentiality of your personal information and registration and all activities that take place due to your failure to protect this information.
Your registration or mobile number shall be kept confidentialYou undertake that:You have obtained consent from the concerned individuals for creating their records through your account.,तुमची नोंदणी किंवा मोबाईल क्रमांक गोपनीय ठेवला जाईलतुम्ही ते हाती घ्याःतुमच्या खात्याद्वारे त्यांचे रेकॉर्ड तयार करण्यासाठी तुम्ही संबंधित व्यक्तींकडून संमती घेतली आहे.,Your registration or mobile number will be kept confidential: You have taken the consent of the concerned person to create their record through your account.
Your account or mobile number shall not include the name of another person with the intent to impersonate that person.,तुमच्या खात्यात किंवा मोबाईल नंबरमध्ये त्या व्यक्तीची तोतयागिरी करण्याच्या हेतूने दुसर्या व्यक्तीचे नाव समाविष्ट नसावे.,Your account or mobile number should not contain the name of another person for the purpose of tracing that person.
You shall not use another user's account without their permission.,तुम्ही दुसर्या वापरकर्त्याचे खाते त्यांच्या परवानगीशिवाय वापरू नये.,You should not use another user's account without their permission.
"You shall immediately notify us in writing, if you discover any unauthorized use of your account or other account-related security breach.","तुम्हाला तुमच्या खात्याचा कोणताही अनधिकृत वापर किंवा इतर खाते-संबंधित सुरक्षा उल्लंघन आढळल्यास, तुम्ही आम्हाला त्वरित लेखी सूचित कराल.","If you find any unauthorized use of your account or other account-related security breach, you will immediately inform us in writing."
"If we receive a complaint that your account violates someone else's rights, or violates our policies we may cancel or block your account.",तुमचे खाते दुसर्याच्या अधिकारांचे उल्लंघन करत असल्याची किंवा आमच्या धोरणांचे उल्लंघन करत असल्याची तक्रार आम्हाला मिळाल्यास आम्ही तुमचे खाते रद्द करू किंवा ब्लॉक करू.,"If we receive a complaint that your account is violating the rights of others or is in violation of our policies, we will block or suspend your account."
"You shall not attempt to conceal your identity by using multiple Internet Protocol addresses or mobile no, or by any other means, to register participants on the Site",साइटवर सहभागींची नोंदणी करण्यासाठी तुम्ही एकाधिक इंटरनेट प्रोटोकॉल पत्ते किंवा मोबाइल नंबर वापरून किंवा इतर कोणत्याही मार्गाने तुमची ओळख लपवण्याचा प्रयत्न करू नका,Do not try to hide your identity using multiple internet protocol addresses or mobile numbers or in any other way to register participants on the site
Poshan Tracker App is available in 22 different languagesThe various languages available are:EnglishHindiGujaratiPunjabiMarathiBanglaKannadaTamilTeluguMalyalamOdiaAssameseNepaliDogriKonkaniSindhiBodoMaithiliManipuriSanthaliUrduKashmiri,पोषण ट्रॅकर अॅप २२ वेगवेगळ्या भाषांमध्ये उपलब्ध आहे.उपलब्ध विविध भाषा या आहेतःइंग्रजीहिंदीगुजरातीपंजाबीमराठीबंगालकन्नडतमिळतेलुगुमल्याळमओडियाआसामीNepaliDogriKonkaniSindhiBodoMaithiliManipuriSanthaliUrduKashmiri,"POSHAN tracker app is available in 22 different languages: English, Hindi, Gujarati, Punjabi, Marathi, Bengali, Kannada, Tamil, Malayalam, Odiya, Assamese, Nepali, Konkani, Sindhi, Maithili, Manipuri, Kashmiri"
"The proposed system should enable real-time monitoring and tracking of all AWCs, AWWs and beneficiaries on the defined indicators.","प्रस्तावित सिस्टीमने निश्चित निर्देशकांवरील सर्व AWCs, AWWs आणि लाभार्थ्यांचे वास्तविक-वेळ देखरेख आणि ट्रॅक करण्यास सक्षम केले पाहिजे.","The proposed system should enable real time monitoring and tracking of all AWCs, AWWs and beneficiaries on specified indicators."
How to Login in Poshan Tracker App?,पोषण ट्रॅकर अॅपमध्ये लॉग इन कसे करावे?,How to log into POSHAN Tracker App?
Height and weight of child has not been measured,मुलाची उंची आणि वजन मोजले गेले नाही,The height and weight of the child were not measured
Calculator to measure the child growth based on the WHO Child Growth Standards.,डब्ल्यूएचओ चाइल्ड ग्रोथ स्टँडर्ड्सवर आधारित मुलांची वाढ मोजण्यासाठी कॅल्क्युलेटर,Calculator to measure the growth of children based on WHO Child Development Standards
TAKE HOME RATION (THR) GIVEN TODAY,आज दिले गेलेले घर रेशन (THR),Today's Home Ration (THR)
A beneficiary is eligible for THR for at least 21 days in a month.,एक लाभार्थी महिन्यातून किमान 21 दिवस टीएचआर साठी पात्र आहे.,A beneficiary is eligible for a minimum period of 21 days in a month.
 III. NOTICE REGARDING FUTURE CHANGES TO TERMS:, III. अटींमधील भविष्यातील बदलांबाबत सूचनाः,Suggestions for future changes:
Planning And Organising Community Based Events At AWC,अंगणवाडी केंद्रामध्ये समुदाय आधारित कार्यक्रमांचे नियोजन आणि आयोजन,Planning and Management of Community Based Programmes at Anganwadi Centres
Please find the following steps to LoginStep 1- Click on Poshan Tracker Website https://poshantracker.,Please find the following steps to LoginStep 1- Click on Poshan Tracker Website https://poshantracker.,Please find the following steps to Login Step 1 - Click on Poshan Tracker Website https: / / posttracker.
inStep 2- Enter your registered Mobile Number and pre-set 4 digit MPIN.,inStep 2- Enter your registered Mobile Number and pre-set 4 digit MPIN.,Step 2 - Enter your registered mobile number and pre-set 4 digit MPIN.
How AWWS can sign up on the app if they are unable to register via their mobile numbers?,अॅडब्ल्यूडब्ल्यूएस त्यांच्या मोबाईल नंबरद्वारे नोंदणी करण्यात अक्षम असल्यास अॅपवर कसे साइन अप करू शकते?,How can AWWs sign up on the app if they are unable to register through their mobile number?
Poshan Tracker adds new Reports feature,पोशन ट्रॅकरने नवीन अहवाल वैशिष्ट्य जोडले आहे,New report feature added by POSHAN Tracker
