eng,mr,indic_trans_translated
The Site is directed to the people residing in India.,साइट भारतात राहणार्या लोकांसाठी निर्देशित केली आहे.,The site is meant for people residing in India.
We do not represent that Content available on or through the Site is appropriate or available in other locations.,आम्ही असे प्रतिनिधित्व करत नाही की साइटवर किंवा त्याद्वारे उपलब्ध असलेली सामग्री योग्य आहे किंवा इतर ठिकाणी उपलब्ध आहे.,We do not represent whether the material that is available on or through the site is correct or is available at other places.
We may limit the availability of the Site or any service or product described on the Site to any person or geographic area at any time.,आम्ही साइट किंवा साइटवर वर्णन केलेल्या कोणत्याही सेवा किंवा उत्पादनाची उपलब्धता कोणत्याही व्यक्ती किंवा भौगोलिक क्षेत्रासाठी कोणत्याही वेळी मर्यादित करू शकतो.,We can limit the availability of any service or product described on the site or site to any person or geographical area at any time.
"If you choose to access the Site from outside India, you do so at your own risk.","तुम्ही भारताबाहेरून साइटवर प्रवेश करणे निवडल्यास, तुम्ही ते तुमच्या स्वतःच्या जोखमीवर करता.","If you choose to access the site from outside India, you do so at your own risk."
Please go back to the homepage,कृपया मुख्यपृष्ठावर परत जा,Please return to the homepage
Please enter Height greater than 29.99 and less than 140.01,कृपया 38 पेक्षा जास्त आणि 150 पेक्षा कमी उंची प्रविष्ट करा,Please enter a height of more than 38 and less than 150
"While login to the Poshan Tracker App, AWWs are required to enter the MPIN set by them.","पोषण ट्रॅझर अॅपवर लॉग इन करताना, एडब्ल्यूडब्ल्यू ने त्यांच्याद्वारे सेट केलेला एमपीन प्रविष्ट करणे आवश्यक आहे.","While logging into POSHAN Treasure App, AWW is required to enter the MPIN set by them."
This MPIN will act as a passcode to run the Poshan Tracker App and entering the information in the beneficiaries forms.,हे एमपीन पोषण ट्रॅकर अॅप चालविण्यासाठी पासकोड म्हणून काम करेल आणि लाभार्थी फॉर्ममध्ये माहिती प्रविष्ट करेल.,This MP will act as a passcode to run the POSHAN tracker app and enter the information in the beneficiary form.
How to ensure timely initiation of complementary feeding,पूरक आहार वेळेवर सुरू करण्याची खात्री कशी करावी,How to ensure timely delivery of supplements
Poshan Tracker App can only be installed in Android Phone with Android version 6.0 and above.,पॉशन ट्रॅकर अॅप केवळ अँड्रॉइड फोन ६.० आणि त्यावरील आवृत्तीसह स्थापित केला जाऊ शकतो.,The POSHAN Tracker app can be installed with Android Phone 6.0 and above only.
General Awareness about Growth Monitoring of Children,मुलांच्या ग्रोथ मॉनिटरिंग बद्दल सामान्य जागरूकता,General Awareness on Child Growth Monitoring
Wasting is defined as low weight-for-height,अशक्त जाण्याची व्याख्या उंचीसाठी कमी वजन अशी केली जाते,Disability is defined as low weight for height
Hot Cooked Meal (HCM) Given Today,आज दिलेला गरम शिजवलेले भोजन (एचसीएम),Hot Cooked Meal (HCM) served today
There are 6 categories for beneficiariesPregnant WomenLactating MotherChildren from 0 to 6 monthsChildren from 6 months to 3 yearsChildren from 3 years to 6 yearsAdolescent girls,लाभार्थ्यांसाठी 6 श्रेणी आहेतगर्भवती महिलास्तनपान करणारी आईमुले 0 महिने - 6 महिनेमुले 6 महिने - 3 वर्षेमुले 3 वर्षे - 6 वर्षेकिशोरवयीन मुली,"There are 6 categories of beneficiaries: Pregnant women, Lactating mothers, Pregnant women, Lactating mothers, Pregnant women, Lactating mothers, Pregnant women, Lactating mothers, Pregnant women, Lactating mothers, Pregnant women, Lactating mothers, Pregnant women, Lactating mothers, Pregnant women, Lactating women, Pregnant women, Lactating women, Pregnant women, Lactating women, Lactating women, Pregnant women, Lactating women, Pregnant women, Lactating women, Lactating women, Pregnant women, Lactating mothers, Pregnant women, Lactating women, Pregnant women, Lactating women, Pregnant women, Pregnant women, Lactating women, Pregnant women, Lactating mothers and Lactating women."
"Data Plan for Mobile Application (01 March, 2021)",मोबाइल अनुप्रयोगासाठी डेटा प्लॅन (०१ मार्च २०२१),Data Plan for Mobile Application (01.03.2021)
 VIII. LIMITATIONS OF MULTI- LINGUAL INTERFACE, VIII. बहु-भाषिक इंटरफेसच्या मर्यादा,Multilingual interface limit
Srijangram I. C. D. S. Project,सृजनग्राम आयसीडीएस प्रकल्प,Srijangram ICDS Project
"We may investigate any violation of these Terms, including unauthorized use of the Site.",आम्ही साइटच्या अनधिकृत वापरासह या अटींच्या कोणत्याही उल्लंघनाची चौकशी करू शकतो.,"We can investigate any violation of these conditions, including unauthorized use of the site."
We may provide law enforcement with information you provide to us related to your transactions to assist in any investigation or prosecution of you.,तुमच्यावरील कोणत्याही तपासात किंवा खटला चालवण्यात मदत करण्यासाठी तुमच्या व्यवहारांशी संबंधित तुम्ही आम्हाला प्रदान केलेली माहिती आम्ही कायद्याची अंमलबजावणी करू शकतो.,We can enforce the law by providing you with information related to your transactions to assist in any investigation or prosecution against you.
We may take legal action that we feel is appropriate.,आम्हाला योग्य वाटेल अशी कायदेशीर कारवाई आम्ही करू शकतो.,We will take appropriate legal action.
Poshan Calculator helps to identify various health conditions of the child as per World Health Organization (WHO) standards,पोषण कॅल्क्युलेटर जागतिक आरोग्य संघटनेच्या (डब्ल्यूएचओ) मानकांनुसार मुलाच्या विविध आरोग्य स्थिती ओळखण्यास मदत करते,The POSHAN Calculator helps in identifying the various health status of the child as per World Health Organization (WHO) standards
How to take care of weak newborn with the help of Kangaroo Mother Care,कांगारू मदर केअरच्या मदतीने कमकुवत नवजात बाळाची काळजी कशी घ्यावी,How to take care of a weak newborn with Kangaroo Mother Care?
"Any liabilities civil or criminal, arising out of any incorrect data, shall solely lie with the concerned ASP.",कोणत्याही चुकीच्या डेटामुळे उद्भवलेल्या कोणत्याही दिवाणी किंवा फौजदारी दायित्वे केवळ संबंधित एएसपीकडेच राहतील.,Any civil or criminal liability arising out of any incorrect data shall remain with the concerned ASPs only.
Poshan Tracker App is available over Google playstore https://play. google. com/store/apps/details?,पोषण ट्रॅकर अॅप गुगल प्लेस्टोअरवर उपलब्ध आहे https://play. google. com/store/apps/details?,The POSHAN tracker app is available on Google Playstore at https: / / play.google.com / store / apps / details? id =? id =? id =? t
Can App be accessed without internet?,इंटरनेटशिवाय आप मध्ये प्रवेश केला जाऊ शकतो का?,Is it possible to access you without internet?
The Government has taken several initiatives to break the intergenerational cycle of malnutrition in children.,मुलांमध्ये कुपोषणाच्या मध्यंतरी चक्र मोडीत काढण्यासाठी सरकारने अनेक पुढाकार घेतले आहेत.,The government has taken several initiatives to break the cycle of malnutrition among children.
"Adopting a life-cycle approach, interventions have been designed to meet the nutritional requirement of adolescent girls and boys, pregnant women, lactating mothers and children.","जीवन-चक्र दृष्टिकोन स्वीकारणे, हस्तक्षेप किशोरवयीन मुली आणि मुले, गर्भवती महिला, स्तनपान करणारी माता व मुलांची पौष्टिक आवश्यकता भागविण्यासाठी डिझाइन केले गेले आहे.","The intervention is designed to meet the nutritional needs of adolescent girls and children, pregnant women, lactating mothers and children."
Awareness for Pregnancy in Preventing Anemia,गरोदरपणात रक्तशय टाळण्यासाठी जागरूकता,Awareness to avoid bleeding during pregnancy
"Howrah North (U) I. C. D. S. Project, Howrah","हावडा उत्तर (यु) आयसीडीएस प्रकल्प, हावडा","Howrah North (U) ICDS Project, Howrah"
Birth Preparedness- For Institutional and Home Delivery,जन्माची तयारी- दवाखान्यात आणि घरी प्रसूतीसाठी,Birth Preparations - Hospital and Home delivery
New beneficiary addition with skip OTP option,"ओटीपी वगळा, पर्यायासह नवीन लाभार्थी जोडणे","Inclusion of new beneficiaries with options, excluding OTP"
We are now available on Video Conference,आम्ही आता व्हिडिओ कॉन्फरन्सवर उपलब्ध आहोत,We are now available through video conference
"Poshan Tracker App is meant for Aanganwadi workers, Anganwadi centers to enter beneficiaries data in the forms.","अंगणवाडी सेविका, अंगणवाडी केंद्रे, लाभार्थ्यांचा डेटा फॉर्ममध्ये टाकण्यासाठी पोषण ट्रॅकर अॅप आहे.","There is a POSHAN tracker app for uploading the data of Anganwadi Workers, Anganwadi Centres, beneficiaries in the form."
It is not at all developed for general public.,हे सर्वसामान्यांसाठी अजिबात विकसित केलेले नाही.,It is not meant for the common man.
Swastha Balak/Balika Spardha Mission is about celebrating the health of children in India.,Swastha Balak/Balika Spardha Mission is about celebrating the health of children in India.,Swastha Balak / Balika Spardha Mission is about celebrating the health of children in India.
It entails identification and awareness of health conditions and providing necessary support wherever required.,It entails identification and awareness of health conditions and providing necessary support wherever required.,It indicates identification and awareness of health conditions and providing adequate support wherever required.
”Our Privacy Policy applies when you use our Services (described below).,"""Our Privacy Policy applies when you use our Services (described below).",Our Privacy Policy applies when you use our Services (described below).
"This Privacy Policy is meant to help you understand what information we collect, why we collect it, and how it is used and shared.","This Privacy Policy is meant to help you understand what information we collect, why we collect it, and how it is used and shared.","This Privacy Policy is meant to help you understand what information we collect, why we collect it, and how it is used and shared."
The collecting and retaining agency in respect of your information is Ministry of Women and Child Development.,The collecting and retaining agency in respect of your information is Ministry of Women and Child Development.,The collecting and retaining agency in respect of your information is Ministry of Women and Child Development.
We are committed to protecting the security of your personal information and safeguarding your privacy.,We are committed to protecting the security of your personal information and safeguarding your privacy.,We are committed to protecting the security of your personal information and protecting your privacy.
How to revive your health if you are Underweight,तुमचे वजन कमी असल्यास तुमचे आरोग्य कसे सुधारावे,How to improve your health if you are underweight
Can a beneficiary change his/her AWC?,लाभार्थी त्याचे/तिचे अंगणवाडी केंद्र बदलू शकतो का?,Can the beneficiary change his / her Anganwadi Centre?
"We use the information we have, to help verify accounts.",खाती पडताळण्यात मदत करण्यासाठी आम्ही आमच्याकडे असलेली माहिती वापरतो.,We use the information we have to help us verify the accounts.
The records may be used for verification of health status for the purposes of Poshan Tracker control and response.,पोषण ट्रॅकर नियंत्रण आणि प्रतिसादाच्या उद्देशाने आरोग्य स्थितीच्या पडताळणीसाठी रेकॉर्डचा वापर केला जाऊ शकतो.,The records can be used for verification of health status for the purpose of nutrition tracker control and response.
Scan the QR Code to Download the App,अॅप डाउनलोड करण्यासाठी क्यूआर कोड स्कॅन करा,Scan the QR code to download the app
Who is eligible for Hot Cooked Meal?,गरम शिजवलेल्या जेवणासाठी कोण पात्र आहे?,Who is eligible for hot cooked meals?
Identifying and preventing Severe Acute Malnutrition,गंभीर तीव्र कुपोषण ओळखणे आणि प्रतिबंध करणे,To identify and prevent severe acute malnutrition
Children who are identified as deficit on nutrition are eligible for additional food supplements.,पोषणाची कमतरता म्हणून ओळखली जाणारी मुले अतिरिक्त आहार पूरक आहारांसाठी पात्र आहेत.,Children who are known to be deficient in nutrition are eligible for additional dietary supplements.
Who is eligible for additional supplementary food.,अतिरिक्त पूरक आहारासाठी कोण पात्र आहे.,Who is eligible for additional supplementary diet.
"Uploading of Data of Anganwadi Services Schemes in Poshan Tracker (24 May, 2021)","पोषण ट्रेकरमध्ये अंगणवाडी सेवा योजनांचा डेटा अपलोड करणे (24 मे, 2021)","Uploading of Anganwadi Services data in POSHAN tracker (24th May, 2021)"
Children between 6 months - 3 years,६ महिन्यांपासून ३ वर्षाच्या मुलांची केली,Children aged 6 months to 3 years
"Ministry of Women and Child Development, Government of India, Shastri Bhawan, New Delhi","महिला व बाल विकास मंत्रालय, भारत सरकार, शास्त्री भवन, नवी दिल्ली","Ministry of Women and Child Development, Government of India, Shastri Bhawan, New Delhi"
Care of the weak newborn baby - How many weak babies are we missing?,अशक्त नवजात बाळाची काळजी - आपण किती अशक्त नवजात  बालके गमावत आहोत?,Care for a Disabled Newborn - How many of our disabled newborns are we losing?
Underweight children who received Supplementary Nutrition,कमी वजनाची मुले ज्यांना पूरक पोषण मिळाले,Low birth weight children who received supplementary nutrition
Identification and care of a Weak Newborn baby,अशक्त नवजात बाळाची ओळख आणि काळजी,Identification and Care of a Disabled Newborn
1.2. Information from use of services.,1.2. सेवांच्या वापरावरून माहिती.,1.2 Information on use of services.
Please contact your respective Anganwadi Centre.,कृपया तुमच्या संबंधित अंगणवाडी केंद्राशी संपर्क साधा.,Please contact your respective Anganwadi Centre.
GOBARDANGA I. C. D. S PROJECT(U),गोबरडंगा आयसीडीएस प्रकल्प(यु),Gobardanga ICDS Project (U)
Please fill in the form below to create a new ticket.,नवीन तिकीट तयार करण्यासाठी कृपया खालील फॉर्म भरा.,Please fill out the following form to generate a new ticket.
Anganwadi Worker will reach out to you within 48 hours.,अंगणवाडी सेविका 48 तासांच्या आत तुमच्यापर्यंत पोहोचेल.,Anganwadi worker will reach you in 48 hours.
Please note down the ticket number for future reference.,भविष्यातील संदर्भासाठी कृपया तिकीट क्रमांकाची नोंद करा.,Please enter the ticket number for future reference.
Poshan Tracker is a project of Ministry of Women and Child Development.,पोषण ट्रॅकर हा महिला आणि बाल विकास मंत्रालयाचा प्रकल्प आहे.,POSHAN tracker is a project of the Ministry of Women and Child Development.
Digital India Corporation is the technical partner of MoWCD.,डिजिटल इंडिया कॉर्पोरेशन हे मोडब्ल्यूसीडी  चे तांत्रिक भागीदार आहे.,Digital India Corporation is the technology partner of MoWCD.
Poshan Tracker focuses on eradication of malnutrition from India.,पोषण ट्रॅकर भारतातून कुपोषण निर्मूलनावर लक्ष केंद्रित करते.,POSHAN tracker focuses on eliminating malnutrition in India.
It serves as a mechanism to monitor and improvise on the service delivery under Poshan Abhiyaan,पोषण अभियानांतर्गत सेवा वितरणावर देखरेख आणि सुधारणा करण्यासाठी हे एक यंत्रणा म्हणून काम करते,It acts as a mechanism for monitoring and improving service delivery under POSHAN Abhiyaan
Is poshan trackers app available over Apple I Store also?,अँपल आय स्टोअरमध्येही पोषण ट्रॅक अॅप उपलब्ध आहे का?,Is POSHAN TRACK APP also available on Apple iStore?
Number of records becoming inactive and number of records migrating from one category to another,निष्क्रीय होणार्या नोंदींची संख्या आणि एका श्रेणीतून दुसर्यात स्थलांतरित होणार्या नोंदींची संख्या,Number of inoperative entries and number of entries migrating from one category to another
In How many languages the Poshan Tracker App is available?,पोषण ट्रॅकर अॅप किती भाषांमध्ये उपलब्ध आहे?,How many languages is the POSHAN Tracker App available?
AWWs are requested to enter their mobile numbers in the Login screen.,एडब्ल्यूडब्ल्यू ला लॉगिन स्क्रीनमध्ये त्यांचे मोबाइल नंबर प्रविष्ट करण्याची विनंती केली जाते.,AWW is requested to enter their mobile number in the login screen.
"An OTP will be sent to your registered mobile number, post which you are required too set your MPIN.",आपल्या नोंदणीकृत मोबाइल नंबरवर एक ओटीपी पाठविला जाईल जो आपण आपला एमपीन म्हणून सेट करणे आवश्यक आहे.,"An OTP will be sent to your registered mobile number, which you will have to set as your MPIN."
Measles Containing vaccine (MCV)/MR-2JE-2**DiphtheriaPertussis & Tetanus (DPT)-Booster-1OPV –Booster,गोवर (एमसीव्ही)/एमआर-2जेई-2**घटसर्पपेर्ट्युसिस आणि टिटॅनस (डीपीटी)-बूस्टर-1ओपीव्ही - बूस्टर,Gower (MCV) / MR-2JE-2 * Ghatsarpupartosis and Tetanus (DPT) - Booster 1OPV - Booster
The Poshan Tracker enables real-time monitoring and tracking of all AWCs and beneficiaries on defined indicators.,पोषण ट्रॅकर सर्व अंगणवाडी केंद्रस् आणि लाभार्थ्यांचे रिअल-टाइम मॉनिटरिंग आणि परिभाषित निर्देशकांवर मागोवा ठेवण्यास सक्षम करते.,POSHAN tracker enables real time monitoring of all Anganwadi Centres and beneficiaries and tracking on defined indicators.
It is built using centralized data architecture that also aligns with the digital technology systems of other ministries and programs.,हे केंद्रीकृत डेटा आर्किटेक्चर वापरून तयार केले गेले आहे जे इतर मंत्रालये आणि कार्यक्रमांच्या डिजिटल तंत्रज्ञान प्रणालींशी देखील संरेखित होते.,It is built on a centralized data architecture that aligns with the digital technology systems of other ministries and programs.
The public dashboard helps to impart transparency on services delivered to beneficiaries,सार्वजनिक डॅशबोर्ड लाभार्थ्यांना दिल्या जाणार्या सेवांमध्ये पारदर्शकता आणण्यास मदत करतो,The Public Dashboard helps in bringing transparency in the services provided to the beneficiaries
Translations on the Poshan Tracker Portal & App Chabot are done by third party translators.,पोषण ट्रॅकर पोर्टल आणि एप चॅबॉट वरील भाषांतर तृतीय पक्ष अनुवादकाद्वारे केले जाते.,Translations on the POSHAN tracker portal and app chatbot are done by third party interpreters.
